name,title,url,description,score,tags
더버뮤다,2020.1월 일상들,https://blog.naver.com/lsj12599/221792872788,처음시작해보는 블로그...설레고 떨리는 첫 블로그 석준이 일끝나고 만나서 즉흥으로 이태원간날 '이태원에 위치한 더버뮤다' 외부가 너무 이뻤던 곳이다!!! 들어오자마자 보이는 풍경ㅠㅠ국내가아닌 해외에 온... ,5.0,"['분위기깡패', '분위기있는', '이국적', '분위기좋은', '프라이빗', '레스토랑', '스테이크', '샌드위치', '칵테일바', '브런치', '나들이', '재방문', '데이트', '오픈키친', '핫플레이스']"
더버뮤다,이태원 분위기 좋은 파스타 맛집 버뮤다,https://blog.naver.com/kimsewon17/221777071586,친구랑 신라호텔 체크인하고 누워서 쉬다가 배가 너무 고파서 이태원으로 넘어왔다.. 동대입구에는 맛집이 별로 없는 것 같아 분위기를 내고자 이태원에 넘어왔다. 사실 이타인가서 뇨끼랑 파스타 먹으려 했는데 위이팅... ,5.0,"['분위기깡패', '분위기있는', '이국적', '분위기좋은', '프라이빗', '레스토랑', '스테이크', '샌드위치', '칵테일바', '브런치', '나들이', '재방문', '데이트', '오픈키친', '핫플레이스']"
더버뮤다,더버뮤다,https://blog.naver.com/sssyyy_1/221791180573,"분위기 너무 좋기로 알려진 더버뮤다! 이태원 거리 초입에 위치하고 있다. 근처 콩카페에 있다가 들렀다. 분위기도 너무 좋고 음식들도 하나같이 다 맛있었다. 들어오자마자 보이는 냥냥이들에 한 번 심쿵, 은은한... ",5.0,"['분위기깡패', '분위기있는', '이국적', '분위기좋은', '프라이빗', '레스토랑', '스테이크', '샌드위치', '칵테일바', '브런치', '나들이', '재방문', '데이트', '오픈키친', '핫플레이스']"
더버뮤다,이태원맛집<버뮤다>,https://blog.naver.com/songhj7019/221802355844,친구들과 이태원 나들이~~ 파스타와 스테이크도 같이먹고싶어서 찾은 버뮤다! 식전빵이랑 같이나온 오일파스타 담백하니 너무 맛있었다 고르곤졸라피자 맛은있었지만....견과류와 건포도를 안먹는 나는 먹다가 골라내기... ,5.0,"['분위기깡패', '분위기있는', '이국적', '분위기좋은', '프라이빗', '레스토랑', '스테이크', '샌드위치', '칵테일바', '브런치', '나들이', '재방문', '데이트', '오픈키친', '핫플레이스']"
더버뮤다,"[이태원 칵테일] 수요미식회에 나온 녹사평 맛집, 더비뮤다 (솔직 후기)",https://blog.naver.com/caligraphy05/221781733166,"작년 크리스마스 쯔음 다녀온 이태원 맛집이자, 녹사평 맛집으로 유명한 더버뮤다! 자세한 후기를 남기기에 앞서 이곳은 수요미식회에 나온 명란크림파스타가 유명한 맛집입니다. 파스타가 유명한 이태원... ",5.0,"['분위기깡패', '분위기있는', '이국적', '분위기좋은', '프라이빗', '레스토랑', '스테이크', '샌드위치', '칵테일바', '브런치', '나들이', '재방문', '데이트', '오픈키친', '핫플레이스']"
더버뮤다,녹사평역 맛집 아기자기한 분위기의 더버뮤다,https://blog.naver.com/000zero000/221792867483,"지난번에 바쁘게 용산구청을 지나갈 일이 있었는데 출출하기도 했던 날, 들렸던 더버뮤다를 재방문했어요. 그 때 명란스파게티랑 와인을 함께 했었는데 짧지만 즐거운 시간을 보냈는데 이번엔 더 많은 인원들과 함께해서... ",5.0,"['분위기깡패', '분위기있는', '이국적', '분위기좋은', '프라이빗', '레스토랑', '스테이크', '샌드위치', '칵테일바', '브런치', '나들이', '재방문', '데이트', '오픈키친', '핫플레이스']"
더버뮤다,[1월 4주차] 연 휴 조 아,https://blog.naver.com/pjw9694/221787221264,Mon 비빔밥을 비빔박자로 비벼 드세요 아악..아메리 어렵게 끊었는데 다시 아메리 없이 살 수 없는 몸이 되었고.. 아니 와플집에 사과쨈+생크림 맛이 없다니 단단히 실망함 뜬금없이 이어팟 쓰고 싶어서 써 봤는데 ? 음질 왜... ,5.0,"['분위기깡패', '분위기있는', '이국적', '분위기좋은', '프라이빗', '레스토랑', '스테이크', '샌드위치', '칵테일바', '브런치', '나들이', '재방문', '데이트', '오픈키친', '핫플레이스']"
더버뮤다,"이태원, 녹사평 분위기 좋은 수요미식회 맛집 <더버뮤다>",https://blog.naver.com/parissung/221735138372,연말 느낌이 나서 설레는 12월이에요 ☺️✨ 얼마전에 다녀온 레스토랑에서 크리스마스 분위기 제대로 느끼고 왔거든요 ❤️ 음식도 맛있고 분위기도 너무 좋아서 대만족하고온 이태원 맛집 추천해요! 더버뮤다 분위기... ,5.0,"['분위기깡패', '분위기있는', '이국적', '분위기좋은', '프라이빗', '레스토랑', '스테이크', '샌드위치', '칵테일바', '브런치', '나들이', '재방문', '데이트', '오픈키친', '핫플레이스']"
더버뮤다,[이태원명란파스타맛집/스테이크맛집/분위기좋은레스토랑... ,https://blog.naver.com/thfal1221/221764045520,"#더버뮤다 #이태원맛집 #명란파스타맛집 #파스타맛집 #녹사평맛집 #스테이크맛집 #분위기좋은레스토랑 #수요미식회맛집 더버뮤다(2호점, 본점은 버뮤다트라이앵글) 영업시간: 11시-03시, 월휴무 주문한메뉴... ",5.0,"['분위기깡패', '분위기있는', '이국적', '분위기좋은', '프라이빗', '레스토랑', '스테이크', '샌드위치', '칵테일바', '브런치', '나들이', '재방문', '데이트', '오픈키친', '핫플레이스']"
더버뮤다,[녹사평맛집] 더버뮤다  쿠바느낌 물씬나는 레스토랑,https://blog.naver.com/sapphire726/221766043906,녹사평 이태원맛집 더버뮤다 이곳도 후기보고 한번 와보고싶었다 마침 집에서 가까운거리라 여기서 밥먹고 근처 베트남 콩카페 가면 코스 좋음!!!! 여행가고싶을때 이국적인 분위기의 음식점에서 대리만족 할수있을듯!!... ,5.0,"['분위기깡패', '분위기있는', '이국적', '분위기좋은', '프라이빗', '레스토랑', '스테이크', '샌드위치', '칵테일바', '브런치', '나들이', '재방문', '데이트', '오픈키친', '핫플레이스']"
더버뮤다,"*연말,데이트,맛집투어 다 좋아요 이태원 맛집 더버뮤다 THE BERMUDA",https://blog.naver.com/sky67014/221749632193,바야흐로 12월으 24일~ 크리스마스 이브라고 하는 이날 칭구들이랑 모임을 하기로 함 그렇지만 전 주 금요일 강남에 갔을때 연말+금요일 콜라보로 인하여 식당 2군데 웨이팅에 못이겨 계획에 없던 메뉴를 먹게 되어... ,5.0,"['분위기깡패', '분위기있는', '이국적', '분위기좋은', '프라이빗', '레스토랑', '스테이크', '샌드위치', '칵테일바', '브런치', '나들이', '재방문', '데이트', '오픈키친', '핫플레이스']"
더버뮤다,은히와의 경리단길 데이트,https://blog.naver.com/gih1930/221771836260,그녀와 함께했던 경리단길 나들이 레츠기릿 보다시피 목적은 올라프 카페! 였지만.. 일단 얘랑 만나면 밥부터 먹어야 해 자몽 음료에 꽂힌 라이언 넘 기엽쥬 (블로그 안 하는) 은희가 블로거는 이런 거 다 찍어야 한대서... ,5.0,"['분위기깡패', '분위기있는', '이국적', '분위기좋은', '프라이빗', '레스토랑', '스테이크', '샌드위치', '칵테일바', '브런치', '나들이', '재방문', '데이트', '오픈키친', '핫플레이스']"
더버뮤다,"더 버뮤다 이태원 맛집, 그윽한 분위기에 와인이 어울리는 곳이에요.",https://blog.naver.com/koo_juun/221774643677,"더 버뮤다 이태원 맛집, 그윽한 분위기에 와인이 어울리는 곳이에요. Previous image Next image Previous image Next image 안녕하세요. 오늘은 지난번에 말씀드렸던 것처럼 4주년을 기념해서 데이트를 했는데요. 그중에 저녁으로... ",5.0,"['분위기깡패', '분위기있는', '이국적', '분위기좋은', '프라이빗', '레스토랑', '스테이크', '샌드위치', '칵테일바', '브런치', '나들이', '재방문', '데이트', '오픈키친', '핫플레이스']"
더버뮤다,(녹사평) 더 버뮤다,https://blog.naver.com/duran1004/221711785400,내 최애 맛집 해방촌 올드나이브스에서 녹사평역 더버뮤다로 옮겨가신 매니저님 ㅜㅜ 따라서 한번 들려야지 하다가 이번에 첫방문하게 되었다 #더버뮤다 #버뮤다트라이앵글 #올드나이브스 다 같은 계열사 음식점(?)... ,5.0,"['분위기깡패', '분위기있는', '이국적', '분위기좋은', '프라이빗', '레스토랑', '스테이크', '샌드위치', '칵테일바', '브런치', '나들이', '재방문', '데이트', '오픈키친', '핫플레이스']"
더버뮤다,"[이태원, 녹사평 맛집] 우리만 알고 싶은 데이트맛집, The Bermuda... ",https://blog.naver.com/armed49/221745687957,"남자친구의 단골집이었던 이태원, 녹사평 브런치 맛집인 더 버뮤다. 이태원으로 데이트 갔는데 남자친구가 오랜만에 가보자고 해서 또 들렸습니다. 이태원 녹사평 데이트 : 남친의 단골집 The Bermuda(더 버뮤다)... ",5.0,"['분위기깡패', '분위기있는', '이국적', '분위기좋은', '프라이빗', '레스토랑', '스테이크', '샌드위치', '칵테일바', '브런치', '나들이', '재방문', '데이트', '오픈키친', '핫플레이스']"
더버뮤다,[이태원맛집 :  더 버뮤다/쿠바샌드위치 ],https://blog.naver.com/jac705/221701808080,이태원 맛집 : 더 버뮤다 영화 아메리칸 더 셰프를 보고 약 2주동안 먹고 싶었던 쿠바샌드위치 !! 정말 노래를 불렀다 ㅎㅎ 인터넷 서치 결과 가장 전통쿠바샌드위치에 가깝다는 맛집 검색!1 녹사평역에서 도보 약 7-8분... ,5.0,"['분위기깡패', '분위기있는', '이국적', '분위기좋은', '프라이빗', '레스토랑', '스테이크', '샌드위치', '칵테일바', '브런치', '나들이', '재방문', '데이트', '오픈키친', '핫플레이스']"
더버뮤다,이태원 더버뮤다/명란파스타star,https://blog.naver.com/byunny2/221745865171,매일11:00-03:00 (bar가 있어서 그런가봐요) 수요미식회에 나온 그 곳 이태원역보다는 녹사평역이 가까워요. 예약 안하고 가면 대기 가능성 커요. 메뉴판은 밑에↓ 시킨 메뉴 모두 추천!! 음식모두 남기지 않고 CLEAR... ,5.0,"['분위기깡패', '분위기있는', '이국적', '분위기좋은', '프라이빗', '레스토랑', '스테이크', '샌드위치', '칵테일바', '브런치', '나들이', '재방문', '데이트', '오픈키친', '핫플레이스']"
더버뮤다,[녹사평역/이태원] 더버뮤다,https://blog.naver.com/yeomju311/221758033272,무려 11월 9일에 갔었던 녹사평/이태원 더버뮤다 원래 민혁이네 외국포차 가고싶어서 녹사평에서 모였는데 없어졌더라.... 그래서 대충 보이는데서 밥먹고 맛있는 술 먹으러 가게 된 곳 입구 감성 7시 반쯤에 갔는데 자리... ,5.0,"['분위기깡패', '분위기있는', '이국적', '분위기좋은', '프라이빗', '레스토랑', '스테이크', '샌드위치', '칵테일바', '브런치', '나들이', '재방문', '데이트', '오픈키친', '핫플레이스']"
