name,title,url,description,score,tags
로우앤슬로우,로우앤슬로우 이태원  택사스 바베큐  (돈스파이크),https://blog.naver.com/mynamco/221803281123,죽어가는 #이태원 을 살리고 있는 #돈스파이크 씨의 #로우앤슬로우 #택사스바베큐 전문점을 다녀왔습니다 기대를 오지게 하고 도착했습니다 영업 시간은 오후5시 부터라 대기를 해야 합니다 4시 반넘어서 갔습니다... ,4.0,[]
로우앤슬로우,이태원 소고기 맛집 로우앤슬로우 돈스파이크 생일파티 다녀왔어요!,https://blog.naver.com/loveholic_/221796035233,친구들과 이태원에서 종종 노는데요. 워낙 핫플이 많은 곳이다 보니 발 디디기만 해도 흥이 올라오는 곳이죠 ㅎ 최근에는 작곡가 돈스파이크 직접 고기를 굽는다는 로우앤슬로우 LOW & SLOW에 대한 관심이 엄청 뜨겁더라구요.... ,4.0,[]
로우앤슬로우,이태원 소고기 맛집 로우앤슬로우 돈스파이크 생일 with 엑셀비프... ,https://blog.naver.com/rinvely0322/221796226615,돈스파이크 생일 in 이태원 소고기 맛집 로우앤슬로우 살면서 연예인 생일파티에 가보는 일이 얼마나 될까요? 저에게 이런 일이 있을 거라고 상상조차 해 본 적이 없는데 좋은 기회로 돈스파이크 생일 파티에 초대받아... ,4.0,[]
로우앤슬로우,이태원 돈스파이크 바베큐 맛집 ‘로우앤슬로우’ 핵짱맛!,https://blog.naver.com/scenecake/221775889387,유튭에서 하도 맛있다고 해서 가보아쯥니당 웨이팅 어마무시하다고 해서 조기퇴근 하자마자 튀오감 로우앤슬로우 : 네이버 리뷰 69 · 이태원 돈스파이크가 직접 구워주는 바베큐 naver.me 해밀튼 호텔 앞 아뉘 4시15분에... ,4.0,[]
로우앤슬로우,[이태원맛집/스테이크맛집]돈스파이크식당 : 로우앤슬로우,https://blog.naver.com/jhsince06/221738323545,안녕하세효 쩨이에요☺️ 이태원에있는 로우앤슬로우!! 너무 너무 가고싶어서 날잡고 방문했는데 문닫았더라구요 ㅠㅠ 알고보니 리뉴얼중이였어요!! 그래서 리뉴얼 끝나고 다시 재방문!! 17:30분에 오픈하는데 저는 16... ,4.0,[]
로우앤슬로우,이태원 돈스파이크 바베큐 식당 로우앤슬로우에서 먹자! - 웨이팅/가격... ,https://blog.naver.com/wnsdud7021/221733031583,안녕하세요 02입니다. 2019년이 이제 20일 정도 밖에 남지 않았습니다. 엉엉.. 이제 20년의 시대가 오고 있습니다. 얼마 남지 않은 2019년도 알차고 행복하게 보내보록 해요! 오늘 제가 다녀온 곳은 바로바로! 요즘 가장 핫한... ,4.0,[]
로우앤슬로우,[이태원] 로우앤슬로우,https://blog.naver.com/sienalis/221725392843,최애 프로 중 하나인 슈퍼맨이 돌아왔다에서 돈스파이크님이 윌벤에게 고기를 썰어주시고 편스토랑에서 돈스파이크님이 혼자 고기 굽고 지지고 볶고 요리하시는걸 보며 대단하다 생각했는데 좋아하는 사람들과 목밤... ,4.0,[]
로우앤슬로우,램스턴_이태원 로우앤슬로우 (Low & Slow) 스모커제작 #2,https://blog.naver.com/lkjunlkmin/221713155498,이태원 로우앤슬로우(Low&Slow) 제작과정 2차 포스팅입니다. 1차 포스팅에서는 현장나올 준비과정을 보여드렸습니다. 이번 포스팅은 현장에서 바베큐 스모커(smoker)가 작업되어지는 과정을 보여드릴거에요~ 결전의 그날은... ,4.0,[]
로우앤슬로우,돈스파이크 생일파티 고기에 꿀이 뚝뚝 ! 이태원 소고기 맛집 최고의 별미,https://blog.naver.com/museok27/221796463794,돈스파이크 생일파티 고기에 꿀이 뚝뚝! 이태원 소고기 맛집 최고의 별미 이태원에서 가장 유명한 로우앤슬로우 주인장인 돈스파이크가 직접 고기를 구워주는 바비큐 가게 로우앤슬로우에서 열린 돈스파이크 생일파티에... ,4.0,[]
로우앤슬로우,램스턴_이태원 로우앤슬로우 (Low & Slow) 스모커제작 #1,https://blog.naver.com/lkjunlkmin/221708753727,시간이 벌써 흘러 11월 입니다. 우연히도 이태원에 현장이 계속 잡혀서 한동안 이태원에서 시간을 보냈습니다~~ 이미 오픈을 한 로우앤슬로우 텍사스 바베큐의 스모커제작 포스팅을 하려합니다. 기존의 스모커들은... ,4.0,[]
로우앤슬로우,"이태원 돈스파이크가 운영하는 로우앤슬로우 후기/대기시간, 주차 팁",https://blog.naver.com/jenniferbeak/221732250774,"이태원 돈스파이크가 운영하는 로우앤슬로우 후기대기시간, 주차 팁 요즘 핫하다는 이태원의 돈스파이크 스테이크 레스토랑인 로우앤슬로우를 100pro 쉬는 날인 지난 월요일에 지인들과 방문했습니다 대기시간이 길 것... ",4.0,[]
로우앤슬로우,"이태원 돈스파이크 식당 로우앤슬로우, 립스 브리스킷 스테이크",https://blog.naver.com/flowe17/221753520326,"이태원역 바로 앞에 위치한 돈스파이크가 운영하는 식당, 로우앤슬로우를 방문했다. 나는 갑자기 뭔가에 홀린 듯 스테이크 스테이크 노래를 불렀고, 친구가 이태원에 텍사스 스타일의 스테이크를 파는 곳이 있다며... ",4.0,[]
로우앤슬로우,이태원 로우앤슬로우 돈스파이크 소고기 맛집 내가 먹어봄(feat.... ,https://blog.naver.com/jjaehhun/221796071797,돈스파이크가 직접 고기 구워주는 이태원 소고기 맛집 로우앤슬로우~ 입장시간 전부터 줄 서서 기다리는 곳으로 유명하죠? 일단 들어오면 고기가 살살 녹아서 워낙 회전율이 좋아 기다릴만하다고 하더라고요.^^ 그리고... ,4.0,[]
로우앤슬로우,돈스파이크 생일 이태원 로우앤슬로우 소고기는 엑셀비프(Excel... ,https://blog.naver.com/narawh/221796023951,"돈스파이크 생일 이태원 로우앤슬로우 소고기는 엑셀비프(Excel®) 완전 맛있어! 겉은 바삭, 육즙 가득한 속살은 입안에서 촉촉하게 녹아 내리고 한 입 먹는 순간 이래서 줄 서서 먹는 맛집이구나 싶더라구요. 며칠 전... ",4.0,[]
로우앤슬로우,"이태원 로우앤슬로우 후기, 돈스파이크 가게 바베큐 비주얼 실화?",https://blog.naver.com/kastia0075/221724096657,11월에 오픈한 돈 스파이크 바베큐 가게 얼마나 맛있길래 다들 난리인가 ㄷㄷ 주말에도 할 일 없이 널브러져 있던 차에 돈스파이크 바베큐 가게에 가고 싶다는 친한 동생이 먼 타지에서 서울까지 오게되어 저도 1+1로 가게... ,4.0,[]
로우앤슬로우,이태원 로우앤슬로우,https://blog.naver.com/unexpected01/221749257136,"그 유명한 로우앤슬로우 나도 가봤다. 여기 사람 너무 많더라.. 수욜 저녁에 다섯시 이십분에 갔더니, 이미 대기표를 받기 위한 줄이 늘어서있어.. 잘은 모르겠지만 일찍 와서 줄 선 사람들 일단 다 입장하고, 그담부턴... ",4.0,[]
로우앤슬로우,[이태원 바베큐]로우앤슬로우 _돈스파이크의 바베큐를 맛볼수있는곳,https://blog.naver.com/loveme1695/221706603891,LOW&SLOW 로우앤슬로우 돈스파이크의 노하우가 담긴 바베큐를 맛볼수있는곳 [연희동 바베큐] 센트그릴 _ 바베큐를 손에 꼽히게 잘하기로 소문난 곳 연희동 바베큐CENTGRILL BBQ텍사스 스모크 바베큐드디어 ! 쎈트그릴에... ,4.0,[]
로우앤슬로우,이태원 로우앤슬로우,https://blog.naver.com/tjsrud203/221719950793,[ 19. 11. 14 ] 이태원 로우앤슬로우/ 돈스파이크 로우앤슬로우 / 텍사스 바베큐하우스 / 텍사스 바베큐하우스 / 돈스파이크 텍사스 바베큐하우스 돈스파이크 스테이크 / 돈스파이크 바베큐 목요일은 나의 오프 날 신경이랑... ,4.0,[]
로우앤슬로우,연말 데이트 코스로 추천하는 훈연 스테이크 전문점 BEST3,https://post.naver.com/viewer/postView.nhn?volumeNo=27105356&memberNo=24562864&vType=VERTICAL,"연말 데이트 코스 고민이라면 분위기 좋고 맛있는 훈현 스테이크 전문점 에서 즐겨보시는 건 어떠세요?  훈연 스테이크 전문점_#준토스라티노스 이태원 분위기 좋은 스테이크 맛집 하면 가장 먼저 떠오르는 '준토스라티노스', 데이트 코스로 안성맞춤인 이곳은 다양한 스테이크와 남미 음식을 맛볼 수 있기 때문에 이색적인 곳 입니다. 24일간 숙성시켜 훈연한 프라임 스테이크는 향이 좋고 육즙 또한 꽉 차있기 때문에 스테이크만 먹어도 맛있지만 타코로 즐기면 더욱더 맛있기 때문에 준토스라티노스... ",4.0,[]
로우앤슬로우,이태원 :: 로우앤슬로우[LOW&SLOW]_돈스파이크 식당/하프앤하프... ,https://blog.naver.com/youjin8879/221802509733,드.디.어 가보고싶던 돈스파이크식당을 다녀왔어요 2월1일 토요일에 방문! 5시부터 오픈인데 3시조금넘어서 갔더니 벌써 사람들이 꽤 줄 서있더라구요 17시가까이되서 예약을받는다고 들었는데 15시30분쯤되었는데... ,4.0,[]
로우앤슬로우,돈스파이크씨 가게 로우엔슬로우에 갔다왔습니다 ㅎㅎ,https://blog.naver.com/saliormars/221637251550,인스타그램에서 돈스파이크씨가 가게를 냈다는 사실은 알고 있었습니다. 사실 작곡가시지만 그분이 고기와 스테이크(이중중첩)에 얼마나 깊은 열정을 가지고 계시는지는 잘 알죠. 가오픈기간이라고 해서 얼른... ,4.0,[]
로우앤슬로우,이태원 / 돈스파이크의 로우앤슬로우 솔직 후기,https://blog.naver.com/ftisland0913/221806640348,잇님들 오랜만이에요 :) 다들 잘 지내셨나요? 2-3주 전에 방문했던 #돈스파이크 #로우앤슬로우 방문했던 솔직한 후기를 적어볼게유 로우앤슬로우 OPEN 17:00 (재료 소진시 마감) 17:00 부터 입장 및 키오스크 대기번호 부여... ,4.0,[]
로우앤슬로우,"이태원 맛집 ""로우앤슬로우"" (돈스파이크 바베큐) 육즙 팡팡",https://blog.naver.com/sucsucsuc/221805196104,"설날 전부터 너무 먹고 싶었던 #돈스파이크바베큐 #로우앤슬로우 에 갔다 왔다 일요일이고, 코로나 바이러스로 사람이 적을 줄 알았는데 그것은 경기도 오산이었다 인터넷 기사들은 줄 서 던 식당도 썰렁하다고 난린데... ",4.0,[]
로우앤슬로우,[이태원] 돈스파이크 로우앤슬로우 바베큐 솔직 후기(+쟈니덤플링),https://blog.naver.com/mapl003/221795108558,"로우앤슬로우 지난 금요일, 퇴근을 하고 부랴부랴 이태원에 도착하여 돈스파이크가 운영하는 바베큐집 로우앤슬로우에 다녀왔다. 요즘 코로나 바이러스 때문에 사람들이 외출을 잘 하지 않아서인지 평소보다는... ",4.0,[]
로우앤슬로우,"[이태원맛집:로우앤슬로우] 예약, 원격웨이팅,가격, 이태원맛집... ",https://blog.naver.com/wndudsis/221808678636,위치 서울특별시 용산구 이태원동 127-28 2층 - 이태원역3번출구 영업시간 매일 17:00 - 23:00 17:00 재료소진시 마감 매주 화요일 휴무 웨이팅 평일기준17:40분에 도착 키오스크로 대기명단작성 -> 18:45분 입장 웨이팅Tip... ,4.0,[]
로우앤슬로우,"이태원 맛집, 돈스파이크의 로우앤슬로우",https://blog.naver.com/oja7966/221797544448,"그렇게 유명하고, 엄청난 웨이팅을 자랑하는 돈스파이크의 로우앤슬로우 방문. 평일이면 웨이팅 많지는 않겠지 하고 이태원으로 ! #이태원맛집 #로우앤슬로우 #이태원로우앤슬로우 #돈스파이크 이태원역 바로... ",4.0,[]
로우앤슬로우,"1221 소혀니와 불타는 밤 [ 로우앤슬로우 / 이태원맛집, 돈스파이크... ",https://blog.naver.com/letsgoeun0422/221798860763,지수랑 헤어지고 이태원 스벅에서 소혀니를 한없이 기다려따...... 댜기.......언제와? 사실 넷플에서 영화 몇편보니까 금방 오긴했다ㅋ 저녁을 안먹어서 머먹을까 찾아다니다가 사람들이 줄을 엄청 서있길래 우리도 그냥... ,4.0,[]
로우앤슬로우,[맛집] 이태원로우앤슬로우/ 돈스파이크 식당/ 돈스파이크스테이크... ,https://blog.naver.com/sssy6037/221802887524,안녕하세요 여러분 ~~~ 오늘은 제가 2020.02.08 방문한 이태원 로우앤슬로우 후기 적어보려구해요 !!  로우앤슬로우는 돈스파이크 식당이거등요 ㅋㅋ 예전부터 가보고 싶었는데 블로그 후기 몇개 보니까 무슨 웨이팅을... ,4.0,[]
로우앤슬로우,[서울/이태원] 이태원 돈스파이크 바베큐 식당 로우앤슬로우,https://blog.naver.com/qkrdpsk1144/221799197518,이태원 바베큐 맛집 로우 앤 슬로우 섭이 생일을 맞이해서 섭이가 평소에 꼭 가보고 싶다고 했던 이태원 '로우 앤 슬로우'를 방문했습니다! 오픈은 5시 인데 4시부터 저렇게나 줄이 길었어요! 기다리는 동안 따뜻한 육수?... ,4.0,[]
로우앤슬로우,이태원 맛집 추천 로우앤슬로우 후기 돈스파이크,https://blog.naver.com/jhjin_0702/221789957015,#이태원 #맛집 #로우앤슬로우 #돈스파이크 #로우앤슬로우후기 안녕하세요 커스입니다. 어제 주중 저녁 이태원으로 데이트를 갔다왔는데요. 그 이유는 로우앤슬로우를 가기위해서! 돈스파이크가 운영하는 바베큐 집입니다.... ,4.0,[]
로우앤슬로우,웨이팅 대박인 돈스파이크 가게! 이태원 [로우앤슬로우],https://blog.naver.com/1000_gold/221795321116,이번 서울 방문의 큰 목적 중 하나는 돈스파이크 식당인 이태원 #로우앤슬로우 먹기였어요! 제주도에서 가는거다보니 악명 높은 웨이팅에 못먹을까봐 걱정이 이만저만이 아니어뜸.. 로우앤슬로우는 이태원역 3번 4번 출구... ,4.0,[]
로우앤슬로우,이태원 로우앤슬로우,https://blog.naver.com/yeon172/221793901460,이태원 로우앤슬로우 저는 설날연휴 첫날 로우앤슬로우에 다녀왔어요! 사실 방문하게 된 이유는 로우앤슬로우 먹방 동영상을 보고 아! 가야겠다하고 바로 고고싕 여러분... 여기 웨이팅 장난없어요... 보라색 라인부터... ,4.0,[]
로우앤슬로우,이태원 돈스파이크 로우앤슬로우 4시간 웨이팅 후기,https://blog.naver.com/ccibccib/221787662532,방문일 - 20.01.24 연휴 첫날에 전부터 종종 가보자고 했던 돈스파이크가 운영하는 로우앤슬로우에 방문했다 주차는 가게에 할 곳이 없어서 근처 공영주차장을 이용해야된다 이태원 로우앤슬로우 돈스파이크가 운영하고... ,4.0,[]
로우앤슬로우,[내돈내산] 이태원 맛집 돈스파이크 바베큐 식당 로우앤슬로우 솔직후기,https://blog.naver.com/dmsquf2225/221777053580,여러분 하이욤! 생일에 다녀온 돈스파이크 식당 로우앤슬로우 후기를 들고왔슴당ㅎㅎ 생일이랑 서울 순천향병원에서 실습이 겹치는 바람에...쥬륵... 이태원에서 생일을 보내게 되었어욤 광주에서 이태원까지 와준 내... ,4.0,[]
로우앤슬로우,"이태원 로우앤슬로우 , 세시간 웨이팅하고 먹어본 솔직후기",https://blog.naver.com/namh_22/221787128577,돈스파이크 식당 로우앤슬로우 오픈하기전부터 줄 선다길래 4시 40분에 갔는데 줄 엄청 길었음^^ 도대체 얼마나 맛있길래 하고 기다려봄 한시간을 추위에 떨며 기다려서 대기표를 받을 수 있었음ㅋㅋㅋㅋㅋㅋ 하아... 직원은... ,4.0,[]
로우앤슬로우,서울 이태원 로우앤슬로우 먹부림,https://blog.naver.com/tkznal32/221777069644,이태원 로우앤슬로우 갔다!! 어마어마한 웨이팅을 뚫고~~ 5시오픈인데.... 친구가 먼저 3시반부터 줄서서.. 웨이팅 19번 안착!!! 5시 땡되야 웨이팅을 할수가 있기에~~ 웨이팅걸어놓으면 알람이 카톡으로 옴! 우리는 근처... ,4.0,[]
로우앤슬로우,[이태원/이태원맛집] 로우앤슬로우 텍사스바베큐 돈스파이크 식당... ,https://blog.naver.com/yoochanwoo96/221785871112,1월15일은 제 생일이라 이태원까지 가서 데이트를 했어요. 벼르고 벼르던 '로우앤슬로우' 서울 용산구 보광로 126 매일 17:00 - 23:00 / 재료소진시 마감 매주 화요일 휴무 5시부터 번호표를 뽑을 수 있어서 4시에 미리 줄을... ,4.0,[]
로우앤슬로우,이태원 돈스파이크 식당 로우앤슬로우 웨이팅 더 길어짐/샐러드바,https://blog.naver.com/qkrxodud2004/221786577232,"새해 복 많이 받으세요! 저는 설연휴에 이태원 도스파이크 식당으로 유명한 로우앤슬로우 low & slow 에 다녀왔어요. 설연휴라서 영업을 안 할 줄 알았는데 27일, 28일에 쉬는 대신 설연휴 내내 문을 열었더라고요. 저는 미리... ",4.0,[]
로우앤슬로우,[이태원역 3번출구] 로우앤슬로우 메뉴/식당내부/웨이팅/대기/솔직후기... ,https://blog.naver.com/loveneverfails22/221786744853,"안녕하세요 나누미에요 :) 오늘은 이태원 핫플 돈스파이크네 스테이크집이 그렇게 맛있다고 하길래 다녀온 썰 들려드리려고 해요! 로우앤슬로우 오픈이 오후 5시인데, 제가 5시 10분쯤 도착했을 때에는 이미 에머이... ",4.0,[]
로우앤슬로우,[이태원] 돈스파이크 텍사스식 바베큐 로우앤슬로우 맛집 존맛!,https://blog.naver.com/1028chuchu/221786998070,안녕하세요 심술연입니다! 지난주에 갔다온 이태원 인기 맛집!! 돈스파이크분이 운영하시는 로우앤슬로우 바베큐점을 소개해 드리겠습니다! >.< 돈스파이크가 운영하는 로우앤슬로우 오픈 17:00~마감 23:00 화요일 휴무... ,4.0,[]
로우앤슬로우,이태원역 :: 돈스파이크가 직접 운영하는 로우 앤 슬로우 !,https://blog.naver.com/yamjoon/221783543790,"안녕하십니까 : ) 얌준입니다. 요즘 여가시간에 틈틈히 하는 것중에 하나가 유튜브를 보면서 노는 게 다인데, 요즘 고기에 대한 관심이 생겨서 고기관련 유튜브를 많이 보곤 했었습 니다. 그러던 중 우연찮게 가수... ",4.0,[]
로우앤슬로우,돈스파이크 식당 이태원 로우앤슬로우 웨이팅엄청나네;,https://blog.naver.com/xoxohit/221755356016,"티비 방송에서 꽤 많이 보이던 돈스파이크의 고기 사랑. 고기 굽기 장인이라며 정말 고기를 사랑하는 고기러버구나 생각을 했었는데, 얼마전 인스타에서 돈스파이크 식당 이라며 바베큐 맛있다고 난리더니 짝꿍이 가고... ",4.0,[]
로우앤슬로우,서울이태원 머리카락없는맛집 로우앤슬로우 리뷰 궁금하면 따라와봐여~,https://blog.naver.com/hairnalds/221787653002,안녕하세요 잘지냈죠??? 항상행복하세요 힘내시구요!!!!! 오늘은 요즘 가장 핫하다는 서울 이태원 맛집 탕방을 해보았어요~~ 일단 맛집을 가기전에 폭풍 검색을 통해서 5시부터 오픈이고 4시전에는 줄을 서야된다!!! 라는걸... ,4.0,[]
로우앤슬로우,돈스파이크 스테이크,https://blog.naver.com/bestofqueen1/221785938240,#돈스파이크 #돈스파이크로우앤슬로우 #돈스파이크스테이크 #이태원로우앤슬로우 #이태원맛집 #돈스파이크음식점 #이태원먹거리 #로우앤슬로우예약방법 #돈스파이크가게예약방법 #이태원맛집#이태원돈스파이크식당... ,4.0,[]
로우앤슬로우,"이태원 맛집 - ""로우앤슬로우"" 방문 후기!",https://blog.naver.com/tjdbrud2116/221785255652,"설날에 이태원 나들이!! 이태원에 가면 꼭 먹어보고 싶었던 돈스파이크 텍사스 바비큐!!!! 오늘 드디어 그토록 가고 싶었던 ""로우앤슬로우""를 방문하러 갔어요 ㅎㅎ 로우앤슬로우 매장은 매일 17:00에 오픈을 하고 23:00에... ",4.0,[]
로우앤슬로우,[이태원 맛집] 로우앤슬로우 솔직 후기,https://blog.naver.com/sonalsdk/221778226733,#이태원 #서울맛집 #이태원스테이크 #이태원고기 #이태원분위기 #서울분위기 #돈스파이크스테이크 안녕하세요~ 어제는 이태원 핫플 #로우앤슬로우 방문후기를 남겨볼까해요 자세한위치는!! 이태원역 3번출구에서 나오시면... ,4.0,[]
로우앤슬로우,[이태원맛집] 돈스파이크 스테이크 얼마나맛있크?,https://blog.naver.com/bananaboutique/221775236578,여러분안녕하세여~~~ 점심시간이 다가오니까 배가 고프네요.. 그래서 쓰는 맛집소개입니다ㅎㅎㅎ 1월부터 다들다이어트를 시작하신분들이 많을텐데 나는먹겠다... 이태원의 돈스파이크 님이 하시는 스테이크식당으로... ,4.0,[]
로우앤슬로우,"이태원 맛집 : 돈스파이크 로우앤슬로우 주말 웨이팅, 가격대, 메뉴",https://blog.naver.com/rorellray/221776582559,"돈스파이크씨가 있느냐? 있습니다! (주말 저녁 기준) 텍사스에 여행온 느낌 그대로! 텍사스 바베큐 촵촵! <웨이팅> 먼저 저희는 2020.1.18 오후 3:30 부터 줄을 섰구요. 주말기준 51명 대기중이라, 26번째 팀이었습니다. 오후... ",4.0,[]
로우앤슬로우,"이태원 맛집 : 돈스파이크 식당, 로우앤슬로우",https://blog.naver.com/wa_micha/221758571536,"이태원 맛집, 돈스파이크가 운영하는 로우앤슬로우(LOW & SLOW) BY. Aden 돈스파이크가 운영하는 식당으로 유명한 로우앤슬로우에 기회가 되어 방문해봤다. 토요일 오후 추운날 4시 30분쯤 갔더니 웨이팅이 이미 어마어마하게... ",4.0,[]
로우앤슬로우,이태원 로우앤슬로우 25만원어치 먹은 후기,https://blog.naver.com/asskkk/221761897652,이태원 초역세권에 위치한 로우앤슬로우 #돈스파이크식당 으로 유명한 곳 4시부터 웨이팅 줄 세운다기에 3시부터 만나서 간 그곳..! 저희는 총 6명으로 교대로 줄 섰어요 4시 10분쯤부터 줄서서 저는 5시10분 타자였는데... ,4.0,[]
로우앤슬로우,이태원역 맛집 :: 비주얼 실화?! 돈스파이크가 직접 고기를... ,https://blog.naver.com/lovely_ilu/221752458575,요즘 완전 핫하다는 돈스파이크 스테이크 맛집 이태원 로우앤슬로우에 파나나와 남자1이 다녀왔습니다! 자타공인 프로고기러들의 스테이크 도장 깨부시기!!! #이태원맛집 #이태원스테이크 #이태원연말모임... ,4.0,[]
로우앤슬로우,[이태원역 리얼 맛집] 돈스파이크님께서 운영하는 로우앤슬로우... ,https://blog.naver.com/happy_memories_s2/221774601580,기다리고 기다렸던 로우앤슬로우 방문기 짝지가 작년부터 가자고 가자고 노래불러서 가려고 했을땐 가오픈기간이 다 끝나버려서 못갔다 ㅠㅠ 하지만 오늘은 로우앤슬로우를 위해 작정한 날!!!! 점심부터 이태원을 거닐며... ,4.0,[]
로우앤슬로우,"[이태원] 돈스파이크가 운영하는 스테이크&립 맛집 ""로우앤슬로우""",https://blog.naver.com/dw5735/221754538862,"안녕하세요. 미야입니다. 오늘은 돈스파이크가 운영하는 이태원 ""로우앤슬로우""입니다. 오픈시간이 오후 5시 30분인 로우앤슬로우! 이미, 유튜브에도 돈스파이크가 운영하는 스테이크&립으로 잘 알려져 있습니다. 이태원 3번... ",4.0,[]
로우앤슬로우,이태원 로우앤슬로우 돈스파이크 바베큐식당 즐기기,https://blog.naver.com/mimiwellcom/221748811919,이태원 떠오르는 핫플 돈스파이크 바베큐식당 로우앤슬로우 제가 다녀왔습니다! 대기가 엄청나다는 소리는 들었는데 역시나 사람들이 엄청 많더라구요ㅠ 그래도 오픈 초기때보다는 그나마 덜한듯했습니다ㅎㅎㅎ 이태원역... ,4.0,[]
로우앤슬로우,“이태원 돈스파이크 바비큐 식당 로우앤슬로우”,https://blog.naver.com/dltpfl11/221758758257,안녕하세요~ 여러분 세리입니다. 벌써 2019년이 가고 2020년이 된지 3일이 되었네요! 다들 2020년은 어떻게 보내고 있나요? 한살 한살 먹어도 특별한 일은 딱히 별로 없는 것 같아요. 오늘 제가 다녀온 곳은 바로 요즘 핫한 식당... ,4.0,[]
로우앤슬로우,돈스파이크 스테이크 로우앤슬로우 가격 후기,https://blog.naver.com/divineimc/221766494631,돈스파이크가 야심차게 준비하여 운영하는 돈스파이크 스테이크 하우스 로우앤슬로우 지난 금요일에 방문했는데 역시 셀럽이라 그런지 사람들이 가득차있었고 대기를 했어야 했다. 7시 정도에 갔지만 얄짤없이... ,4.0,[]
로우앤슬로우,이태원 핫플레이스 돈스파이크의 바베큐가게 로우앤슬로우!... ,https://blog.naver.com/soonzzi1120/221738139939,돈스파이크네 돈스테이크 먹으러간다고 말해야되는데 자꾸 돈스테이크네 돈스파이크먹으러간다고말함 ㅁㅣ춰버리겠네 ㅋㅋㅋㅋㅋㅋㅋㅋㅋㅋㅋㅋㅋㅋㅋ 돈스파이크가 운영하는 #로우앤슬로우 갔다왔ㅇㅓ여! 현재시간... ,4.0,[]
