name,title,url,description,score,tags
모터시티,녹사평역 모임장소! 이태원모터시티 (MOTOR CITY),https://blog.naver.com/angel-yoni/221794981805,녹사평역 모임장소! 이태원모터시티 (MOTOR CITY) 오랜만에 이태원 모임! 날씨 화창하고 좋은날 모였다+_+ 역시나 오늘도 맛집투어를 목표로하고 부지런히 움직여서 녹사평역으로 고고! 이태원모터시티는 이태원 모임장소로도... ,5.0,"['친절한', '이국적', '분위기좋은', '심플한', '세련된', 'tv방영', '피맥', '피자', '수박맥주', '파스타', '나들이', '재방문', '데이트', '자극적인', '핫플레이스']"
모터시티,이태원 녹사평역 모터시티,https://blog.naver.com/erincha98/221792981584,녹사평역 근처에 있는 모터시티 피자맛집이라고 예전부터 봐둔 곳이었다 수요미식회에도 나온 식당이란다 메뉴 Fries with queso 14900 얇고 바삭한 감자튀김이었다 퀘소 소스에 베이컨이랑 고수가 들어가있다 양이... ,5.0,"['친절한', '이국적', '분위기좋은', '심플한', '세련된', 'tv방영', '피맥', '피자', '수박맥주', '파스타', '나들이', '재방문', '데이트', '자극적인', '핫플레이스']"
모터시티,"[이태원 맛집] 분위기 좋고 맛있는 피자 맛집, 모터시티 솔직한 리뷰",https://blog.naver.com/dichterin_8/221779894711,이태원 피자맛집 <모터시티> 먼 대구에서 온 친구를 데리고 서울의 핫함을 보여주기 위해 이태원으로 데려갔다 최근에 계~속 맛있는 피자가 먹고 싶었는데 마침 이태원에 간 김에 피자 맛집을 찾아 가야 겠다는 생각을... ,5.0,"['친절한', '이국적', '분위기좋은', '심플한', '세련된', 'tv방영', '피맥', '피자', '수박맥주', '파스타', '나들이', '재방문', '데이트', '자극적인', '핫플레이스']"
모터시티,수요미식회가 인정한 이태원 피자 맛집! 모터시티,https://blog.naver.com/moka07/221785197060,요즘 이태원 쪽으로 나들이를 잘 댕겨오는데요 갈 때마다 뭘 먹어야하나 엄청나게 고민하게 된답니다. 워낙 먹을 곳이 많아 생긴 행복한 고민! 요상하게도 갈 때마다 피자가 떙겨 이태원 근처 피자맛집을 찾아... ,5.0,"['친절한', '이국적', '분위기좋은', '심플한', '세련된', 'tv방영', '피맥', '피자', '수박맥주', '파스타', '나들이', '재방문', '데이트', '자극적인', '핫플레이스']"
모터시티,[이태원/맛집] 피자 맛탱 버섯튀김 존맛탱 ‘모터시티’,https://blog.naver.com/lovesome321/221788004256,이태원에 가면 왠지 핏짜를 먹어줘야 할 넉낌 피자 맛집을 검색하다 발견한 모터시티 근데 역삼 잠실 모터시티도 있다네???????? 다음엔 역삼이나 잠실로 가봐야지 대표 베스트 메뉴 잭슨5 피자 콜렉! 비주얼 미쳤다리... ,5.0,"['친절한', '이국적', '분위기좋은', '심플한', '세련된', 'tv방영', '피맥', '피자', '수박맥주', '파스타', '나들이', '재방문', '데이트', '자극적인', '핫플레이스']"
모터시티,이태원 녹사평역 맛집 :: 수요미식회 피자 맛집 모터시티,https://blog.naver.com/anstjdgml12/221784284024,"안녕하세요 여러분:) 오늘은 이태원 맛집 포스팅이예요! 모터시티라는 피자맛집이랍니다:) 백종원의 3대천왕에도 나왔던 곳이고, 생방송 모닝와이드에도 방영되었을 정도로 검증된 맛집이예요! 메뉴가 잘 안보이긴 하지만... ",5.0,"['친절한', '이국적', '분위기좋은', '심플한', '세련된', 'tv방영', '피맥', '피자', '수박맥주', '파스타', '나들이', '재방문', '데이트', '자극적인', '핫플레이스']"
모터시티,이태원 맛집_<모터시티>,https://blog.naver.com/jeonyulyul/221791239066,오래 전부터 가보겠다고 다짐한 “모터시티” 디트로이트 스타일의 피자로 유명한 맛집이다. 흔히 동그란 도우 위에 토마토 소스와 토핑을 올리는게 우리가 아는 피자이지만 디트로이트에서는 네모난 도우에 피자 소스를... ,5.0,"['친절한', '이국적', '분위기좋은', '심플한', '세련된', 'tv방영', '피맥', '피자', '수박맥주', '파스타', '나들이', '재방문', '데이트', '자극적인', '핫플레이스']"
모터시티,191028. 이태원 모터시티,https://blog.naver.com/thumb_notmine/221800544860,"카메라를 다시 꺼내 들었다. 어릴 때 때를 써서 카메라를 샀는데, 거의 한 10년을 묵혀둔 것 같다. . . . . 기본 콤비네이션 피자였던 것으로 추정. 피자는 솔직히 맛있었다고 말할 수 있지만, 맛있었다고 말할 수도 없었다.... ",5.0,"['친절한', '이국적', '분위기좋은', '심플한', '세련된', 'tv방영', '피맥', '피자', '수박맥주', '파스타', '나들이', '재방문', '데이트', '자극적인', '핫플레이스']"
모터시티,200127 피자 먹기 힘든 약속,https://blog.naver.com/posthing/221787995018,"정*원, 권*현, 정*현과 함께한 피자파티! 작년 12월에 만났지만 26일에 생일인 누군가와 이번 주에 출국하는 나를 위해 또 한번 뭉쳤다. 적어도 1년에 한번은 만나는 모임인데, 마지막까지 얼굴 보고 가서 좋고 만날 수 있음에... ",5.0,"['친절한', '이국적', '분위기좋은', '심플한', '세련된', 'tv방영', '피맥', '피자', '수박맥주', '파스타', '나들이', '재방문', '데이트', '자극적인', '핫플레이스']"
모터시티,2019 연말,https://blog.naver.com/ebi74/221760155465,12월 21일 토요일. 단쓰 송년회가 있던 날. 곱 언니도 함께할 예정이었으나 본가 내려갈 일이 생겨서 신년회를 기약하며 떠났고..★ 남은 사람들만 이태원 모터시티에 모였다. 역시 믿고 가는 뽕 언니 픽 맛집! 감튀 파스타... ,5.0,"['친절한', '이국적', '분위기좋은', '심플한', '세련된', 'tv방영', '피맥', '피자', '수박맥주', '파스타', '나들이', '재방문', '데이트', '자극적인', '핫플레이스']"
모터시티,이태원 피자 모터시티 수요미식회,https://blog.naver.com/mtuo/221770430044,2019.08.17.토 이태원 프리덤~ 아 녹사평 프리덤~ 역을 볼때마다 해리포터 학교 계단 생각나는건 저뿐인가요 오홍 전경일세 그냥 지하철역에 오면 되게 여행온 느낌이 든다. 갑자기 관광객마인드 메뉴판 오늘은 우리 피자... ,5.0,"['친절한', '이국적', '분위기좋은', '심플한', '세련된', 'tv방영', '피맥', '피자', '수박맥주', '파스타', '나들이', '재방문', '데이트', '자극적인', '핫플레이스']"
모터시티,"이태원, 녹사평 피자 맛집 - 모터시티 (MOTOR CITY)",https://blog.naver.com/jongeun0124/221777146688,모터시티 (MOTOR CITY) 주소 : 서울 용산구 이태원로 140-1 2층 영업시간 : 월-토 11:30 - 22:30 / 일 11:30 - 22:00 영업시간 변동이 있을 수 있으니 확인해주세요 :) 2층에 위치 팝콘이가 맛있다고 완전 추천하길래 궁금해서 다녀온... ,5.0,"['친절한', '이국적', '분위기좋은', '심플한', '세련된', 'tv방영', '피맥', '피자', '수박맥주', '파스타', '나들이', '재방문', '데이트', '자극적인', '핫플레이스']"
모터시티,[이태원] MOTOR CITY : 모터 시티,https://blog.naver.com/jjangda87/221784312292,:: 수요미식회에 나온 맛집이에요. 이태원은 평일이 답인가요! 무슨 일인지 사람도 별로 없고 평온 :) 공사 중인 건물 옆이고 2층에 위치해 있어 눈에 띄는 곳은 아니에요. :: 잭슨 파이브 피자를 주문했어요. 크기는... ,5.0,"['친절한', '이국적', '분위기좋은', '심플한', '세련된', 'tv방영', '피맥', '피자', '수박맥주', '파스타', '나들이', '재방문', '데이트', '자극적인', '핫플레이스']"
모터시티,이태원맛집:모터시티/수요미식회 피자맛집/연말모임장소추천,https://blog.naver.com/baguette82/221749974298,수요미식회 피자맛집으로도 소개됐었던 디트로이트스타일의 피자로 유명한 모터시티 주차장이 없으니 도로변 공영주차장 또는 인근 유료주차장 이용할것 도로변 건물 2층에 자리잡고 있다 안으로 들어가면 주말밤답게... ,5.0,"['친절한', '이국적', '분위기좋은', '심플한', '세련된', 'tv방영', '피맥', '피자', '수박맥주', '파스타', '나들이', '재방문', '데이트', '자극적인', '핫플레이스']"
모터시티,"이태원 모터시티, 수요미식회 피자맛집(feat.프렌치프라이)",https://blog.naver.com/fruit0303/221774603946,쨔아안 응디랑 오랜만에 만나서 이태원 갬성있는 피자맛집에 다녀왔다 그 이름하여 모터시티! 응디가 딱 알아서 여기 유명하다고 해서 와봤는뎅 진짜 힙했다!!!!! 최고!!!!!!!!!!!!!!!! >ㅇ< 모터시티 서울 용산구 이태원로... ,5.0,"['친절한', '이국적', '분위기좋은', '심플한', '세련된', 'tv방영', '피맥', '피자', '수박맥주', '파스타', '나들이', '재방문', '데이트', '자극적인', '핫플레이스']"
모터시티,[맛집/이태원] 모터시티 피자~~,https://blog.naver.com/kja1479/221808822499,맛집이라는 소문을 듣고 다녀왔는데 울아들램들은 싸구려 입맛인걸로...ㅋㅋㅋ 고급스럽고 맛은 있었지만 짠 느낌이 많이 났고 가격도 비싼듯... 그래도 맛집인 곳을 다녀왔다는거...^^ 감자튀김은 맛있었다... 소스도... ,5.0,"['친절한', '이국적', '분위기좋은', '심플한', '세련된', 'tv방영', '피맥', '피자', '수박맥주', '파스타', '나들이', '재방문', '데이트', '자극적인', '핫플레이스']"
모터시티,이태원 모터시티,https://blog.naver.com/yoonyeomini/221782260796,이태원 모터시티 아주 맛있는 피자를 판다길래 종로에서 먼길을 떠난 우리들... 일단 앞에 7팀 대기에 눈물 30분정도 기다려야 된다길래 춥지만 기대하고 기다렸다 우리가 시킨건 페페로니 19.8 쉬림프 파스타 19.8... ,5.0,"['친절한', '이국적', '분위기좋은', '심플한', '세련된', 'tv방영', '피맥', '피자', '수박맥주', '파스타', '나들이', '재방문', '데이트', '자극적인', '핫플레이스']"
모터시티,이태원 피자맛집을 찾아서,https://blog.naver.com/bulppak/221772416876,오늘은 이태원에서 피자 맛있는 집 모터시티를 가게 됐어요. 이태원은 언제 가도 항상 설레고 젊어지는 곳이죠. 맛있는 집도 너무 많아서 갈 때마다 고민하게 되는데 오늘은 정말 피자가 떙겨서 피자 맛집 모터시티를 폭풍... ,5.0,"['친절한', '이국적', '분위기좋은', '심플한', '세련된', 'tv방영', '피맥', '피자', '수박맥주', '파스타', '나들이', '재방문', '데이트', '자극적인', '핫플레이스']"
모터시티,[친구들/이태원/모터시티/탄탈라이즈/몽키숄더/포차],https://blog.naver.com/aqwjs1027/221786114361,"모처럼 셋이서 이태원에 왔는데 빨간날이라,,그런가 다들 줄이 어마어마ㅠㅠ 단골집 앞까지 갔는데 웨이팅이 말도안되서 모터시티 와부림 1.24 #이태원 #모터시티 #피자 녹사평역이 훨신 가까움!! 그치만우린... ",5.0,"['친절한', '이국적', '분위기좋은', '심플한', '세련된', 'tv방영', '피맥', '피자', '수박맥주', '파스타', '나들이', '재방문', '데이트', '자극적인', '핫플레이스']"
모터시티,[이태원/피자]모터시티,https://blog.naver.com/iyeni/221791458099,예지랑 보노보노랑 같이 갔던 이태원 텍사스 피자집 모터시티! 도보 길찾기 '녹사평역 6호선 3번출구'에서 '모터시티'까지 kko.to 녹사평역 6호선 3번 출구에서 도보로 4분 이태원역에서 걸어가면 5분~!~!~!! 그게 그거에요... ,5.0,"['친절한', '이국적', '분위기좋은', '심플한', '세련된', 'tv방영', '피맥', '피자', '수박맥주', '파스타', '나들이', '재방문', '데이트', '자극적인', '핫플레이스']"
모터시티,녹사평역 모터시티,https://blog.naver.com/hyelim___/221773767199,안녕하세요. 어제 떵어니님이랑 녹사평에서 만났습니다. 용산구의 자랑 녹사평 에스컬레이터. 좋아합니다. 외국인들이 인상깊어한다고 들었습니다. 예전에 자살방지 커튼이 없었는데 2년 만이 왔더니 생겼더라고요.... ,5.0,"['친절한', '이국적', '분위기좋은', '심플한', '세련된', 'tv방영', '피맥', '피자', '수박맥주', '파스타', '나들이', '재방문', '데이트', '자극적인', '핫플레이스']"
모터시티,이태원 모터시티 :: 네모난 디트로이트 스타일 피자,https://blog.naver.com/onionbabe/221719416217,"모터시티 이태원 피자 맛집 느지막한 주말 점심, 가족끼리 이태원으로 향했어요. 날씨가 추워지니 아기랑 야외활동이 어려워서 아침에 게으름을 피우다 집 청소를 마치고 점심시간이 지난 애매한 시간에 밖으로... ",5.0,"['친절한', '이국적', '분위기좋은', '심플한', '세련된', 'tv방영', '피맥', '피자', '수박맥주', '파스타', '나들이', '재방문', '데이트', '자극적인', '핫플레이스']"
모터시티,이태원.모터시티피자,https://blog.naver.com/chloe-k/221788230628,공휴일 웨이팅 한시간 해서 들감. 피자 특이하고 예쁘고 비쌈. 서빙해주는 분들이 이태원답게 외국인도 계심. 말해뭐하지..? 저런건 걍 다 맛있음. 친구들은 맥주마실수있어서 좋겠다 나도 피맥하고싶다ㅠㅠ 저 이태원맥주... ,5.0,"['친절한', '이국적', '분위기좋은', '심플한', '세련된', 'tv방영', '피맥', '피자', '수박맥주', '파스타', '나들이', '재방문', '데이트', '자극적인', '핫플레이스']"
모터시티,이태원 피자 맛있는 곳 모터시티,https://blog.naver.com/vmflwk623/221761349442,오늘은 이태원에서 피자 맛있는 집 모터시티를 가게 됐어요. 이태원은 언제 가도 항상 설레는 곳이죠. 맛있는 집도 너무 많아서 갈 때마다 고민하게 되는데 오늘 제 배는 피자가 떙겨서 피자 맛집 모터시티를 가게 됐어요.... ,5.0,"['친절한', '이국적', '분위기좋은', '심플한', '세련된', 'tv방영', '피맥', '피자', '수박맥주', '파스타', '나들이', '재방문', '데이트', '자극적인', '핫플레이스']"
모터시티,이태원맛집. 이태원피자. 모터시티. 한강진카페. 데일리. 일상. 영화... ,https://blog.naver.com/ss_17/221757244910,요즘 자주 가는 #이태원 #이태원피자#이태원맛집#모터시티 이태원 워낙 맛집 많다던데 저는 그냥 가던데만 가는 스탈이라~~ 녹사평에서 바로 요기로 갔어요 #모터시티메뉴 . 연말에 갔어서 그런지 사람 바글바글 다행히 저... ,5.0,"['친절한', '이국적', '분위기좋은', '심플한', '세련된', 'tv방영', '피맥', '피자', '수박맥주', '파스타', '나들이', '재방문', '데이트', '자극적인', '핫플레이스']"
모터시티,[이태원맛집] 모터시티,http://store.naver.com/cafeRedirect?cafeUrl=ec0561a91dd6384dba35bc96306539b536df719b6595387d6bb17f93f532f364d554787b6ef032312d67f304a5942eaf&query=38331689,안녕하세요. 카통령입니다! 오늘 제가 소개할 맛집은 서울 용산구 이태원에 위치한모터시티이라는 맛집 입니다. 서울특별시 용산구 이태원로 140-1 / 이태원동 56-30 모터시티는 이태원역이랑 녹사평역 사이 대로변 건물... ,5.0,"['친절한', '이국적', '분위기좋은', '심플한', '세련된', 'tv방영', '피맥', '피자', '수박맥주', '파스타', '나들이', '재방문', '데이트', '자극적인', '핫플레이스']"
모터시티,[용산구 이태원]모터시티 - 이태원 피플을 사로잡은 디트로이트 스타일 피자,http://store.naver.com/cafeRedirect?cafeUrl=ec0561a91dd6384dba35bc96306539b55d689cb682896a21853e27371dfd0d9dff7a6b414d45177e426e870408b805a6&query=38331689,,5.0,"['친절한', '이국적', '분위기좋은', '심플한', '세련된', 'tv방영', '피맥', '피자', '수박맥주', '파스타', '나들이', '재방문', '데이트', '자극적인', '핫플레이스']"
