name,title,url,description,score,tags
오아시스,[한남] 진짜 너무 맛있어서 소리지르고 싶은 한남동 브런치 맛집... ,https://blog.naver.com/wooes2/221810962135,"갑자기 브런치에 꽂혀서 다녀온 오아시스 한남점 원래 그랜드뮤즈 가려고 했었는데, 웨이팅이 너무 길다고 하길래 급하게 노선을 틀었다 약간 굴뚝같이 생긴 오아시스 한남 사실 여기도 한 20분 정도 기다렸다 오후 2시에... ",4.0,"['따뜻한느낌', '이국적', '친절한', '심플한', '치킨', '오믈렛', '케이크', '샌드위치', '브런치', '핫플레이스', '나들이']"
오아시스,한남동 브런치 맛집 오아시스 다녀온 후기,https://blog.naver.com/bih931128/221802155759,한남동 브런치 맛집 오아시스 방문 후기 한남동 브런치로 유명한 오아시스다녀왔다 오아시스는 청담점과 한남점 두군데가 있음! 한남동 브런치 맛집 오아시스는 브레이크 타임 없이 운영되고 있다 평일 9:00 ~20:00 시 까지... ,4.0,"['따뜻한느낌', '이국적', '친절한', '심플한', '치킨', '오믈렛', '케이크', '샌드위치', '브런치', '핫플레이스', '나들이']"
오아시스,[이태원] 오아시스 - 한남동 브런치 / 이태원 브런치,https://blog.naver.com/juhun000/221758263061,#한남동 #이태원 #한남동브런치 #이태원브런치 #브런치카페 #호두바나나팬케익 #팬케익 #치킨아보카도샌드위치 #에그베네딕트 #오아시스 #영업시간 월 ~ 토 09:00 ~ 20:00 일요일 09:00 ~ 18:00 #브레이크타임 없음 #주차 가능... ,4.0,"['따뜻한느낌', '이국적', '친절한', '심플한', '치킨', '오믈렛', '케이크', '샌드위치', '브런치', '핫플레이스', '나들이']"
오아시스,한남동 카페 브런치 맛집 오아시스 한남 두번 방문 평일 추천!,https://blog.naver.com/nr_factory/221756723146,"OASIS CAFE BRUNCH 한남동 오아시스 카페 예쁘고 맛있어 글, 사진 그레이홈 @greyhome_ 프리랜서의 장점은 시간 분배를 내 맘대로 할 수 있다는 것 ! 평소 가고싶었던 카페에 갔다. 어쩜 여긴 문 색깔도 내취향일까 발렛 주차비... ",4.0,"['따뜻한느낌', '이국적', '친절한', '심플한', '치킨', '오믈렛', '케이크', '샌드위치', '브런치', '핫플레이스', '나들이']"
오아시스,한남동 / 오아시스(맛과 분위기 모두 마음에 들어 계속 찾게되는... ,https://blog.naver.com/moongqi/221722208635,오아시스 한남점. - 일상글을 쓰다보니 얼마나 많은 맛집들을 따로 포스팅 하지 않고 미루어 왔는지 깨달았다. 인지를 한 이상 오아시스 한남점이랑 펄쉘 청담점부터 포스팅하고 일상글로 넘아가야 속이 시원할 것 같아서... ,4.0,"['따뜻한느낌', '이국적', '친절한', '심플한', '치킨', '오믈렛', '케이크', '샌드위치', '브런치', '핫플레이스', '나들이']"
오아시스,한남동 오아시스,https://blog.naver.com/ina0618/221760955059,제가 자주가는 애정하는 브런치 카페 한남동 ‘오아시스’ 에요 ! 청담에도 있는데 저는 개인적으로 한남점이 더 좋아요:) 건물이나 인테리어가 더 예쁘거든요 ...  저는 어딜가든 항상 창가자리에 앉는걸 선호해요... ,4.0,"['따뜻한느낌', '이국적', '친절한', '심플한', '치킨', '오믈렛', '케이크', '샌드위치', '브런치', '핫플레이스', '나들이']"
오아시스,"아침 9시 오픈하는 브런치카페, 오아시스 한남점",https://blog.naver.com/ssilly/221706610201,쌀쌀한 아침 10시 조식을 거르고 나온 차가운 몸뚱이를 녹일 공간이 필요하다 이렇게 이른시간에 커피는 물론이거니와 곯는 배도 알차게 채울 수 있다면 당장 가봐야지. 제일기획 맞은편으로 약간 경사진 곳을 오르면... ,4.0,"['따뜻한느낌', '이국적', '친절한', '심플한', '치킨', '오믈렛', '케이크', '샌드위치', '브런치', '핫플레이스', '나들이']"
오아시스,오아시스 한남점 (브런치 맛집),https://blog.naver.com/song_of_mh/221722906041,#오아시스 한남점 아침 9시에 여는 브런치 가게 찾기 힘든데 음식이 맛있고 커피맛도 괜찮고 분위기까지 좋아서 갈 수 밖에 없는 곳이다. 한달만에 갔더니 감나무 잎이 다 떨어져버렸다. 11시 전에는 1층만 열어서... ,4.0,"['따뜻한느낌', '이국적', '친절한', '심플한', '치킨', '오믈렛', '케이크', '샌드위치', '브런치', '핫플레이스', '나들이']"
오아시스,[이태원/한남] 오아시스 한남점,https://blog.naver.com/dana_104/221698385511,이번 주말엔 어디갈까 폭풍검색끝에 정우성이 자주 온다는??ㅋㅋㅋㅋㅋㅋ 오아시스에 가봤다 제일기획 건너편 골목에 있음 생각보다 꽤 올라가야했다 첨엔 여기 아닌줄 알고 지나칠뻔 가정집을 개조한 듯 하다 문을 열고... ,4.0,"['따뜻한느낌', '이국적', '친절한', '심플한', '치킨', '오믈렛', '케이크', '샌드위치', '브런치', '핫플레이스', '나들이']"
오아시스,Oasis 오아시스 cafe & restaurant,https://blog.naver.com/13572887/221712374080,나의 대학시절을 오래오래 꾸준히 함께해준 찬찬이가 떠났던 11월 지난주 :) 그와의 작별을 기념하며 간만에 모인 세 명! ‘오늘은 차니언니가 브런치 쏘는 날’ Oasis 오아시스 cafe & restaurant 한남동... ,4.0,"['따뜻한느낌', '이국적', '친절한', '심플한', '치킨', '오믈렛', '케이크', '샌드위치', '브런치', '핫플레이스', '나들이']"
오아시스,한남동 브런치 오아시스 / 수요미식회 추천 맛집,https://blog.naver.com/dan9199/221596324308,한남동 브런치 oasis 오아시스 솔직히 청담동까지 가기는 엄두도 안 나고 마침 친구도 브런치를 먹고 싶다기에 주말 아침 댓바람부터 한남동 고고 이건 나올 때 찍은 사진인데 한남동 브런치 맛집으로 유명해서인지 주말... ,4.0,"['따뜻한느낌', '이국적', '친절한', '심플한', '치킨', '오믈렛', '케이크', '샌드위치', '브런치', '핫플레이스', '나들이']"
오아시스,이태원 브런치 오아시스에서 여유로운 하루 보내기,https://blog.naver.com/sht01140/221651226447,"오아시스에서 브런치 여유롭게 즐겨볼까요? 안녕하세요 루샤에요! 지난 주말, 고등학교 친구를 만나고왔는데요 오랜만에 만나서 맛있는 브런치 식사도 하고 예쁜 카페에 가서 사진도 찍었습니다- 오늘 소개할 브런치... ",4.0,"['따뜻한느낌', '이국적', '친절한', '심플한', '치킨', '오믈렛', '케이크', '샌드위치', '브런치', '핫플레이스', '나들이']"
오아시스,[한남동 맛집] 한남동에서 브런치하기 좋은 곳: 오아시스,https://blog.naver.com/skyhygy/221662310336,"[한남동 맛집] 한남동에서 브런치하기 좋은 곳 : 오아시스 오랜만에 한남동 오아시스. 사실 청담동에 있는 오아시스가 집에서 더 가까운데, 막상 거기는 안가보고 회사에서 택시타고 갈 수 있는 한남동 쪽 오아시스만 가게... ",4.0,"['따뜻한느낌', '이국적', '친절한', '심플한', '치킨', '오믈렛', '케이크', '샌드위치', '브런치', '핫플레이스', '나들이']"
오아시스,한강진·한남동 / 오아시스(OASIS) 한남 / 친구들과 주말 브런치,https://blog.naver.com/hyeminsecond/221574813767,"결혼식 준비로 바쁜 박이와 그냥 약속이 많은 미미와 나불 :-) 셋이서 참 시간 잡아 만나기 어려웠다. 마침 일요일 낮 시간이 비어, 오아시스 한남에서 브런치를 먹기로 함 오아시스 한남점은 처음 방문해 보는데... ",4.0,"['따뜻한느낌', '이국적', '친절한', '심플한', '치킨', '오믈렛', '케이크', '샌드위치', '브런치', '핫플레이스', '나들이']"
오아시스,한남동 이태원 브런치맛집 오아시스 OASIS 카페&레스토랑,https://blog.naver.com/wowlovesoo/221585558499,오아시스 한남 이태원 한남동 브런치맛집으로 아주 아주 핫한 곳 청담점이 1호점인데 얼마 전에 한남동에도 오픈했다고 하네요. 최근엔 핫하다는 곳보다 그냥 편히 아는 가까운곳 위주로 다녔는데 잠시 여수에 있다가... ,4.0,"['따뜻한느낌', '이국적', '친절한', '심플한', '치킨', '오믈렛', '케이크', '샌드위치', '브런치', '핫플레이스', '나들이']"
오아시스,8월 사는 이야기 | 한남동 브런치 오아시스 | 스타벅스 리저브,https://blog.naver.com/0701____/221621791222,8월도 돈쓴기 오랜만에 꼬니 만나러 이태원 갔다. 이 날 더워서 죽을뻔 했다고 한다... 가보고싶던 오아시스 한남점! 이태원역이랑 한강진역 딱 중간에 있다. 35도 정도 까지 올라가는날에는 걸어갈게 못된다는거;... ,4.0,"['따뜻한느낌', '이국적', '친절한', '심플한', '치킨', '오믈렛', '케이크', '샌드위치', '브런치', '핫플레이스', '나들이']"
오아시스,"무화과 프렌치 토스트가 맛있었던 브런치카페_ 오아이스 한남, 한남동... ",https://blog.naver.com/noheul0517/221613513304,"-이 포스팅은 본인이 비용 지불 후 본인이 직접 촬영, 이용 후 사실만을 토대로 자발적으로 작성된 글입니다. 한남동 브런치카페_ 오아이스 한남점 지난번 다녀온 한남동 브런치카페 오아시스! 한창 남편이랑 출산 전... ",4.0,"['따뜻한느낌', '이국적', '친절한', '심플한', '치킨', '오믈렛', '케이크', '샌드위치', '브런치', '핫플레이스', '나들이']"
오아시스,"(한남)이태원 브런치 맛집, 오아시스한남",https://blog.naver.com/hylove104/221620059246,"오랜만에 아들없이 평일데이트를 즐겼답니다. 어딜갈까하다 애있을때는 못가는 동네로갔어요. 오늘은 한남동. 원래 사운즈한남가서 먹으려했는데, 오픈시간이 11시반 이래서 근처 더 일찍 브런치 먹을수 있는곳으로 급... ",4.0,"['따뜻한느낌', '이국적', '친절한', '심플한', '치킨', '오믈렛', '케이크', '샌드위치', '브런치', '핫플레이스', '나들이']"
오아시스,"한남동 오아시스, 현경, 서울 브루어리 브루잉랩 한남",https://blog.naver.com/nylee090/221809271543,호주 여행기 쓰다가 간만에 올리는 소소한 일상 (2020.01.29) 호주에서 귀국 후 집순이 모드로만 지내다가 간만에 나선 외출! 간만의 외출이기에 아무데나 가고 싶지 않아서 한남동 카페를 검색한 끝에 #오아시스한남 에... ,4.0,"['따뜻한느낌', '이국적', '친절한', '심플한', '치킨', '오믈렛', '케이크', '샌드위치', '브런치', '핫플레이스', '나들이']"
오아시스,"한남동 오아시스, 수요미식회 브런치!",https://blog.naver.com/kyoonsun7/221283112479,"오랫동안 청담동에서 사랑받던 인기 브런치식당. 햇빛 잘 들어오는 창가에서 기분 좋게 즐기는 예쁘고 맛있는 브런치카페, 한남동 오아시스. 2017년 9월 첫 방문때의 포스팅. 한남동 주택가 골목 안쪽에 새롭게 둥지를 튼... ",4.0,"['따뜻한느낌', '이국적', '친절한', '심플한', '치킨', '오믈렛', '케이크', '샌드위치', '브런치', '핫플레이스', '나들이']"
오아시스,[한남동] 오아시스 한남 / 브런치 맛집,https://blog.naver.com/violetsky5/221357785684,2018.8.19 (일) 원래 청담동에 있었다는 브런치 카페 오아시스. 수요미식회에도 나왔다고 하는데 나는 인스타에서 우연히 알게 되어 어느 일요일 한남점에 방문하였다. 오아시스 한남점 대로변에서 얼마 안 들어갔는데... ,4.0,"['따뜻한느낌', '이국적', '친절한', '심플한', '치킨', '오믈렛', '케이크', '샌드위치', '브런치', '핫플레이스', '나들이']"
오아시스,오아시스 한남 (OASIS)/한남동 브런치 카페/에그베네딕트... ,https://blog.naver.com/yoo_h_byul/221566925926,"오아시스 한남 한남동 브런치 카페 예전부터 가고 싶던, 오아이스 한남 주말에 브런치를 먹으러 나올 일이 거의 없어서 계속 못갔었는데 지난 주말에 부산에서 친한 언니가 올라와서 같이 이태원 해밀턴에서 1박하고... ",4.0,"['따뜻한느낌', '이국적', '친절한', '심플한', '치킨', '오믈렛', '케이크', '샌드위치', '브런치', '핫플레이스', '나들이']"
오아시스,한남동맛집. 오아시스 브런치 그리고 앤드커피랩❤️ 나는 이직준비 중!,https://blog.naver.com/soboru87/221552241839,안녕하세요! 바이소루 입니다. 이번 한주는 이직을 하게되어 전 직장을 퇴사하여 푹 쉴 수 있는 백수였어요. 몇년만에 이렇게 오래 쉬게되어 기분이 남달랐던 일주일 이였답니다. 이직이라는게 정말 쉬운게 아니더라구요.... ,4.0,"['따뜻한느낌', '이국적', '친절한', '심플한', '치킨', '오믈렛', '케이크', '샌드위치', '브런치', '핫플레이스', '나들이']"
오아시스,"[한남맛집] : ""오아시스""브런치카페~!",https://blog.naver.com/j0121u/221794409111,"한남브런치카페 ""오아시스"" 오아시스한남/브런치카페/브런치맛집 친구들과 생파겸 만나기로 한날~ 정말 오랜만에 한남동에 온거같아요:) 오복수산에 가려고 했는데 공휴일이라 문을 닫아서 두번째로 알아본곳인... ",4.0,"['따뜻한느낌', '이국적', '친절한', '심플한', '치킨', '오믈렛', '케이크', '샌드위치', '브런치', '핫플레이스', '나들이']"
오아시스,[2017년 10월] 발품 팔아 찾은 맛집,http://post.naver.com/viewer/postView.nhn?volumeNo=9944936&memberNo=25567520&vType=VERTICAL,"경리단길 골목대장 장진우가 광주에 오픈한 베트남 레스토랑부터 심야식당과 럭셔리한 한우 구이집, 그리고 브런치 레스토랑까지 풍성한 10월의 레스토랑 오픈 소식을 전한다.  달아래,면 심야식당 같은 일본식 면 요리 전문점 탄탄면, 미소명란감자볼, 비빔면 달아래 단골들의 성원에 힘입어 오픈한 달아래,면의 메뉴는 달아래의 인기 메뉴인 마제소바, 매생이면, 명란미소감자볼을 비롯해 새롭게 추가한 탄탄면, 마제밥으로 단출하게 구성됐다. 그럼에도 연일 손님이... ",4.0,"['따뜻한느낌', '이국적', '친절한', '심플한', '치킨', '오믈렛', '케이크', '샌드위치', '브런치', '핫플레이스', '나들이']"
오아시스,[임신 32주] 9개월 진입 : 오아시스 브런치/베이비페어/자연주의출산... ,https://blog.naver.com/wls1202/221633897644,[임신 32주] 9개월 진입 임신 32주의 메모 자다가 다리에 쥐 두번인가 세번인가 나는 (비몽사몽이라 기억이 잘 안남ㅠㅠ) 신기록을 세우며 32주차 시작^^....... 쥐나는거 넘 아파서 무섭다ㅠㅠ / 한동안 잘 안깼었는데 오랜만에... ,4.0,"['따뜻한느낌', '이국적', '친절한', '심플한', '치킨', '오믈렛', '케이크', '샌드위치', '브런치', '핫플레이스', '나들이']"
오아시스,"오아시스 한남점 : 브런치는 맛있고, 1층보단 2층으로 :)",https://blog.naver.com/c_viewpoint/221436364361,2019년 새해가 되면서 예배후 시간이 여유로와진 우리부부는 브런치를 즐기러 한남동 / 이태원 여기저기 돌아다녀보기로 했구요 그중 첫번째는 한남동 브런치의 대표레스토랑 오아시스 한남점에 방문했습니다 :) 이... ,4.0,"['따뜻한느낌', '이국적', '친절한', '심플한', '치킨', '오믈렛', '케이크', '샌드위치', '브런치', '핫플레이스', '나들이']"
오아시스,"한남동 브런치카페, 오아시스한남(Oasis Hannam)",https://blog.naver.com/sarah7979/221506536707,안녕하세요 예디입니다! 요번에는 한남동 핫플인 오아시스 한남 포스팅해볼게욧~! 요기 웨이팅 많구 워낙 핫해서 예약하려고 전전날 전화했더니 풀이래요 ㅜㅜ 그래서 예약은 못하구 친구가 먼저... ,4.0,"['따뜻한느낌', '이국적', '친절한', '심플한', '치킨', '오믈렛', '케이크', '샌드위치', '브런치', '핫플레이스', '나들이']"
오아시스,"[한남동 브런치카페] 여전히 브런치 핫플, 오아시스 한남",https://blog.naver.com/twoseven2727/221592627227,안녕하세요. 여전히 인기가 좋은 한남동 브런치카페 오아시스 한남!! 제 딸을 어린이집 보내고 부지런히 왔는데 이미 10시반인데도 웨이팅이라니ㅜ 참 인기가 사그러들지않네요. 위치는 참 애매한 골목에 있어요. 가면서도... ,4.0,"['따뜻한느낌', '이국적', '친절한', '심플한', '치킨', '오믈렛', '케이크', '샌드위치', '브런치', '핫플레이스', '나들이']"
오아시스,[이태원/한남동] 오아시스,https://blog.naver.com/blue_yj28/221311079144,[이태원/한남동] 오아시스 •9시부터 22시까지 (일요일 18시까지) •브런치 맛집이래요!! 가벼운 마음으로 찾아갔다가 완전 반해서 온 곳! 한남동 오아시스 나중에 보니 한남동 브런치 맛집으로 유명한 곳이었어요. 친구와... ,4.0,"['따뜻한느낌', '이국적', '친절한', '심플한', '치킨', '오믈렛', '케이크', '샌드위치', '브런치', '핫플레이스', '나들이']"
오아시스,"이태원,한강진역 오아시스 한남점/낮에는 브런치카페,저녁엔 레스토랑",https://blog.naver.com/berryeunice/221208293245,압구정에서 인기대박 브런치집인 오아시스가 한남점도 생겼어요. 여긴 좀 사람이 적겠지 하고 갔는데 대기 걸어놓고 30분은 기다린 것 같아요. 평일 한낮에도 사람이 많네요. 오아시스 한남점 Oasis Cafe&Restaurant 주택을 잘... ,4.0,"['따뜻한느낌', '이국적', '친절한', '심플한', '치킨', '오믈렛', '케이크', '샌드위치', '브런치', '핫플레이스', '나들이']"
오아시스,오아시스 한남동브런치카페,https://blog.naver.com/lje3208/221510610052,오픈이 이르고! 분위기 좋은 한남동브런치카페 <오아시스 한남> 골목 위에 있어서 도보로는 좀 걸어야하고요 주차는 발렛해줍니다 골목이 좁으니 운전해서 올라올 때 조심조심요 주택가에 있는 오아시스 브런치카페 1층... ,4.0,"['따뜻한느낌', '이국적', '친절한', '심플한', '치킨', '오믈렛', '케이크', '샌드위치', '브런치', '핫플레이스', '나들이']"
오아시스,"오아시스_한남,청담",https://blog.naver.com/ever_ours/221265649932,몇 번을 벼르고 이상하게 인연이 없는지 문 앞에서 번번히 물러섰던 오아시스 식상한 브런치 이지만 그 중 제일 맛있다고도 하고 분위기도 좋대서 결국! 또! 점심때 다녀왔다 ㅎㅎㅎ 조금 덜 먼 이태원의 오아시스 한남... ,4.0,"['따뜻한느낌', '이국적', '친절한', '심플한', '치킨', '오믈렛', '케이크', '샌드위치', '브런치', '핫플레이스', '나들이']"
오아시스,#한남동맛집/한남동 브런치 오아시스 한남점,https://blog.naver.com/h00000n/221436654106,"꺄르르 꺄르르 오아이스를 처음 경험한 건 #청담오아시스 그 날의 기억이 좋아 한남점도 2번 방문했다. 하지만 한남점, 청담점 어떤 직원이 서빙해주냐에 따라 재방문이 있고 없더라. 오아시스 한남점 02-790-8906 서울... ",4.0,"['따뜻한느낌', '이국적', '친절한', '심플한', '치킨', '오믈렛', '케이크', '샌드위치', '브런치', '핫플레이스', '나들이']"
오아시스,이태원 브런치- 오아시스 한남점,https://blog.naver.com/namji2738/221454716221,느끼한걸 그렇게 선호하는 편은 아니지만 가끔 브런치가 땡길 때가 있다- 평일 낮에 방문했던 오아시스 한남점 이태원역에서는 걸어서 10분이상 가야하고 살짝 언덕길에 있으니 힐신으시는 분들은 참고~ 예약을 안하고... ,4.0,"['따뜻한느낌', '이국적', '친절한', '심플한', '치킨', '오믈렛', '케이크', '샌드위치', '브런치', '핫플레이스', '나들이']"
오아시스,"[이태원,한남동] 오아시스 한남",https://blog.naver.com/sienalis/221254617990,[이태원] 오아시스 한남주소: 서울 용산구 이태원로45길 30전화번호: 02-790-8906영업시간: 평일 09:00 - 22:00 일요일 09:00 - 18:00 월요일 휴무 이전 포스팅 . .)https://blog.naver.com/sienalis/221151819226 지난 주말엄마랑... ,4.0,"['따뜻한느낌', '이국적', '친절한', '심플한', '치킨', '오믈렛', '케이크', '샌드위치', '브런치', '핫플레이스', '나들이']"
오아시스,브런치 맛집 오아시스 한남점 역시 맛있어! (+햇살맛집),https://blog.naver.com/lol_awesome/221452064248,브런치 맛집 오아시스 한남점 역시 맛있어! (+햇살맛집) 주말인데 남편은 계모임 약속이 있어서 오랜만에 자유부인 !!! 이런 날엔 혼자 집에 있으면 심심하니까 몇 주 전부터 친구들과 약속을 했어요 만나서 수다도 떨고... ,4.0,"['따뜻한느낌', '이국적', '친절한', '심플한', '치킨', '오믈렛', '케이크', '샌드위치', '브런치', '핫플레이스', '나들이']"
오아시스,"한남동 브런치 카페 오아시스 한남점 에그베네딕트, 머쉬룸 파스타",https://blog.naver.com/uniquebitna/221474537350,"한남동 브런치 오아시스 한남점 에그베네딕트, 머쉬룸 파스타 안녕하세요. 오늘은 주말에 다녀온 브런치 카페 오아시스 이야기를 해볼게요. 오래 전에 청담점에만 있을 때 다녀오고 생각으로만 가본 그 곳이예요. 완전... ",4.0,"['따뜻한느낌', '이국적', '친절한', '심플한', '치킨', '오믈렛', '케이크', '샌드위치', '브런치', '핫플레이스', '나들이']"
오아시스,"한남동 브런치, 오아시스 한남 에그베네딕트 버섯크림파스타",https://blog.naver.com/lemon3761/221443253365,"한남동브런치, 오아시스 에서 에그베네딕트 위치: 용산구 한남동 745-10 영업시간 : 9:00- 20:00, 일요일 18:00 닫음 아무래도 글로 쓰는거보다 딱! 이미지가 나을거 같아소 요렇코럼 네이버에서 캡쳐해서 첨부하겟음니다... ",4.0,"['따뜻한느낌', '이국적', '친절한', '심플한', '치킨', '오믈렛', '케이크', '샌드위치', '브런치', '핫플레이스', '나들이']"
오아시스,"이태원 브런치 맛집 : 오아시스 메뉴 추천 (프렌치 토스트, 연어... ",https://blog.naver.com/ysb221/221311303631,"안녕하세요 스텔라에요 너무나 오랜만에 쓰는 포스팅이라 낯서네요그동안 많이 바쁘기도 했고,,, 블로그 해야지 해야지 하면서 미뤄왓어요그치만 안쓰는 거 보다는 간략하게 하는 쪽이 낫겠다 싶어앞으로는 맛집 포스팅... ",4.0,"['따뜻한느낌', '이국적', '친절한', '심플한', '치킨', '오믈렛', '케이크', '샌드위치', '브런치', '핫플레이스', '나들이']"
오아시스,"<한남동,오아시스>최애 브런치레스토랑은 바로 여기 오아시스 !!",https://blog.naver.com/js2276/221432219051,새로운곳에 도전하는거 즐기지않아서(카페는 괜찮지만 레스토랑은 망하면 돈아까버..) 파스타는 어디 핏자는 어디 좋아하는 장소들이 몇 있는데.. 페이보릿 브런치레스토랑이 몇 있었는데 그중 하나가 베끼. 가격대... ,4.0,"['따뜻한느낌', '이국적', '친절한', '심플한', '치킨', '오믈렛', '케이크', '샌드위치', '브런치', '핫플레이스', '나들이']"
오아시스,"주말 브런치 , 오아시스(OASIS) 한남",https://blog.naver.com/kangpoorun/221474494971,오아시스 한남 후배랑 주말 브런치 :-) 오아시스 한남에서~ 지하철역으로는 이태원역이랑 가까워요. 걸어서 10분 내외였던 것 같아요. 혹시나 웨이팅 있으려나 싶었는데 다행히 자리가 있었던! 외관만 봤을때는 가정집 같은... ,4.0,"['따뜻한느낌', '이국적', '친절한', '심플한', '치킨', '오믈렛', '케이크', '샌드위치', '브런치', '핫플레이스', '나들이']"
오아시스,한남동 브런치 맛집 오아시스,https://blog.naver.com/jenny8428/221214493669,오아시스 브런치 정말 좋아하는데 한남동에도 생겼다는 소문이 있지 뭐예요? 지지난 주 주말인가. 남편이랑 남편 친구들이랑 (거의 매주 같이 노는 ㅋㅋㅋ) 한남동 근처에 있다가 제가 여기 요즘 핫하다며 오빠들 끌고... ,4.0,"['따뜻한느낌', '이국적', '친절한', '심플한', '치킨', '오믈렛', '케이크', '샌드위치', '브런치', '핫플레이스', '나들이']"
