name,title,url,description,score,tags
오아시스,[Lifeplus] 계란이 하드캐리!계란요리 맛집 5,https://post.naver.com/viewer/postView.nhn?volumeNo=13383896&memberNo=37778488&vType=VERTICAL,"계란 덕후라면 지나치지 못할걸? 반숙? 완숙?수란 파스타부터 에그스카치, 타마고샌드까지!계란의 변신은 끝이 없다고 하지요?라이프플러스와 함께 노랑노랑한 계란 요리 맛집을 알아보아요! 1. (합정) 에그당 마스터 셰프 코리아 출연자들의 수란 파스타 1. 마스터 셰프 코리아 이창수와 강형구가 운영하는 고메 프로젝트 2. 생크림에 청양고추, 고춧가루를 넣어 숙성시킨 특제 크림소스 파스타에 신선한 수란이 풍덩3. 다섯 가지 쌀을 최상의 비율로 섞어 지은 밥과... ",4.0,"['따뜻한느낌', '이국적', '친절한', '심플한', '치킨', '오믈렛', '케이크', '샌드위치', '브런치', '핫플레이스', '나들이']"
오아시스,한남동 오아시스 분위기갑!!,http://store.naver.com/cafeRedirect?cafeUrl=ec0561a91dd6384dba35bc96306539b52961f9fc61ebceb012afd8d30542777203ebab4b417f32fec292351ba14029fc&query=1110133208,안녕하세요~ 오랜만에 모인 친구들과 함께 갔던 브런치카페 소개해드려요! 한남동에 오아시스라는 곳입니다~ 위치가 살짝 언덕에 위에 있어서 그동안 미루고 미루다가 다츠에 웨이팅이 길어 급 가게 되었어요~ 입구부터... ,4.0,"['따뜻한느낌', '이국적', '친절한', '심플한', '치킨', '오믈렛', '케이크', '샌드위치', '브런치', '핫플레이스', '나들이']"
오아시스,한남동 브런치카페 오아시스(oasis),https://blog.naver.com/p_yjyj8024/221797208571,오랜만에 친구들이랑 한남동 나들이 ㅎㅎ ! 집에서 한남동을 가기가 애매해서 그런지 한남동은 잘 안오게되는데 진짜 진짜 오랜만에 나왔습니다 !! 그래두 전에는 클럽간다고 이태원에 .. 퍽... ,4.0,"['따뜻한느낌', '이국적', '친절한', '심플한', '치킨', '오믈렛', '케이크', '샌드위치', '브런치', '핫플레이스', '나들이']"
오아시스,1월의 일상,https://blog.naver.com/cheek07/221458982210,1월의 시작은 우리 유니 생일 유니가 넘나 좋아하는 할아버지 품에 안겨서 생일상을 바라보는 유니 표정이 왜케 아련하니 양가에서 번갈아 챙겨주시는 덕분에 아주 너무너무 행복했던 유니 평소에 좋아하던 것들을 선물로... ,4.0,"['따뜻한느낌', '이국적', '친절한', '심플한', '치킨', '오믈렛', '케이크', '샌드위치', '브런치', '핫플레이스', '나들이']"
오아시스,한남동 브런치맛집_오아시스,https://blog.naver.com/20072123/221473768646,2월 생일자 모임을 위해 오랜만에 한남동 궈 브런치먹을까? 해서 예전부터 가고 싶었던 오아시스 한남점 총총. 웨이팅이 있긴 했는데 십분?만에 바로 들어가서 그야말로 럭키이 사진은 갬성뿜뿜하던 입구 옆 공간... ,4.0,"['따뜻한느낌', '이국적', '친절한', '심플한', '치킨', '오믈렛', '케이크', '샌드위치', '브런치', '핫플레이스', '나들이']"
오아시스,한남동 맛집 / 브런치를 즐기러 '오아시스',https://blog.naver.com/sweet0616/221195323578,"한남동의 브런치 맛집인 '오아시스'에서 브런치를 즐겼던 어느 주말. 워낙, 인기가 많은 곳이라고 해서 미리 예약을 하고 방문했어요. (예약시간에 맞춰도착하지 못하면 예약이 취소 될 수 있다니 주의) 주말이라고... ",4.0,"['따뜻한느낌', '이국적', '친절한', '심플한', '치킨', '오믈렛', '케이크', '샌드위치', '브런치', '핫플레이스', '나들이']"
오아시스,4월 5일 한남동,https://blog.naver.com/dkdldi29/221514642694,오랜만에 술망이들이 다 모였다 두 춘천러들을 기다리기 위해 잠시 들른 벤허 #BNHR 밀크티 맛있음 인스타 감성을 내보려 했지만 실패한 행갱이 없어보인다고 면박 줌 미아냉 사실이 그래... #오아시스한남 이제 오아시스로... ,4.0,"['따뜻한느낌', '이국적', '친절한', '심플한', '치킨', '오믈렛', '케이크', '샌드위치', '브런치', '핫플레이스', '나들이']"
오아시스,한남동 브런치 오아시스 카페 + 한남동카페 BNHR + 청담동 카페... ,https://blog.naver.com/studiobyh/221310610457,"한남동 브런치 오아시스 카페 + 한남동카페 BNHR + 한남동카페 교양식사 + 청담동 카페 데바스테이트 / #한남동브런치 #오아시스카페 #오아시스한남 지난 주말, 오라비와의 오붓한 주말 브런치하러 한남동으로 고고... ",4.0,"['따뜻한느낌', '이국적', '친절한', '심플한', '치킨', '오믈렛', '케이크', '샌드위치', '브런치', '핫플레이스', '나들이']"
오아시스,한남 카페 ? 브런치 맛집_ 오아시스 한남,https://blog.naver.com/dngusco/221396395096,내가 울 학교에서 제일 조아하는 남사친 (남자 사람 친구 ? 오빠) 한양대에서 만난 한양대 남자 같지 않은 탈 한남 (탈 한양대 남자ㅋ) 코로로기뿌와 + 에그를 만났당 우리 삼인 팟은 언제 모여도 즐거워 우리 셋이 어떻게... ,4.0,"['따뜻한느낌', '이국적', '친절한', '심플한', '치킨', '오믈렛', '케이크', '샌드위치', '브런치', '핫플레이스', '나들이']"
오아시스,오아시스 한남 : 한남동 브런치 카페,https://blog.naver.com/moon_daldal/221240894432,주말 아침. 미세먼지가 다가오고 있던 날이였다. 전날 오랜만에 우리집에 모였던 숙자매 딸래미들은 미세먼지를 뚫어보기로 했다. 식욕이 미세먼지를 이기고 도착한 한남 오아시스 리움미술관을 지나 안쪽 골목길에... ,4.0,"['따뜻한느낌', '이국적', '친절한', '심플한', '치킨', '오믈렛', '케이크', '샌드위치', '브런치', '핫플레이스', '나들이']"
오아시스,한남동 맛집 수요미식회 오아시스 브런치,https://blog.naver.com/486nanana/221357834160,브런치가 너무 맛있는 오아시스 한남동 골목길을 조금 들어서면 보이는 오아시스 이곳 브런치가 참 맛있다. 청담동에도 있지만 분위기는 개인적으로 한남동이 나에게 다소 편하게 느껴진다. 요즘 가을날씨와 함께 맛 좋은... ,4.0,"['따뜻한느낌', '이국적', '친절한', '심플한', '치킨', '오믈렛', '케이크', '샌드위치', '브런치', '핫플레이스', '나들이']"
오아시스,한남동 카페) 오아시스 갔다옴~~,https://blog.naver.com/dudxmr1171/221396099963,ㅎㅇㅎㅇ 이 카페는 어케 가게됏냐믄 기억이 안나는데 인스타에서 보고 갓던것 같음 브런치 먹으려고 했는데 어쩌다 보니 3시에 가게됨ㅎㅎ *^^* 이쁘죵 딱 날씨 좋을 가을 날에 갔더니 요로코롬 문도 열어놨더라구요??... ,4.0,"['따뜻한느낌', '이국적', '친절한', '심플한', '치킨', '오믈렛', '케이크', '샌드위치', '브런치', '핫플레이스', '나들이']"
오아시스,[한남 브런치] OASIS 오아시스,https://blog.naver.com/hyunzinkim/221326069856,"#브런치 맛집 #오아시스한남 :) 요즘 주변에서 오아시스,..오아시스... 소리가 들려서 그럼 한번 가볼깡 이태워너로서 점심시간 급 이동! 착한 친구들이 먼저와서 기다린 덕에 나는 크게 기다리는 시간 없이 입성 고마와... ",4.0,"['따뜻한느낌', '이국적', '친절한', '심플한', '치킨', '오믈렛', '케이크', '샌드위치', '브런치', '핫플레이스', '나들이']"
오아시스,"이태원 오아시스 브런치 카페, OASIS CAFE & RESTURANT",https://blog.naver.com/solbon1212/221646511208,2019.09.09 여기 카페 대사관로 중간에 있다. 대사관이 주변에 많다! 브런치 카페인가보다. 다른 손님들은 카페보다는 음식을 많이 주문했다. 가격표 오랜만에 당근 케이크 ㅋㅋㅋㅋㅋㅋㅋㅋㅋㅋ 이상하게 나만 사진 계속... ,4.0,"['따뜻한느낌', '이국적', '친절한', '심플한', '치킨', '오믈렛', '케이크', '샌드위치', '브런치', '핫플레이스', '나들이']"
오아시스,예쁜 공간 맛있는 브런치 한남동 오아시스,https://blog.naver.com/minjeong03/221363646659,한남동 오아시스 맛있는 브런치로 유명한 오아시스. 청담동에 이어 오픈한 한남동 2호점에 다녀왔다. 이전 포스팅에서 예쁜 꽃다발을 만들어 선물했던 선배와 오랜만에 브런치 타임을 갖기로 했다. 직접 만든 노랑... ,4.0,"['따뜻한느낌', '이국적', '친절한', '심플한', '치킨', '오믈렛', '케이크', '샌드위치', '브런치', '핫플레이스', '나들이']"
오아시스,[한남동] 오아시스,https://blog.naver.com/miyamui/221390274879,"하늘이 맑고 예뻤던 날, 추석 전이었던 것 같은데.. 마침 서울에 사람도 많이 없고, 날도 좋을때라 오랜만에 브런치 즐기러 나갔던 주말 좋아하는 오아시스가 한남동에도 생겼다길래, 마침 창가쪽 자리가 비어 혼자 언니를... ",4.0,"['따뜻한느낌', '이국적', '친절한', '심플한', '치킨', '오믈렛', '케이크', '샌드위치', '브런치', '핫플레이스', '나들이']"
오아시스,한남동 브런치 오아시스 한남,https://blog.naver.com/notabigthing/221268064700,한남동 브런치 오아시스 한남 청담 브런치 맛집으로 유명했던 오아시스가 한남동에도 매장을 오픈한지 꽤 되었다. 나도 3월쯤 다녀온 것 같은데 꽤나 늦어버린 포스팅 ~_~ 가정집을 개조하여 카페로 만든 것 같은 느낌!... ,4.0,"['따뜻한느낌', '이국적', '친절한', '심플한', '치킨', '오믈렛', '케이크', '샌드위치', '브런치', '핫플레이스', '나들이']"
오아시스,"■Keviny_place:한남동 오아시스,오아시스 한남,한남동 브런치",https://blog.naver.com/ckevin01/221288551021,""" OASIS HANNAM "" 오아시스 한남점 한남동 및 이태원에는 유명한 브런치집이 굉장히 많다. 매주 일요일에는 , 어딜가나 웨이팅하는데 오리지날팬케이크 집을 가려다 너무 많은 인파로 밀리고 밀려 한남동 오아시스에 다녀왔다.... ",4.0,"['따뜻한느낌', '이국적', '친절한', '심플한', '치킨', '오믈렛', '케이크', '샌드위치', '브런치', '핫플레이스', '나들이']"
오아시스,[한남동/한강진] 브런치 카페: 오아시스,https://blog.naver.com/ju_hyun2/221360321368,[한남동/한강진] 브런치 카페: 오아시스 #한남동브런치 #카페오아시스 #발렛가능 여행 후 정신없는 나날의 연속이지만 나도 사람은 만나고 살아야죠 'ㅁ' 그래서 다녀왔습니다 어디로? 한남동으로ㅋ 망원으로... ,4.0,"['따뜻한느낌', '이국적', '친절한', '심플한', '치킨', '오믈렛', '케이크', '샌드위치', '브런치', '핫플레이스', '나들이']"
오아시스,5月 한남동 브런치 맛집 오아시스 / 수요미식회,https://blog.naver.com/hyunsj0421/221293159999,오아시스 치킨 아보카도 샌드위치 에그 베네딕트 느로웨이산 훈제연어 아이스 아메리카노 입구부터 남다르게 예뻤던 '오아시스' 수요미식회에 호주식 브런치로 소개 됐었다고 한다. 청담점과 한남점이 있다. 햿빛도... ,4.0,"['따뜻한느낌', '이국적', '친절한', '심플한', '치킨', '오믈렛', '케이크', '샌드위치', '브런치', '핫플레이스', '나들이']"
오아시스,한남동 브런치 카페 오아시스 에서 편안한 브런치 타임,https://blog.naver.com/sweetysomi/221401659887,한남동 브런치 카페 오아시스 근처에 있다가 우연히 들른 한남동 브런치 카페 오아시스 처음에는 몰랐는데 굉장히 유명한 브런치 카페라고 한다. 청담점은 초기에 브런치 카페 붐이 일기 시작 했을때부터 자리를 잡은... ,4.0,"['따뜻한느낌', '이국적', '친절한', '심플한', '치킨', '오믈렛', '케이크', '샌드위치', '브런치', '핫플레이스', '나들이']"
오아시스,[한남] 오아시스 한남점,https://blog.naver.com/lunabambi/221306947032,자주 만나지는 않지만 그래도 분기별이나 반기별로 한번씩 만나서 브런치 먹는 멤버들이 모였다. 어디갈까 고민하는데 다들 맛집 4개 5개씩 찾아옴 ㅋㅋㅋㅋ 이번엔 오아시스 한남으로 가본다. 주말엔 웨이팅이 길대서... ,4.0,"['따뜻한느낌', '이국적', '친절한', '심플한', '치킨', '오믈렛', '케이크', '샌드위치', '브런치', '핫플레이스', '나들이']"
오아시스,12월 첫째날,https://blog.naver.com/sweetspring6/221410098268,"새벽에 꿀잠 자고 일어난 오빠와 새벽 6시 30분부터 7시 30분까지 침대속에서 모닝 수다를 떨었다. 제법 진지한 이야기들이었는데, 무지 감사한 시간들 - 아침에 콘프레이크를 먹고 열심히 머리써서 공부할 남편이 금방... ",4.0,"['따뜻한느낌', '이국적', '친절한', '심플한', '치킨', '오믈렛', '케이크', '샌드위치', '브런치', '핫플레이스', '나들이']"
오아시스,한남 브런치 오아시스,https://blog.naver.com/mocha_unee/221236756173,한남동의 어느 골목 차안으로 햇살이 내리쬐는 따뜻한 봄날 만끽하며 브런치 땡기러 가는 자유부인의 발걸음이 오늘따라 막 그르케 좋은 것 한남동 브런치 오아시스 주택을 개조했나봄 만날 약속장소를 전날 밤에 부랴부랴... ,4.0,"['따뜻한느낌', '이국적', '친절한', '심플한', '치킨', '오믈렛', '케이크', '샌드위치', '브런치', '핫플레이스', '나들이']"
오아시스,"[한남동 브런치 맛집] ""오아시스 한남점"" 비오는 날에 더 좋은, 분위기... ",https://blog.naver.com/su_kyung14/221315022121,"지난 주말에 다녀온 브런치 카페 ""오아시스 한남점"". 너무 좋은 기억으로 남아서 쉽게 잊혀질 것 같지 않은 곳. 메뉴 메뉴 메뉴 비가 상당히 많이 와서 찾아가는 길이 결코 편하지는 않았다. 한강진역 쪽에 간 것은... ",4.0,"['따뜻한느낌', '이국적', '친절한', '심플한', '치킨', '오믈렛', '케이크', '샌드위치', '브런치', '핫플레이스', '나들이']"
오아시스,한남[오아시스]브런치,https://blog.naver.com/huyou83/221629450041,오랜만에 평일 오전 시간이 빈 영쌤과 함께 한남동에 브런치 먹으러감. 여기는 주차장이 없어서 무조건 발렛. 작고 특이한 구조임. 아기자기한 실내. 딱 커피를 위한 셋팅만 올라와 있고. 조리하는 곳은 지하인 듯. 셀카중인... ,4.0,"['따뜻한느낌', '이국적', '친절한', '심플한', '치킨', '오믈렛', '케이크', '샌드위치', '브런치', '핫플레이스', '나들이']"
오아시스,[후곡/식사/운정/파주 미술학원]일산 바른미술학원_ 서울 브런치 맛집... ,https://blog.naver.com/westside_is/221358836814,"[후곡/식사/운정/파주 미술학원]일산 바른미술학원_ 서울 브런치 맛집 추천: 한남동, 오아시스 안녕하세요~ 일산 후곡, 바른이 입니다. 오늘이 벌써 금요일이네용 요즘 날씨가 계속 좋죠? 다행히 이번주 주말에 비 소식이... ",4.0,"['따뜻한느낌', '이국적', '친절한', '심플한', '치킨', '오믈렛', '케이크', '샌드위치', '브런치', '핫플레이스', '나들이']"
오아시스,"이태원 카페, 오아시스 한남(oasis hannam)",https://blog.naver.com/happy36860/221279521008,"이태원 한남동에 위치한 브런치 카페 오아시스 한남 가격깡패이지만 맛은 있는 곳 * * * #오아시스한남 #한남동카페 #이태원카페 #브런치카페 - 영업시간 : 9:00-22:00(평일), 9:00-18:00(일) / 월휴무 - 전화번호 : 02-790-8906... ",4.0,"['따뜻한느낌', '이국적', '친절한', '심플한', '치킨', '오믈렛', '케이크', '샌드위치', '브런치', '핫플레이스', '나들이']"
오아시스,한남동 :: 오아시스,https://blog.naver.com/nabie102/221590908123,"짧게 서울 놀러온 민이랑 뭐라도 하나 더 먹고 헤어져야지 ㅋㅋㅋㅋ 일요일 눈뜨자마자 챙겨서 오아시스 ㅋㅋ 일찍문열고, 발렛되고, 하이체어있는 그냥 맘편한 브런치집 ㅎㅎㅎㅎ 소윤인 이제 하이체어는 필요없지만 ㅎㅎ... ",4.0,"['따뜻한느낌', '이국적', '친절한', '심플한', '치킨', '오믈렛', '케이크', '샌드위치', '브런치', '핫플레이스', '나들이']"
오아시스,한남동 브런치까페 오아시스,https://blog.naver.com/soverycold/221239331239,핫한 곳을 꿰뚫고 있는 망고 언니가 데리고 가준 오아시스 한남 압구정이 1호 한남이 2로점이라하네요 한강진역 1번출구로 나와 직진 우리은행 옆 골목으로 언덕길 따라 쭉 올라가면 벨기에대사관 앞에 위치해 있어요.... ,4.0,"['따뜻한느낌', '이국적', '친절한', '심플한', '치킨', '오믈렛', '케이크', '샌드위치', '브런치', '핫플레이스', '나들이']"
오아시스,한남동 브런치 - 오아시스 (급브런치),https://blog.naver.com/minahbb/221380842545,이곳은 윤지와 함께 가고싶은 곳 중에 한곳 원래는 조찬회 갔어야 했는데 잠을 선택했던 나는 조찬회갔던 사람들과 한남동에서 조인하기로 진짜 간만에 브런치 집에서부터 둑은둑은ㅋㅋㅋㅋㅋㅋ 늦어서 부랴부랴 들어옴... ,4.0,"['따뜻한느낌', '이국적', '친절한', '심플한', '치킨', '오믈렛', '케이크', '샌드위치', '브런치', '핫플레이스', '나들이']"
오아시스,한남동 맛집 _ [ 오아시스 ] 한남. 브런치. 앞은.. 벨기에 대사관... ,https://blog.naver.com/just_kimi/221330094059,초점은 어디로 사라졌나요 그래도 기분좋은 날이였다 동생이랑 급 데이트 이렇게 펼쳐져있는 애들은 뭔가 손을 잡고 먹고 싶어진다 사람이 많았지만 없는 것처럼 찍어보기 후루룩후루룩 수프 내가 사진을 찍는걸 보면 내... ,4.0,"['따뜻한느낌', '이국적', '친절한', '심플한', '치킨', '오믈렛', '케이크', '샌드위치', '브런치', '핫플레이스', '나들이']"
오아시스,"[이태원,한남동] 오아시스 (OASIS) 한남점",https://blog.naver.com/sienalis/221151819226,브런치계의 조상님이라고 해도 무방한.... 읭? 청담에서 너무 맛나게 먹었는데 그 오아시스가 한남동에도 생겼어요- 주말 점심시간 좀 지났지만 여전히 핫하디 핫한 오아시스 오픈한지 좀 됐는데 드디어 들렸다는!!!!... ,4.0,"['따뜻한느낌', '이국적', '친절한', '심플한', '치킨', '오믈렛', '케이크', '샌드위치', '브런치', '핫플레이스', '나들이']"
오아시스,"이태원 브런치 카페, 오아시스 한남 : 프렌치토스트가 맛있는 카페",https://blog.naver.com/seul8413/221191015743,"이태원 브런치 카페, 오아시스 한남 프렌치토스트가 맛있는 한남동 브런치 카페 요즘 예약하기 힘든 핫플레이스 중 한 곳인 #오아시스한남 덕분에 오아시스 청담은 조금은 한가해졌을거 같아요, 한달전쯤에는 저녁... ",4.0,"['따뜻한느낌', '이국적', '친절한', '심플한', '치킨', '오믈렛', '케이크', '샌드위치', '브런치', '핫플레이스', '나들이']"
오아시스,이태원 핫한 브런치카페 오아시스 한남 굿!,https://blog.naver.com/jangyah/221147600820,이태원 핫한 브런치카페 오아시스 한남 굿! 다녀온지 몇달 되었는데 추석 연휴 오기 전 지인들과 함께 모임을 가졌던 곳이에요. 청담에 있던 오아시스가 한남에도 오픈을 했어서 꼭 가보고 싶었거든요. 미루다 미루다... ,4.0,"['따뜻한느낌', '이국적', '친절한', '심플한', '치킨', '오믈렛', '케이크', '샌드위치', '브런치', '핫플레이스', '나들이']"
오아시스,라이딩이 오아시스 : 스냅 라이드 남산 브런치 벙개,https://blog.naver.com/jty40/221438013647,사진제공 : @gago_charles 한남동 폴 바셋. 사진제공 : @gago_charles 진정한 사이클리스트 소람소람 사진제공 : @gago_charles 진정한 사이클리스트 고고촬스 사진제공 : @gago_charles 진정한 사이클리스트 헤헤영헤... ,4.0,"['따뜻한느낌', '이국적', '친절한', '심플한', '치킨', '오믈렛', '케이크', '샌드위치', '브런치', '핫플레이스', '나들이']"
오아시스,이태원 브런치카페 오아시스 한남,https://blog.naver.com/cafecurator/221088457723,청담동 브런치카페 오아시스가 한남점을 오픈했어요 청담동에서 꽤나 오래되었지만 오픈때부터 최근까지도 여전히 인기가 많은 브런치카페 오아시스 드디어 2호점을 이태원에 만들었네요 오아시스 한남점... ,4.0,"['따뜻한느낌', '이국적', '친절한', '심플한', '치킨', '오믈렛', '케이크', '샌드위치', '브런치', '핫플레이스', '나들이']"
오아시스,오아시스한남 @ 한남동 브런치카페,https://blog.naver.com/parisunset/221082899957,청담동에서 브런치로 너무나 유명한 오아시스가 한남동에 2호점을 냈다고 해서 주말브런치하고 왔어요 ^^ 청담점은 갈 때마다 사람이 참 많았는데 한남점은 오픈 초기라 여유로워 좋더라구요 워낙 아침 일찍(9시)오픈하는... ,4.0,"['따뜻한느낌', '이국적', '친절한', '심플한', '치킨', '오믈렛', '케이크', '샌드위치', '브런치', '핫플레이스', '나들이']"
오아시스,한남동 브런치 카페 - 오아시스,https://blog.naver.com/bowsuarez/221124854877,한남동 브런치 카페 오아시스 입니다 브런치로 유명한데전 친구와 커피한잔 하구왔어요! 귤나무 - 나도 키우고 싶...네...요.... 화이트톤에 나무들 있는데너무 심플하고 고급스러워서 계속 찰칵찰칵 - 울프강이후 브라우니... ,4.0,"['따뜻한느낌', '이국적', '친절한', '심플한', '치킨', '오믈렛', '케이크', '샌드위치', '브런치', '핫플레이스', '나들이']"
오아시스,한남동 맛집 / 한남동 브런치 / 오아시스 한남,https://blog.naver.com/iiqqppii/221155905419,도심 속 한적한 주택가 오아시스 같은 브런치 레스토랑 주소 / 서울 용산구 이태원로45길 30 (지번 / 한남동 745-10) 전화번호 / 02-790-8906 영업시간 / 09:00 - 22:00 (월요일 휴무) 당일예약 불가 조금은 시끄럽고 도시적인 느낌을... ,4.0,"['따뜻한느낌', '이국적', '친절한', '심플한', '치킨', '오믈렛', '케이크', '샌드위치', '브런치', '핫플레이스', '나들이']"
오아시스,한남동 오아시스 한강진역 이태원역 중간 (브런치),http://store.naver.com/cafeRedirect?cafeUrl=ec0561a91dd6384dba35bc96306539b56973b827112428fb737f193935a06cb4f55962cf1a3117c709cef593cadc6f4a&query=1110133208,"브런치.. 너무 맛있었어요ㅠㅠ 에그베네딕트, 로제파스타(오늘의파스타였어요), 그리고 프렌치토스트였나? 무화과 잼인지 절인건지 올라가있는데 진짜 맛있네요. 브런치 치고 가격이 넘 비싸서 커피는 못 먹었다는...... ",4.0,"['따뜻한느낌', '이국적', '친절한', '심플한', '치킨', '오믈렛', '케이크', '샌드위치', '브런치', '핫플레이스', '나들이']"
오아시스,이태원 브런치카페 [오아시스 한남],http://store.naver.com/cafeRedirect?cafeUrl=ec0561a91dd6384dba35bc96306539b5928a46f9241cc6ba59379f9244ae0b8d971ebe4a1722669e5248642dec550162&query=1110133208,"안녕하세요 :) 날씨 좋은 주말 힙한 브런치카페를 다녀왔어요 이태원에 위치한 브런치카페 ""오아시스"" 한남점으로 꼬우! 점심시간 쯤에 방문했더니 사람이 많아서 30분 이상 대기한거 같아요 배가 고파옵니다.. 내부에... ",4.0,"['따뜻한느낌', '이국적', '친절한', '심플한', '치킨', '오믈렛', '케이크', '샌드위치', '브런치', '핫플레이스', '나들이']"
오아시스,파이어족 : 매월 배당받는 전 세계 배당주 포트폴리오 20년... ,https://blog.naver.com/runnstop/221769303059,"한남동 오아시스에서 친한 친구 부부와 부부동반 모임을 가졌다. 모처럼 마음 편한 사람들과 깊은 속 얘기를 나눌 수 있어서, 행복했다. 신나게 나눈 대화는 내 스트레스를 줄여주었다. 다녀와서 집에서 낮잠을... ",4.0,"['따뜻한느낌', '이국적', '친절한', '심플한', '치킨', '오믈렛', '케이크', '샌드위치', '브런치', '핫플레이스', '나들이']"
오아시스,[한남동 맛집] 오아시스 한남 : 브런치가 맛있는 카페,https://blog.naver.com/ssimyo/221801463058,이른 아침 브런치를 즐길 수 있는 분위기 좋은 카페 일요일 09:00 - 18:00 평일 09:00 - 20:00 브레이크 타임 없음 주차.발렛가능 오늘 오랜만에 지인분들을 한남동에서 만나기로 했어요. 이른 오전 10시에 만나기로 하여서 그때... ,4.0,"['따뜻한느낌', '이국적', '친절한', '심플한', '치킨', '오믈렛', '케이크', '샌드위치', '브런치', '핫플레이스', '나들이']"
