name,title,url,description,score,tags
오아시스,2월 첫 주,https://blog.naver.com/mjasc5555/221797813678,아침 러닝을 다시 시작했다. 올해 목표는 ✔️스페인 산티아고 순례길 완주하기 ✔️서울시 마라톤 완주하기 스페인은 기간제 끝나고 7월 말-8월 즈음 발령 전을 목표로 두고 있다. 체력을 길러야하기 때문에 새벽 러닝과... ,4.0,"['따뜻한느낌', '이국적', '친절한', '심플한', '치킨', '오믈렛', '케이크', '샌드위치', '브런치', '핫플레이스', '나들이']"
오아시스,한남동 오아시스 / 한남동 브런치카페 / 이태원 브런치카페,https://blog.naver.com/yeju1114/221790791935,한남동 브런치카페 오아시스 서울 용산구 이태원로45길 30 오늘은 승혀니와 오전데이트가 있는 날 아무 이유없이 한남동 가자고해서 알겠다고 하구 만나기로 했다ㅎㅎ 만나는 시간이 딱 브런치 먹으면 좋을 시간이라... ,4.0,"['따뜻한느낌', '이국적', '친절한', '심플한', '치킨', '오믈렛', '케이크', '샌드위치', '브런치', '핫플레이스', '나들이']"
오아시스,[sunny_pinkrose’s Taste] 한남 Oasis(오아시스) & 용산 A la... ,https://blog.naver.com/joonim102/221806080416,Rose_sun’s 블로그의 시작을 알리기 위해 일단 첫 게시글 최근 내 최애가 된 곳을 간단히 소개해볼까아ㅏㅏ 1. 한남오아시스(Oasis) 누구든 상상하고 꿈꾸는 여유로운 오전을 즐기기에 딱인 브런치 카페... ,4.0,"['따뜻한느낌', '이국적', '친절한', '심플한', '치킨', '오믈렛', '케이크', '샌드위치', '브런치', '핫플레이스', '나들이']"
오아시스,Oasis (오아시스) / 한남동 브런치 카페,https://blog.naver.com/mystory_is/221795276616,한남동 브런치가게 오아시스 에요 언덕으로 올라가다보면 위치해있어요 흰문으로 되어진 입구로 되어있어요 내부 공간이에요 브런치 카페로 좋은 분위기에요 각테이블별로 공간도 넉넉하게 되어있어요... ,4.0,"['따뜻한느낌', '이국적', '친절한', '심플한', '치킨', '오믈렛', '케이크', '샌드위치', '브런치', '핫플레이스', '나들이']"
오아시스,"한남동 카페, 브런치 맛집 오아시스 한남 (OASIS)",https://blog.naver.com/serendipiter_/221795454426,OASIS CAFE BRUNCH 주택을 개조한 수많은 카페들 중 주택의 공간을 해치지 않고 예쁘게 잘 꾸며 놓은 한남동 오아시스. 입구에는 화분과 허브들을 두어 싱그러운 느낌을 준다. 어디를 가나 눈길을 사로잡는 초록... ,4.0,"['따뜻한느낌', '이국적', '친절한', '심플한', '치킨', '오믈렛', '케이크', '샌드위치', '브런치', '핫플레이스', '나들이']"
오아시스,한남동 맛집 : 브런치 카페 오아시스 급 에그베네딕트 먹으러 갔당,https://blog.naver.com/pinkblue80/221778647805,한남동 브런치 오아시스 Tel. 02-790-8906 Address. 서울 용산구 이태원로45길 30 Open & Close 평일 09:00 - 20:00브레이크 타임 없음 일요일 09:00 - 18:00 나혼자 행복한 급 호캉스에 다음날 아침 일찍 브런치까지 먹으면 너무 좋을 것... ,4.0,"['따뜻한느낌', '이국적', '친절한', '심플한', '치킨', '오믈렛', '케이크', '샌드위치', '브런치', '핫플레이스', '나들이']"
오아시스,이태원 한남동 브런치가 맛있는 '오아시스' 다녀왔어요!,https://blog.naver.com/yonoooon/221772374132,오아시스 한남점 서울 용산구 이태원로45길 30 / 한남동 745-10 평일 09:00 - 20:00 / 브레이크 타임 없음 일요일 09:00 - 18:00 02-790-8906 친구들과 1박2일을 보내게 되면 이튿날 아침은 느지막이 브런치로 즐기게 되는 것 같아요...... ,4.0,"['따뜻한느낌', '이국적', '친절한', '심플한', '치킨', '오믈렛', '케이크', '샌드위치', '브런치', '핫플레이스', '나들이']"
오아시스,한남동 맛집: 브런치가 맛있는곳 '오아시스',https://blog.naver.com/jaelomon87/221778627264,한남동 브런치 맛집 오아시스(OASIS) A형독감을 이겨내고 지난주말에 브런치를 먹으러 오아시스에 다녀왔어요! 가게앞 발렛주차 되니 차량가지고와도 편하게 올수도 있어요~ 가게 외관은 이렇게 생겼습니다. 간판 보이시죠?... ,4.0,"['따뜻한느낌', '이국적', '친절한', '심플한', '치킨', '오믈렛', '케이크', '샌드위치', '브런치', '핫플레이스', '나들이']"
오아시스,오아시스 한남,https://blog.naver.com/stringkiz_/221781678709,"한남동 오아시스 한남 o a s i s b r u n c h 이태원역 2번 출구에서 나와 도로변 사이의 골목길로 꺾어 들어가, 큰 언덕을 하나 넘으면 보이는 오아시스 한남. 나는 한남동에 갈 때면 조금 더 걷더라도 470번 버스를 타고 다닌다.... ",4.0,"['따뜻한느낌', '이국적', '친절한', '심플한', '치킨', '오믈렛', '케이크', '샌드위치', '브런치', '핫플레이스', '나들이']"
오아시스,♥슬♥[맛집][일상] 이태원 브런치 _ 오아시스 한남점,https://blog.naver.com/jrim_/221771595601,아무래도 새로운 코너를 만들어야 할 것 같아요 <권예슬의 리얼로 막쓰는 맛집 코너> 이런거..? ㅋㅋㅋㅋㅋㅋㅋㅋㅋㅋㅋㅋㅋㅋㅋㅋㅋㅋㅋㅋ 사실 블로그 후기를 쓰면서 지원받아서 쓰는 경우에는 열심히 촬영하고... ,4.0,"['따뜻한느낌', '이국적', '친절한', '심플한', '치킨', '오믈렛', '케이크', '샌드위치', '브런치', '핫플레이스', '나들이']"
오아시스,한강진역 한남동 브런치 추천: 오아시스(OASIS),https://blog.naver.com/kjmsg63/221746855696,#한강진역 #이태원역 사이에 위치해 있어요 전 한강진역에서 내려서 걸어갔어요 우리은행이 보이면 다음에나오는 블럭에서 오른쪽으로 쭉 올라가면 오아시스 등장 발렛 해주시는 분도 있었어요 큰 문과 큰 창이 너무... ,4.0,"['따뜻한느낌', '이국적', '친절한', '심플한', '치킨', '오믈렛', '케이크', '샌드위치', '브런치', '핫플레이스', '나들이']"
오아시스,2020년 새해의 한남동 브런치. 오아시스.,https://blog.naver.com/mdhaksu/221760649359,한남동/오아시스/브런치/2020.01/발렛가능/3천원 오아시스 새해의 주말. 커피 한 잔과 즐기기 좋은 여유로운 브런치 카페를 찾아봤다. 한남동에서 핫한지 꽤나 오래된 오아시스 카페. 아메리카노와 즐기기 좋은 메뉴들이... ,4.0,"['따뜻한느낌', '이국적', '친절한', '심플한', '치킨', '오믈렛', '케이크', '샌드위치', '브런치', '핫플레이스', '나들이']"
오아시스,한남동 오아시스 :: 맛있는 브런치,https://blog.naver.com/jimin605/221744190286,지난 화요일 ! 오랜만에 브런치 먹으러 브런치로 유명한 '오아시스'를 다녀왔다 오아시스 한남점 위치 ▼ 르미언니랑 너무 배고픈 상태에서 빠르게 바나나프렌치토스트랑 런치파스타를 주문 ! 깔끔한 플레이팅 내부가... ,4.0,"['따뜻한느낌', '이국적', '친절한', '심플한', '치킨', '오믈렛', '케이크', '샌드위치', '브런치', '핫플레이스', '나들이']"
오아시스,한남동오아시스 브런치카페,https://blog.naver.com/sujin1_park/221753980521,요즘 #한남동 에 핫하다는 브런치 카페를 찾다가..... 방문! 찾아가는길에.. 아주 살짝 언덕이 있다는점..^^ 사우디 대사관 바로 앞이랍니다 입구 부터가 남다름.. 인스타좀 한다는 아줌마들이 애들데리고 카페앞에서... ,4.0,"['따뜻한느낌', '이국적', '친절한', '심플한', '치킨', '오믈렛', '케이크', '샌드위치', '브런치', '핫플레이스', '나들이']"
오아시스,"한남동 - 브런치 카페 ""오아시스"" 한남점",https://blog.naver.com/real_sunny/221723883760,"오아시스의 브런치의 명성은 예전부터 익히 들어왔던터라, 한남동에 놀러 가는 김에 오아시스 한남점을 갔다. 이태원과 한강진 사이의 고급 주택가에 위치해 있었는데, 가게도 원래 일반 집이었던 곳을 그대로 사용하는 것... ",4.0,"['따뜻한느낌', '이국적', '친절한', '심플한', '치킨', '오믈렛', '케이크', '샌드위치', '브런치', '핫플레이스', '나들이']"
오아시스,[한남동 브런치 카페] 오아시스 한남,https://blog.naver.com/dink206/221759445433,"한남동 브런치카페 오아시스 한남 안녕하세요 저는 어제 한남동 브런치 맛집 카페 오아시스를 다녀왔어요 ㅎㅎ 10:30분쯤 방문했는데도 사람이 1층은 거의 꽉 차 있더라구요....! 저는 에그베네딕트 훈제연어(₩19,500)... ",4.0,"['따뜻한느낌', '이국적', '친절한', '심플한', '치킨', '오믈렛', '케이크', '샌드위치', '브런치', '핫플레이스', '나들이']"
오아시스,한남동 브런치 카페 오아시스를 다녀왔어요 !,https://blog.naver.com/junseok0227/221711078173,"주소 : 서울 용산구 이태원로45길 30 영업시간 : - 평일 : 09:00~20:00 - 일요일 : 09:00~18:00 주차 : 발렛 이용 (1시간 30분 3,000원/이후 10분 1,000원) 한남동 브런치 카페 오아시스를 다녀왔습니다. 프렌치 토스트가 어찌나 먹고... ",4.0,"['따뜻한느낌', '이국적', '친절한', '심플한', '치킨', '오믈렛', '케이크', '샌드위치', '브런치', '핫플레이스', '나들이']"
오아시스,이른 시간부터 브런치를 즐길 수 있는 한남동 오아시스,https://blog.naver.com/daeun4452/221780273916,내게는 아주 오래전부터 브런치에 대한 야망과 꿈이 있었다 ㅋㅋㅋㅋㅋㅋ 간단하면서도 참 집에서 해먹으려면 일단 재료 구입부터 일인 브런치.. 피그인더가든 퀴노아바질 미니샐러드 COUPANG coupa.ng 파트너스 활동을... ,4.0,"['따뜻한느낌', '이국적', '친절한', '심플한', '치킨', '오믈렛', '케이크', '샌드위치', '브런치', '핫플레이스', '나들이']"
