name,title,url,description,score,tags
이태원곱,이태원 단체 : 압도적인 비주얼을 자랑하는 소곱창전문점 이태원곱,https://blog.naver.com/mystic_rose91/221703825587,이태원곱 *영업시간 : 매일 15:00~02:00 금/토 15:00~03:00 *주소 : 서울 용산구 이태원로19길 5 1층 *예약전화 : ***-****-**** 요즘들어 곱창에 빠진 저희 커플+_+! 자주 가는 이태원에 분위기 좋고 곱창이 맛있기로 입소문 타고 있는... ,5.0,[]
이태원곱,"이태원 회식 / 이태원 소곱창 - 이태원곱 (모듬 2인, 셀프철판볶음밥)",https://blog.naver.com/324th/221726182723,안녕하세요 체리입니당 ㅎㅎ 요즘 피치가 열심히 해 줘서 오랜만에 온 느낌이네요 ㅠ ㅠ 그런 의미에서(?)ㅋㅋㅋㅋ 피치와 다른 칭구와 저희만의 이태원 회식을 하고 온 !!!!!!!!! 이태원 소곱창 이태원곱 리뷰를 적어 보러... ,5.0,[]
이태원곱,이태원곱 / 이태원 맛집 / 이태원소곱창 / 이태원 곱창맛집 / 모듬곱창... ,https://blog.naver.com/ikaros84/221729484404,이태원 맛집 이태원곱 ♡ 모듬곱창 (feat. 진로토닉 ♡) - 내돈내산 솔직후기♡ - 내가 가자고~~ 가자고 졸라도 매번 자기 좋아하는 닭발만 먹으러가던 짝꿍이 드디어 내 소원을 들어주었당ㅋㅋ 드디어 가보는 #이태원곱... ,5.0,[]
이태원곱,"[이태원맛집/이태원곱창] 리얼곱이 빵방 ""이태원 곱""_별 세개 ★★★",https://blog.naver.com/sindongyj/221637446842,※ 포스팅 내 조선시대 말투 주의 ※ 주인장이 미스터선샤인에 뒤늦게 빠져있는 관계로 말투 이상함. 요 몇일 굽는 고기 많이 먹었으니 기름지고 느끼한게 생각나서 열심히 곱창집 서칭 좀 해봤다. 그러던 중 데이뚜를... ,5.0,[]
이태원곱,[이태원/곱창] 이태원에서 맛있는 곱창을 먹고 싶다면 ? ‘이태원곱’으로,https://blog.naver.com/lsu5482/221716463531,오늘은 이태원 곱창 맛집 이태원곱에 방문했어요 ! 간판도 엄청 갬성있죠 ~??! 오늘은 바로 곱창 먹는 날 !! 곱창 먹을 생각에 떨리더라고요 ㅎㅎ 옆으로 미는걸 잊지 마세요 ! 저는 당기기도 하고 밀기도 해서 왜 안열리나... ,5.0,[]
이태원곱,[이태원역]이태원곱,https://blog.naver.com/yunha1188/221732239479,"[이태원역] 이태원곱 ✔️ 모듬 (1인분 기준) :: 16,800원 ✔️ 셀프 철판 볶음밥 (1.5인분) :: 5,000원 ✔️ 봄베이 하이볼 :: 8,000원 오늘..은 아니지만 저번주에 이태원역에 위치해있는 이태원곱을 다녀왔다 >__________< 글을 따로... ",5.0,[]
이태원곱,이태원곱창 맛집 찾는다면 이태원곱으로! +이태원할로윈,https://blog.naver.com/sarah_1227_/221701426730,"10월 31일 할로윈데이 HAPPY HALLOWEEN! 너무나 뒷북이지만 ㅋㅋㅋㅋㅋ 나름,, 할로윈데이에 이태원을 찾았다. 퇴근하고 여진이랑 카페에 갔다가 이태원으로 고고링 마침 날짜가 할로윈에 맞았던 거지만 ㅎㅎ 이태원곱창... ",5.0,[]
이태원곱,이태원맛집추천 :: '이태원곱' 곱창막창대창을 한번에~양대박많음~,https://blog.naver.com/seoyoojin96/221702182417,날이 점점 추워지는 것 같아요!! 요즘같은 날씨에는 배에 기름칠을 좀 해줘야겠죠?! 오늘 리뷰할 곳은 이태원에 위치한 막창맛집 '이태원곱' 위치는 이태원1번출구에서 나와서 걸어서 5분정도. 추운날 많이걸으면... ,5.0,[]
이태원곱,"이태원 소곱창 : 이태원곱,가성비 좋은 곱창집",https://blog.naver.com/thddl0413/221676668720,"ㅋㅋㅋㅋㅋㅋㅋㅋㅋㅋㅋㅋㅋㅋㅋ 늼들 저 스티커 샀어요 귀엽쥬? 요즘 금요일마다 이태원 출석 중입니다 이태원 못 잃어,~~~! 오늘 1차는 너다. 이태원 소곱창 맛집 이태원곱. 이태원역 1번 출구 메인 거리 맨 끝 쪽에... ",5.0,[]
이태원곱,이태원 곱창 맛집 :: 이태원 회식 장소로도 좋은 이태원곱♬,https://blog.naver.com/mnlee0204/221684957097,이태원 곱창 맛집 '이태원곱' 소규모 이태원 회식 장소로도 좋아요! 매일 15:00-02:00 안녕하세요 이웃님들 +ㅡ+ 오늘은 이태원 곱창 맛집 이태원곱 포스팅으로 인사드려요 ^ㅡ^ 참... 곱창은 언제 먹어도 맛있어요 ㅠㅡㅠ 먹을... ,5.0,[]
이태원곱,이태원 회식장소 이태원곱 어떨까요?,https://blog.naver.com/ryovvely/221665711960,"이태원 회식장소 이태원 곱 주소 : 서울 용산구 이태원로 19길 5 영업시간 : 매일 15:00 - 24:00 전화번호 : 010 - 6858-9595 주차여부 : 불가능 (용산구청이나 하나은행, 커피스미스 주차장 이용) 대기 : 주말에는 있는듯 지난 평일... ",5.0,[]
이태원곱,〔 이태원 곱창 맛집 | 이태원곱 〕 모듬곱창에 살얼음생맥주 존맛탱,https://blog.naver.com/cinnamon0412/221663148273,어제 다녀온 따끈따끈한 #이태원곱창 맛집 후기. 친절하고 맛있고 인스타각 제대로 나오는 이태원 핫플이에요 ~ 올만에 먹어서 더 맛있었던 모듬곱창에 시원한 살얼음생맥주 조합 최고  역세권이라 접근성도 좋은... ,5.0,[]
이태원곱,이태원 단체 회식으로도 부담없는 곱창집,https://blog.naver.com/wnfks1/221701438274,이태원 단체 회식으로 부담없는 가격인 곱창집 마지막으로 2차 3차 술집으로 아주굿인 저렴한곱창 가격 대박 이태원에 가면 저는 서울에서 회사를 다니는것이 아니라서 단체 회식을 이태원에서 한적은 한번도 없고..... ,5.0,[]
이태원곱,이태원 회식 이태원곱 소곱창 짜응,https://blog.naver.com/bodornim22/221608657389,금요일 퇴근하고 이태원에 소곱창 먹으러 다녀왔어요 이태원 회식 하기 좋은곳으로 이태원곱 여기가 유명하더라구요 :) 그래서 먹으러 다녀왔답니다 후후 여름이라 사실 긴장했거든요 아 더우면 어쩌지 하고 걱정했는데... ,5.0,[]
이태원곱,[이태원 곱]가성비 최강의 소곱창 맛집~이태원 터줏대감같은 오픈... ,https://blog.naver.com/dorya/221535175184,"이제 겨우 두 달 된 이태원 곱은 그 뛰어난 맛과 가성비로 인해, 이미 인산인해입니다. 인기가 엄청나게 많고,손님들도 계속 웨이팅이 걸리는 맛집이예요. 모듬 소곱창 1인분이 16,800원!!!! 꺄아아~ 실화냐~ 화사언니... ",5.0,[]
이태원곱,[이태원 곱] 가성비좋고 비쥬얼도 좋은 시선강탈 이태원 핫~플 !!!,https://blog.naver.com/moonhouse123/221671657313,[문혜욱 공인중개사 사무소] 딱써니 쑤기 입니다 다양한 음식과 개성이 넘치는 이태원 자주 가는 곳은 아니지만 특색있고 이색적인 식당들이 많아 늘~볼거리가 많더라구욤 지난주말 지인들과의 만남으로 급 결정된... ,5.0,[]
이태원곱,이태원 곱창맛집 이태원곱에서 모듬곱창 조졌음,https://blog.naver.com/ddongssa37/221665662544,이태원 곱창맛집 이태원곱 지하철 6호선 이태원역에서 엄청나게 가까운 이태원 곱창맛집에 다녀왔어요 해밀톤호텔 1번 출구쪽으로 나오면 진짜 금방 도착해요 ㅋㅋㅋㅋㅋㅋㅋㅋㅋㅋㅋㅋ 이태원 곱창맛집 이태원곱... ,5.0,[]
이태원곱,이태원곱창 : 이태원데이트 핫플이라는 이태원곱에서 친구들이랑... ,https://blog.naver.com/shmwlals/221584079357,요즘은 곱창집에서 데이트한다고 하던데 이태원데이트 코스로 곱창이 각인가욤 오랜만에 저도 친구들 만나서 이태원에서 곱창이 맛깔난다고 소문이 아주 자자한!! 이태원곱에 다녀왔습니당 이태원곱은 이태원역 1번출구... ,5.0,[]
이태원곱,이태원/곱창 : 가성비 좋은 이태원곱,https://blog.naver.com/anjuhee4258/221616404041,오랜만에 밍키와 데이튜.. #이태원 #곱창 조지기로 해서 만났당 두근두근 곱창 먹을 생각에 오늘 얼마나 설렜는지 ㅠㅠ 우리가 먹은 곳은 #이태원곱 이태원역 1번 출구에서 5분 정도 걸었다 갬성적인 곱창집간판 들어가보니... ,5.0,[]
이태원곱,"[이태원/핫플/곱창] 감성돋는 곱창집 이태원 ""곱""",https://blog.naver.com/najs1685/221688252239,"#이태원#곱창#이태원곱 기억을 더듬으면서 이태원곱창집을 리뷰 하겠습니다~ 감성적인 이태원곱창집 ""이태원 곱"" #이태원#이태원곱창#이태원곱 이태원 화합에서 부실하게 먹었던 저희는 눈에 띄던 곱창집으로... ",5.0,[]
이태원곱,이태원 단체 손님 환영 ! 이태원곱창 '곱',https://blog.naver.com/seraphic_xx/221684820939,이태원에서 제일 맛있다는 곱창집 이태원 곱 입니다 ! 사람 지인짜 ! 많더라고요 와 여기가 이태원곱창 핫플이구나 생각했어요 :) 단체로 오시는 분들 많더라고요 이태원곱에 단체 좌석이 있어서 20명씩 와도 상관 없을... ,5.0,[]
이태원곱,"이태원 곱창 맛집 이태원곱, 소곱창 모듬곱창 & 생맥주 JMT",https://blog.naver.com/micky_o0o/221570089951,"@ 이태원곱 소곱창, 대창, 곱창 JMT 영업시간 15 : 00 - 24 : 00 (금,토 - 02 : 00) 항상 이태원에 가면 피자나 타코와 같은 외국 음식을 먹었던 것 같은데 이번에는 이태원을 가긴했지만 곱창이 먹고싶어서 곱창을 먹으러 갔다 : )... ",5.0,[]
이태원곱,이태원 곱_이태원 맛집(저렴하고 양이 많아 회식으로도 좋은 맛집),https://blog.naver.com/justone486/221678299519,오늘은 이태원 지구촌 축제가 열린대서 이태원으로 놀러 갔어요 낮에는 이태원 지구촌 축제를 즐기고나서 밤까지도 정말 많은 인파에 요기조기 휩쓸려 다니다가 저녁으로 곱창이 먹고 싶어 간 곳은 바로 이태원 곱!... ,5.0,[]
이태원곱,[서울/이태원] 이태원 곱,https://blog.naver.com/seomj1__9/221703087842,곱 도착하기 전에 보았던 터키 빵집 유퀴즈에 나온 곳이라 그런지 사람이 꽤 있었다 걸려있던 유느님 옷걸이 ㅋㅋㅋㅋㅋㅋㅋㅋㅋㅋㅋㅋㅋㅋㅋㅋㅋㅋㅋ 갑분곱 우리가 주문했던 메뉴는 3인분 곱창+우삼겹 전골 세트에... ,5.0,[]
이태원곱,"이태원 곱창 : 이태원곱, 가성비 터지는데 배부른 곱창집",https://blog.naver.com/thddl0413/221596983737,내가 곱창집에 가는날은 김나둥이랑 노는날 단 하루 뿐. 곱창을 즐기지 않는 나도 맛있게 먹고 왔던 이태원 곱창집 이태원 곱ㅋ 오늘 이태원에서 접선이 있었기 때문에 이태원으로 향했다. 주소 : 이태원동 168-3 번지... ,5.0,[]
이태원곱,이태원 곱창 개존맛집 이태원 곱 웨이팅 이겨낼만하다,https://blog.naver.com/dmstjgod/221636490006,얼마전에 진삼씨랑 다녀온 이태원 곱창 존맛탱집 사실 이태원가서 무슨 곱창이야 하겠지만 여기 가봤어요 ? 꼭 가야되요 이태원 1번출구랑 엄청 가까웠어요! 요기 골목에 비노친친도 있고 찰*네도 있더라구여 지구 최강... ,5.0,[]
이태원곱,이태원 곱창 맛집 이태원곱,https://blog.naver.com/sooyoun13/221606101662,"이태원 곱창 맛집 이태원 곱 주소 서울 용산구 이태원로19길 5 영업시간 매일 15:00 - 24:00 / 금,토 15:00 - 02:00 남편이랑 이태원에 곱창 먹으러 다녀왔당! 이태원에서 유명한 맛집 이태원곱이 그 곳- 외관부터 눈길을 끄는... ",5.0,[]
이태원곱,이태원 곱창집 곱 가성비 세트메뉴 괜찮네,https://blog.naver.com/captain90dy/221598557400,"세 줄 요약 1. 가성비 세트 무조건 추천합니다. 2. 매운 거 싫으면 우삼겹백짬뽕으로 선택 3. 둘이서 적당하고 알맞게 먹었어요. 이태원 곱창집 곱 메뉴 가격 가성비 세트 A 46,400 콜라 2,500 ㅡㅡㅡㅡㅡㅡㅡㅡㅡㅡㅡㅡㅡㅡㅡ... ",5.0,[]
이태원곱,이태원맛집 : 맛있는 곱창에 살얼음 생맥이 최고! 이태원 회식하면... ,https://blog.naver.com/hy_goddess/221603259470,저의 단골집 이태원 부산집 골목에 위치한 이태원곱! 예전에 홍석천아저씨 레스토랑이었는데 곱창집으로 바뀌었더라고요 새로 생겼으니까 궁그미궁그미~.~ 엇그제 퇴사했으니까 이제 현대가 전 회사가 되었고 전전회사인... ,5.0,[]
이태원곱,이태원 나드으리~!,https://blog.naver.com/ksm5372023/221664232250,"친구랑 곱창이 너어어어어어ㅓ엉무 먹고 싶어서 이태원까지 곱창먹으러 간 수민 여기는 요새 핫하다는 이태원곱 모둠을 시켰다 메뉴판을 안찍은 나는 아직도 블로거가 아니야,, 2인 세트로 딱 먹기 좋은 세트가 있으요... ",5.0,[]
이태원곱,이태원 가성비 맛집 이거지. 곱창 못먹어도 만사OK “이태원곱”,https://blog.naver.com/ilee2008/221606533532,이제는 차 없으면 어디 나갈 엄두도 못하는 햄니쓰^^ 너무 더워요 무조건 택시 아니면 자차 / 남차 이용 약속 잡기도 싫고 의욕도 없고.. 할것도없어서 오빠랑 이태원 다녀왔어요 다리만 건너면 이태원인데 무족권 차... ,5.0,[]
이태원곱,"이태원 곱창 : 곱, 저렴하게 소곱창 맛있게 먹기",https://blog.naver.com/hayoon92/221699460969,이태원으로 곱창 먹고 왔아요 >.< 빨리 외근으로 이태원 퇴근한 날 놓칠 수 없지~ 할로윈 전이라서 이렇게 꾸며져 있엉 짱짱 흥나고 그래~ 6시도 안되어서 일찍 왔더니 세상 여유롭다 조앙 모듬 2인분에 진로토닉 먹을 거얏... ,5.0,[]
이태원곱,이태원 곱창 이태원곱에서 시원하게 맥주한잔 하고 왔습니다!!,https://blog.naver.com/hdn0525/221601121627,이태원곱창 맛집 이태원곱 안녕하세요 탈잉 블로그 강사 한동남입니다. 비오는 날에 소주가 생각나 이태원 곱창 맛집으로 소문난 이태원곱에 다녀왔습니다. 인스타에 이태원 곱창 찾아보다 비쥬얼보고 한번 반하고... ,5.0,[]
이태원곱,[이태원데이트/이태원곱창] 힙스터들의 최애 맛집 _ 이태원 곱,https://blog.naver.com/truei1113/221570949394,"요새 이태원에 핫플레이스가 많이 생겨서 자꾸 가게 된다. 지난 번에 왔을 때 지나가다가 보고 담번에 가야지 했던 #이태원곱창 집, #이태원곱 에 드디어 갔다왔다 :) 1번 출구 3분 거리라 접근성 최고. 줄서서 먹는... ",5.0,[]
이태원곱,[이태원 곱창] 이태원곱 〰️,https://blog.naver.com/ljw2052/221618701941,"오늘부터 저는 휴가입니다  그래서 퇴근하고 4년 (?) 만에 이태원에 곱창을 먹으러 다녀왔다. #이태원곱 저녁 7시 좀 넘어서 들어갔는데 웨이팅도 없고, 시원한 자리로 착석! 우리는 모듬 2인과 맥주 두잔이 들어있는... ",5.0,[]
이태원곱,이태원 맛집 / 맛과 가격이 다 착한 갓성비 ‘이태원곱’,https://blog.naver.com/gldbd/221608521835,"이태원 프리덤〰️ 그 많고많은 #이태원맛집 중에 요즘 꽂힌 곱창먹으러 !!!!!! #이태원곱창 #곱 여기는 체인으로 알고있는데 , 저렴하고 맛있게 먹을수 있다는 말에 지인추천으로 다녀왔어용:) 곱게 말할 때 곱창 먹으러... ",5.0,[]
이태원곱,[이태원 맛집]이태원 소곱창 맛집 이태원곱 살얼음맥주와 꿀조합!,https://blog.naver.com/fbgid1023/221549457428,이태원에 맛있는 곱창집이 있다고 해서 방문했어요! 사실 곱창엔 소주가 더 땡기는 1인이지만 살얼음맥주와 굳이 고르자면.. 저는 맥주로 갑니다 ㅎㅎ 이태원에 지금 핫한 살얼음맥주! 한번 드시러 가보세요~ 술술... ,5.0,[]
이태원곱,"이태원 회식 이태원곱, 시원한 살얼음 생맥주와 곱창구이",https://blog.naver.com/mkdkrk/221608790864,"이태원 회식 이태원곱, 시원한 살얼음 생맥주와 곱창구이 간만에 술한잔 마시러 찾아간 이태원... 예전엔 참 많이 찾아갔던 곳인데 요즘은 예전 같지가 않죠... 그래도 가끔은 이태원에서 한잔 마실 때가 있는데 이날이 바로... ",5.0,[]
이태원곱,이태원 데이트 살얼음생맥 시원하게 캬~ 이태원곱 배불리 냠냠,https://blog.naver.com/lsy0318/221578987245,언제나 먹어도 맛있는 곱창 -! 이태원 데이트 즐기기 좋은 이태원곱가서 엄청 배불리 식사하고 왔어요 여기가시면 살얼음생맥주 완전 강추 -! 정말 너무나도 시원하고 생맥 넘 맛있어서 정말 술술술 들어가더라구요... ,5.0,[]
