name,title,url,description,score,tags
탄탈라이즈,[라떼뷰]탄탈라이즈 플랫화이트,https://blog.naver.com/binyoung92/221762158414,이름 : 탄탈라이즈 (Tantalize) 주소 : 서울 용산구 이태원로20가길 7-6 가격 : 6000원 평점 : 7.5/10 음료 : 플랫화이트 (iced) 이태원에 가면 꼭 들리는 카페 '탄탈라이즈'입니다. 스콘 맛집으로 알고 간 곳이지만 커피 맛에 반해... ,4.0,"['감각적인', '심플한', '카페', '브라우니', '스콘', '디저트', '케이크', '사진찍기']"
탄탈라이즈,[맛집]이태원 탄탈라이즈 카페 / 디저트가 맛있는 카페 / 진한커피집... ,https://blog.naver.com/leelee_jo/221762853549,"추위를 피해 들어온 이태원의 디저트 맛집 탄탈라이즈 카페. 음료 메뉴는 단조로운편. 디저트 맛집인데 디저트를 안 먹고 와서 너무나 후회했다ㅜㅜ 입에 맞지 않는 비싼 커피나 마시고 오고,, 흑흑 기회가 된다면 블루베리... ",4.0,"['감각적인', '심플한', '카페', '브라우니', '스콘', '디저트', '케이크', '사진찍기']"
탄탈라이즈,ᴍʏ ʙɪʀᴛʜᴅᴀʏ-2-,https://blog.naver.com/sm3564/221760146223,2020.01.01.수 “21번째 생일파티” 숨-하 오늘은 대학교 친구들이랑 이태원에서 만나기로 했다!♥️ 지하철역 지하철 기다리는 중 태어나서 처음으로 ‘우이신설선’ 을 타봤다. 이태원 갈 때 원래는 4호선 삼각지역에서... ,4.0,"['감각적인', '심플한', '카페', '브라우니', '스콘', '디저트', '케이크', '사진찍기']"
탄탈라이즈,"[이태원 맛집/카페] 고퀄리티 커피와 디저트, 분위기 좋은 '탄탈라이즈... ",https://blog.naver.com/94qkralfl/221763039560,"[이태원 맛집/카페] 고퀄리티 커피와 디저트, 분위기 좋은 '탄탈라이즈 커피' 후기! 먹기로 맛집 탐방 10 안녕하세요-! 빨리 찍고, 열심히 먹고, 솔직하게 리뷰하는 먹기로입니다! 오늘은 이태원 핫한 카페! 분위기도... ",4.0,"['감각적인', '심플한', '카페', '브라우니', '스콘', '디저트', '케이크', '사진찍기']"
탄탈라이즈,"[이태원 카페] 스콘 맛집으로 유명한 ""탄탈라이즈"" 솔직 후기",https://blog.naver.com/parkhaeree26/221755610535,"안녕하세요! Harrysia입니다. 오늘은 이태원에 위치한 스콘 맛집으로 유명한 ""탄탈라이즈""를 다녀왔습니다! 위치는 아래 참고하세요 파운드 케잌과 스콘들 탄탈라이즈는 스콘이 유명하다고 해서 얼그레이 스콘과... ",4.0,"['감각적인', '심플한', '카페', '브라우니', '스콘', '디저트', '케이크', '사진찍기']"
탄탈라이즈,이태원 탄탈라이즈,http://store.naver.com/cafeRedirect?cafeUrl=ec0561a91dd6384dba35bc96306539b52961f9fc61ebceb012afd8d305427772dd841eee8c93dead6670b0eaef526181&query=195525006,이태원에 위치한 탄탈라이즈 라는 카페입니다 :) 사진 분위기가 예쁘게 나와서 너무 좋아요 여러분들도 한번 가보시길 추천드려요! ,4.0,"['감각적인', '심플한', '카페', '브라우니', '스콘', '디저트', '케이크', '사진찍기']"
