name,title,url,description,score,tags
할랄가이즈,할랄가이즈 - 뉴욕에서 들어온 이태원 할랄푸드,https://blog.naver.com/elixir0827/221810776948,뉴욕에서 할랄푸드로 유명한 할랄가이즈 할랄푸드 자체가 뉴욕에 리어카 같은걸로 많이 파는데 그중 한국에 들어온건 여기 하나뿐이긴 합니다. 현지에 가면 이거 말고도 유명한 애들이 몇 있는데 일단 한국에 들어온게... ,5.0,"['재미있는', '고급진', '이국적', '친절하고', '깨끗한', '치킨', '길거리음식', '중동음식', '샌드위치', '양고기', '나들이', '신선한', '데이트', '재방문', '핫플레이스']"
할랄가이즈,"이태원 할랄가이즈, 맛있게 할랄푸드 즐기기~",https://blog.naver.com/bom25bom/221798415854,얼마 전 ' 정해인의 걸어보고서 ' 를 봤는데 할랄가이즈 뉴욕본점에 가서 너무 맛있게 먹는 것을 봤어요. 저랑 신랑 둘 다 여기는 가본 적은 없지만 할랄푸드를 좋아라하기 때문에 넘나 땡기더라고요. 정해인이 진짜 맛있게... ,5.0,"['재미있는', '고급진', '이국적', '친절하고', '깨끗한', '치킨', '길거리음식', '중동음식', '샌드위치', '양고기', '나들이', '신선한', '데이트', '재방문', '핫플레이스']"
할랄가이즈,"[이태원 맛집] 뉴욕 소울푸드 추천, 이태원 ‘할랄가이즈’",https://blog.naver.com/hahao_ob/221736055023,정해인의 걸어보고서 1편을 보고 넘나 생각하던 할랄가이즈ㅠㅠㅠㅠㅠㅠㅠㅠ 새벽에 혼자 페북 사진첩 들어가서 추억팔이 함 라면이랑 먹으면 존맛인데 ㅎ 그 몇일 눈독 들이다가 결국 신션 꼬셔서 간 #이태원 #할랄가이즈... ,5.0,"['재미있는', '고급진', '이국적', '친절하고', '깨끗한', '치킨', '길거리음식', '중동음식', '샌드위치', '양고기', '나들이', '신선한', '데이트', '재방문', '핫플레이스']"
할랄가이즈,할랄가이즈 이태원,https://blog.naver.com/jiroharu/221728278354,"플래터 스몰 사이즈, 샌드위치 레귤러, 허머스 큰 기대없이 그냥 호기심에 가본 할랄가이즈. 별 거 없는 것 같은데 은근히 맛있네. 맛있다를 한 다섯번쯤 말한 듯. 핫소스는 먹을 땐 그냥 아 맵다 정도였는데, 먹고 나니... ",5.0,"['재미있는', '고급진', '이국적', '친절하고', '깨끗한', '치킨', '길거리음식', '중동음식', '샌드위치', '양고기', '나들이', '신선한', '데이트', '재방문', '핫플레이스']"
할랄가이즈,"강추▶ 뉴욕 푸드트럭의 성공신화! 이태원 맛집, 할랄가이즈",https://blog.naver.com/zone7878/221700294894,"[할랄가이즈 이태원점] - 주소 : 서울시 용산구 이태원로 187-2층 The Halal Guys - 영업시간 : 일,월,화,수,목 11:00 ~ 22:00 금,토 11:00 ~ 04:00 [연중무휴] - 전화 : 02 - 794 - 8308 [배달가능] - 주차 : 주차장 X 안녕 친구들!! 서울... ",5.0,"['재미있는', '고급진', '이국적', '친절하고', '깨끗한', '치킨', '길거리음식', '중동음식', '샌드위치', '양고기', '나들이', '신선한', '데이트', '재방문', '핫플레이스']"
할랄가이즈,▷[이태원 맛집] 할랄가이즈 성공적~~,https://blog.naver.com/rnalgh5746/221697127828,10월의 마지막 날 10/31 하필이면 마지막 날 재수없는 일이 있어서 기분이 말이 아니었다 그래서 원래는 공부하려 했는데 할로윈이기도 하고 기분도 안 좋고 그래서 이태원을 가기로!! 기원언니 팀플 끝날때까지 기다렸다가... ,5.0,"['재미있는', '고급진', '이국적', '친절하고', '깨끗한', '치킨', '길거리음식', '중동음식', '샌드위치', '양고기', '나들이', '신선한', '데이트', '재방문', '핫플레이스']"
할랄가이즈,"[이태원 - 산책 후 옥상(루프탑)에서] 와인, 소주 & 할랄가이즈... ",https://blog.naver.com/ginger176/221694927502,"- Written By GINGER - 흔한 토요일 이태원 거리 풍경. 앤틱가구거리엔 상점마다 길에 제품들을 꺼내 손님을 끈다. 뭐, 건질 것 좀 없나? 토요일이라고 예전처럼 북적대진 않더라. 난 탈 거 중엔 자동차만 좋다.ㅎㅎ 10년전 쯤... ",5.0,"['재미있는', '고급진', '이국적', '친절하고', '깨끗한', '치킨', '길거리음식', '중동음식', '샌드위치', '양고기', '나들이', '신선한', '데이트', '재방문', '핫플레이스']"
할랄가이즈,이태원맛집! 뉴욕에서들어온!!!!할랄가이즈!,https://blog.naver.com/yuyu8447/221813711861,어제! 친구랑 이태원역에가서 할랄가이즈를 먹어보았어요!!!! 친구가엄청맛있다고..끌고 간 곳이에여..! 뉴욕에서들어온 할랄푸드라고 하더라구요! 이태원역 2번출구에서 46미터! 직진! 2층이에요~ 주문은 서브웨이형식이라... ,5.0,"['재미있는', '고급진', '이국적', '친절하고', '깨끗한', '치킨', '길거리음식', '중동음식', '샌드위치', '양고기', '나들이', '신선한', '데이트', '재방문', '핫플레이스']"
할랄가이즈,뉴욕맛집 할랄가이즈 이태원에 상륙하다.,http://store.naver.com/cafeRedirect?cafeUrl=ec0561a91dd6384dba35bc96306539b537f060d5e79c90a677f70c7a099d2345a65e12221ac108cd9aa866f8f82c6534&query=54363337,"뉴욕맛집 이태원 할랄가이즈 THE Halal Guys 플래터 11,900원샌드위치 / 플래터 모두 사이즈에 따라 7,900~11,900원이다. 저 화이트소스와 핫소스가 중독성있는 맛.실제로 많은 사람들이 주문할 때 바닥이 안보일정도로... ",5.0,"['재미있는', '고급진', '이국적', '친절하고', '깨끗한', '치킨', '길거리음식', '중동음식', '샌드위치', '양고기', '나들이', '신선한', '데이트', '재방문', '핫플레이스']"
할랄가이즈,"이태원 할랄가이즈 , 미국 추억 소환 ♥ 역시 맛있어 !",https://blog.naver.com/love1318js/221629778795,"이태원 할랄가이즈, 미국 푸드트럭 먹던 맛 그대로 소환 ♥ 동생이랑 피부과 갔다가 미국 추억 소환 겸 - 부천에서 나오지 않은 동생이 모처럼 서울 왔으니 같이 할랄가이즈 방문했다. 미국 트럭에서 판매하는 할랄가이즈... ",5.0,"['재미있는', '고급진', '이국적', '친절하고', '깨끗한', '치킨', '길거리음식', '중동음식', '샌드위치', '양고기', '나들이', '신선한', '데이트', '재방문', '핫플레이스']"
할랄가이즈,이태원 맛집 저렴한 할랄가이즈,https://blog.naver.com/gagamell20/221582209303,"요즘 남편이 스파이더맨 게임을 즐겨하는데 거기 배경이 뉴욕이라고 한다. 게임을 틀어놓고 나를 옆에 앉히더니 스파이더맨이 슝슝 날아다니는 거리를 보여주며 여기는 무슨 빌딩, 여기는 무슨 공원, 여기는 뭐가... ",5.0,"['재미있는', '고급진', '이국적', '친절하고', '깨끗한', '치킨', '길거리음식', '중동음식', '샌드위치', '양고기', '나들이', '신선한', '데이트', '재방문', '핫플레이스']"
할랄가이즈,이태원 할랄가이즈 언제나 맛있어,https://blog.naver.com/gaesiki18/221642142970,"안뇽하세요 차짠입니당~ 오랜만에 이태원에 갔었는데, 아침을 거른 상태가 몹시 배가고프더라구요. 이태원은 세계 각지의 다양한 음식을 파는곳이 많아 뭘 먹을지 항상 고민을 했는데요. 이날은 유독 할랄가이즈가... ",5.0,"['재미있는', '고급진', '이국적', '친절하고', '깨끗한', '치킨', '길거리음식', '중동음식', '샌드위치', '양고기', '나들이', '신선한', '데이트', '재방문', '핫플레이스']"
할랄가이즈,뉴욕3대 맛집 / 이태원에서 점심 고민 끝 '할랄가이즈 ',https://blog.naver.com/zamtangei/221267815620,"할랄가이즈 이태원점 평일 오전 11:00~23:00 금, 토 11:00~24:00 서울특별시 용산구 보광로59길 32 1층 저스트뉴욕베이글 02-794-8308 #뉴욕3대맛집 이라하면 쉑쉑버거 저스트뉴욕베이글 그리고 할랄가이즈! 유겸이가 질할브로스... ",5.0,"['재미있는', '고급진', '이국적', '친절하고', '깨끗한', '치킨', '길거리음식', '중동음식', '샌드위치', '양고기', '나들이', '신선한', '데이트', '재방문', '핫플레이스']"
할랄가이즈,"이태원 맛집 저렴해서 좋다 "" 할랄가이즈 """,https://blog.naver.com/lovelyul_/221509267048,이태원 맛집 저렴해~ 할랄가이즈 서울시 용산구 이태원로 187 2층 이태원 맛집 저렴 우리민이 시험끝내고 이태원에 떴다!! 오랫동안은 아니지만 근 몇개월간 열공하고 처음으로 시험보고나서 우리는 기분전환 겸... ,5.0,"['재미있는', '고급진', '이국적', '친절하고', '깨끗한', '치킨', '길거리음식', '중동음식', '샌드위치', '양고기', '나들이', '신선한', '데이트', '재방문', '핫플레이스']"
할랄가이즈,[이태원] 뉴욕의 핫한 푸드트럭! 할랄가이즈!!,https://blog.naver.com/goms1101/221808186997,뉴욕의 소울푸드! 할랄 푸드! 할랄가이즈!!! 내가 뉴욕갔을 때 할랄가이즈 못먹은게 한이 맺혀 코로나를 뚫고 다녀왔다... 할랄푸드란? 이슬람교도들이 먹을 수 있도록 허용된 식품. 돼지고기가 들어가지 않는다!... ,5.0,"['재미있는', '고급진', '이국적', '친절하고', '깨끗한', '치킨', '길거리음식', '중동음식', '샌드위치', '양고기', '나들이', '신선한', '데이트', '재방문', '핫플레이스']"
할랄가이즈,[ 이태원 맛집 저렴 ] 이태원 점심을 먹고싶다면 할랄가이즈!,https://blog.naver.com/wjsdmsgml7/221509167427,안녕하세요! 오늘은 이태원 맛집 저렴 하게 이태원 점심 식사 할 수 있는 할랄가이즈 후기로 돌아온 춘삼맘이에요. 저는 이태원을 굉장히 좋아하는 편이고 최근 이태원에 자주 가게 되는것같아요. 마치 우리나라가 아닌것... ,5.0,"['재미있는', '고급진', '이국적', '친절하고', '깨끗한', '치킨', '길거리음식', '중동음식', '샌드위치', '양고기', '나들이', '신선한', '데이트', '재방문', '핫플레이스']"
할랄가이즈,"이태원 맛집 저렴하지만 맛있는 곳을 찾는다면 ""할랄가이즈""",https://blog.naver.com/epkcs_0112/221587570303,오랜만에 토리랑 데이튜 둘다 저녁에 용산에 약속있었는데 점심시간이 비어서 간단히 먹을 수 있는 이태원 할랄가이즈! 로 초이스함 6호선 이태원역 2번출구에서 가까워요 ☎ 02-794-8308 영업시간 평일/일 11:00 - 22:00 금/토... ,5.0,"['재미있는', '고급진', '이국적', '친절하고', '깨끗한', '치킨', '길거리음식', '중동음식', '샌드위치', '양고기', '나들이', '신선한', '데이트', '재방문', '핫플레이스']"
할랄가이즈,이태원 - 할랄가이즈 / 이태원 맛집 저렴 까지! 딱 좋은 할랄푸드,https://blog.naver.com/oluur/221580913490,오늘은 언이랑 할랄푸드 대작전! 할랄푸드가 얼마나 먹을만 한지 궁금따리 궁금따 도전 ( ˘•ω•˘ ).｡oஇ 이태원에서 멀까봐 걱정했는데 내리자마자 정말 한 30걸음? 도 안되서 있다 엄청 가까워서 좋댜... ,5.0,"['재미있는', '고급진', '이국적', '친절하고', '깨끗한', '치킨', '길거리음식', '중동음식', '샌드위치', '양고기', '나들이', '신선한', '데이트', '재방문', '핫플레이스']"
할랄가이즈,"[이태원 맛집] - 이태원 맛집 저렴한 ""할랄가이즈""",https://blog.naver.com/isgn/221425177053,[이태원 맛집 - 할랄 가이즈] 쏠이랑 만나서 같이 전시회 가기로 했다. 전시회 가기 전 이태원에서 점심 먹기로 결정- 우리가 가기로 한 곳은 할랄 가이즈 이태원역 2번 출구에서 나와서 직진하다 보면 이 건물이 보인다.... ,5.0,"['재미있는', '고급진', '이국적', '친절하고', '깨끗한', '치킨', '길거리음식', '중동음식', '샌드위치', '양고기', '나들이', '신선한', '데이트', '재방문', '핫플레이스']"
할랄가이즈,이태원 맛집 추천::뉴욕에서도 줄서먹는 할랄푸드▶할랄가이즈◀,https://blog.naver.com/lkj8318/221802491878,"안녕하세요 여러분 탈일상입니다! 오늘은 이태원에서 먹은 소울푸드, 할랄가이즈를 소개해 드리려해요 정해인의 걸어보고서에 나온 할랄가이즈를 보고 한국에도 뉴욕맛집이 있었단걸 알게되고 다음에 기회되면 가야지... ",5.0,"['재미있는', '고급진', '이국적', '친절하고', '깨끗한', '치킨', '길거리음식', '중동음식', '샌드위치', '양고기', '나들이', '신선한', '데이트', '재방문', '핫플레이스']"
할랄가이즈,5月 이태원 할랄가이즈,https://blog.naver.com/hyunsj0421/221552420389,"할랄가이즈 서울 용산구 이태원로 187 2층 운영시간 평일 11:00 - 22:00 금요일 11:00 - 04:00 토요일 11:00 - 04:00 일요일 11:00 - 22:00 Combo Small Platter 강남점, 홍대점도 생긴 할랄가이즈ㅋㅋ https://blog.naver.com/hyunsj0421... ",5.0,"['재미있는', '고급진', '이국적', '친절하고', '깨끗한', '치킨', '길거리음식', '중동음식', '샌드위치', '양고기', '나들이', '신선한', '데이트', '재방문', '핫플레이스']"
할랄가이즈,이태원 저렴한 맛집 할랄가이즈 / 카페 WEGINTIXIX,https://blog.naver.com/solbon1212/221596387555,"2019.07.26 오늘은 이태원을 갔다. 저렴한 맛집을 치니까 할랄가이즈가 뜨길래 오늘 한 번 도전해보러 갔다. 2층, 이태원역 2번출구 근처에 있다. 케밥과 플래터, 샌드위치를 파는 곳이다. 상당히 깔끔했던 식당 내부... ",5.0,"['재미있는', '고급진', '이국적', '친절하고', '깨끗한', '치킨', '길거리음식', '중동음식', '샌드위치', '양고기', '나들이', '신선한', '데이트', '재방문', '핫플레이스']"
할랄가이즈,이태원 맛집_할랄가이즈 이태원 맛집 저렴한 가격 이태원 점심으로 딱!,https://blog.naver.com/mimi2172/221510801633,"춥긴 하지만 그래도 미세먼지도 없구 공기 너~무 맑았던 날. 일찍 퇴근 해서 남산따라 쭉~ 걸어서 칭구 만나러 이태원으로 고고! 늦은 점심겸 저녁으로 뭘 먹지 고민고민하다, 이태원 맛집으로 저렴하면서도... ",5.0,"['재미있는', '고급진', '이국적', '친절하고', '깨끗한', '치킨', '길거리음식', '중동음식', '샌드위치', '양고기', '나들이', '신선한', '데이트', '재방문', '핫플레이스']"
할랄가이즈,이태원 맛집 저렴 하게! 할랄가이즈(뉴욕 3대 맛집이라능),https://blog.naver.com/s2pjhsj/221511540831,"이태원 맛집 저렴 저케밥좋아하는고아시죠.... 아무도몰랐던이야기.., 어쨌든 제가 할랄가이즈에 다녀왔습니다 일단 커플세트를 시켰습니다 고기는 소고기와 닭고기를 모두 넣을 수 있는 콤보로 해서 천원추가... ",5.0,"['재미있는', '고급진', '이국적', '친절하고', '깨끗한', '치킨', '길거리음식', '중동음식', '샌드위치', '양고기', '나들이', '신선한', '데이트', '재방문', '핫플레이스']"
할랄가이즈,[서울 이태원 맛집] 할랄 가이즈 (The Halal Guys) - 이태원에서... ,https://blog.naver.com/lemonlime2/221297975765,"위치, 영업시간 등 자세한 정보는 포스팅 하단에 있습니다 :) 한국에 할랄 가이즈가 들어왔다고 해서 기대를 하고 있다가, 결국 생긴지 꽤 되어서 가봤었어요. 뉴욕에서 먹은 그 맛이 날까 기대하면서ㅎㅎ 지금이야... ",5.0,"['재미있는', '고급진', '이국적', '친절하고', '깨끗한', '치킨', '길거리음식', '중동음식', '샌드위치', '양고기', '나들이', '신선한', '데이트', '재방문', '핫플레이스']"
할랄가이즈,이태원 :: 이태원 맛집 저렴하게 한끼 먹을수있는 할랄가이즈!,https://blog.naver.com/guin0819/221487074263,주말에 강제로 회사 끌려갔다가 이태원으로 퇴근했다ㅠㅠㅠㅠㅠㅠㅠㅠㅠㅠㅠ 밥도못먹고일하는 바람에 밥은 이태원에서 언니만나서 먹기로하고 이태원역 2번출구 바로앞에있는 할랄가이즈에서 늦은점심을 먹으러... ,5.0,"['재미있는', '고급진', '이국적', '친절하고', '깨끗한', '치킨', '길거리음식', '중동음식', '샌드위치', '양고기', '나들이', '신선한', '데이트', '재방문', '핫플레이스']"
할랄가이즈,이태원부터 삼청동까지,https://blog.naver.com/success0108/221392857391,화창한 가을날이었던 지난 9월 이야기예요 주말이었지만 출근했던 하마씨의 퇴근을 기다리며 도산공원에서 친구와 함께 브런치를 먹고는 하마씨의 퇴근에 맞춰 잽싸게 이태원으로 날아갔어요 이 날은 아주 동에 번쩍... ,5.0,"['재미있는', '고급진', '이국적', '친절하고', '깨끗한', '치킨', '길거리음식', '중동음식', '샌드위치', '양고기', '나들이', '신선한', '데이트', '재방문', '핫플레이스']"
할랄가이즈,이태원 맛집 저렴한 할랄가이즈에서 간단하게~,https://blog.naver.com/uk22uk/221403980346,저렴한 이태원 맛집 할랄가이즈 안녕하세요~ 여행블로거 벤입니다. 저는 지난 연말에 뉴욕여행을 다녀오고나서 남들은 다 맛있게 먹었다고 했던 할랄가이즈 저 혼자만 좀 별로라는 생각이 들었거든요. 왜냐면 뉴욕은... ,5.0,"['재미있는', '고급진', '이국적', '친절하고', '깨끗한', '치킨', '길거리음식', '중동음식', '샌드위치', '양고기', '나들이', '신선한', '데이트', '재방문', '핫플레이스']"
할랄가이즈,[이태원/이태원역] 할랄가이즈_플래터 메뉴/이태원 타코/케밥,https://blog.naver.com/muziqui/221433060823,"내가 ‘핵인싸’는 아닌데도 어쩌다 전에는 홍대, 이번엔 이태원으로 사는 곳 근처가 사람 북적이는 번화가 인근이다. 예전에도 그리 적게 가는 동넨 아니었지만 이젠 ‘우리 동네’이다보니 단골집이 몇 생겼다. 그 중... ",5.0,"['재미있는', '고급진', '이국적', '친절하고', '깨끗한', '치킨', '길거리음식', '중동음식', '샌드위치', '양고기', '나들이', '신선한', '데이트', '재방문', '핫플레이스']"
할랄가이즈,@ 할랄가이즈 이태원점 ㅣ 뉴욕 여행 1년 기념위해 할랄가이즈... ,https://blog.naver.com/chuyiyoung/221586574953,#이영쓰맛집 #이태원맛집 #할랄가이즈 #이태원할랄가이즈 할랄가이즈 이태원점 할랄가이즈 이태원점 다녀왔어요! 유정이랑 뉴욕여행 1주년 기념 ㅋㅋㅋㅋㅋㅋㅋㅋㅋㅋㅋㅋㅋ 다른 칭구들 나중에 같이가쟈 !>_< 더... ,5.0,"['재미있는', '고급진', '이국적', '친절하고', '깨끗한', '치킨', '길거리음식', '중동음식', '샌드위치', '양고기', '나들이', '신선한', '데이트', '재방문', '핫플레이스']"
할랄가이즈,전세계 4분의 1이 먹는다? '의외로' 맛있는 할랄 푸드 맛집,https://post.naver.com/viewer/postView.nhn?volumeNo=27412207&memberNo=15460571&vType=VERTICAL,"18억 이슬람 신자들이 즐기는 할랄 푸드 할랄 푸드는 할랄 범위 내의 식재료를 엄격한 기준에 의해 도축되거나 생산되고 포장, 보관, 저장, 판매 등 유통에 이르기까지 꽤 까다롭고 제한이 있어 뭔가 어렵고 거창하게 느껴진다. 또 중동지역이 음식이 우리에게 익숙하지 않다 보니 할랄 푸드에 대한 도전이 쉽지 않았을 수 있다. 하지만 전 세계 인구의 23% 정도에 해당하는 약 18억 명의 이슬람 신자들이 먹는 할랄 푸드가 그들만의 음식이 아니라 전 세계인의 입맛을 사로잡기 시작했다. 실제 2016년 1조... ",5.0,"['재미있는', '고급진', '이국적', '친절하고', '깨끗한', '치킨', '길거리음식', '중동음식', '샌드위치', '양고기', '나들이', '신선한', '데이트', '재방문', '핫플레이스']"
할랄가이즈,(이태원)할랄가이즈-이태원에서 저렴하게 외국 분위기 내면서... ,https://blog.naver.com/choijg0921/221401939200,이태원 2번출구 참.. 지난 할로윈시즌 금요일에 이곳은 정말 어마어마 했다. 토요일 새벽 이태원에 왔다가 지나가는 청춘들을 보며 얼마나 부럽던지.. 한때 나도 저들과 같은 분위기에 취해있었는데.. 점차 아재가 되고.... ,5.0,"['재미있는', '고급진', '이국적', '친절하고', '깨끗한', '치킨', '길거리음식', '중동음식', '샌드위치', '양고기', '나들이', '신선한', '데이트', '재방문', '핫플레이스']"
할랄가이즈,이태원 맛집 저렴하고 배부르게 먹는 할랄가이즈,https://blog.naver.com/9200425/221448559957,#이태원맛집 #할랄가이즈 광화문에서 일하는 친구를 퇴근하기 기다려서 함께 이태원에 위치한 맛집인 할랄가이즈에 다녀왔어요~~ 할랄가이즈 이태원점은 뭐니뭐니해도 접근성...goodgoodgood!! 6호선 이태원역 2번출구... ,5.0,"['재미있는', '고급진', '이국적', '친절하고', '깨끗한', '치킨', '길거리음식', '중동음식', '샌드위치', '양고기', '나들이', '신선한', '데이트', '재방문', '핫플레이스']"
할랄가이즈,<이태원> 할랄가이즈,https://blog.naver.com/penguin911/221699283384,전에 혼자 가서 먹어본 적이 있는데 가끔 생각이 났다. 곰 옷 사러 이태원 간 김에 데려가보았다~ 나는 망설임 없이 팔라펠 플래터. 곰은 망설이다가 비프자이로 샌드위치로. 플래터 작은 걸로 시켰더니 많이 작다. ㅠㅠ 이... ,5.0,"['재미있는', '고급진', '이국적', '친절하고', '깨끗한', '치킨', '길거리음식', '중동음식', '샌드위치', '양고기', '나들이', '신선한', '데이트', '재방문', '핫플레이스']"
할랄가이즈,[이태원역]할랄가이즈 THE HALAL GUYS,https://blog.naver.com/kkj7770/221560874408,이태원에서 꼭 가보고싶었던 할랄푸드 음식점 할랄가이즈 THE HALAL GUYS 생각안하고 있다가 이태원역 지날때 갑자기 생각나서 녹사평에서 내려서 왔다ㅋ 점심을 굶은상태이고 혼밥을 해야할때였음... 점심시간 지난 평일... ,5.0,"['재미있는', '고급진', '이국적', '친절하고', '깨끗한', '치킨', '길거리음식', '중동음식', '샌드위치', '양고기', '나들이', '신선한', '데이트', '재방문', '핫플레이스']"
할랄가이즈,[서울/이태원] 할랄가이즈 #2,https://blog.naver.com/lcw6285/221748213747,"이태원 할랄가이즈. 미국 뉴욕에서 푸드트럭으로 시작하여 세계적인 체인으로 자리잡은 이 브랜드는 이름처럼 할랄을 전면에 내걸고 있다. 당연하게 할랄 인증서를 가게에 구비하고 있는데, 그렇다고 아주 중동 스타일의... ",5.0,"['재미있는', '고급진', '이국적', '친절하고', '깨끗한', '치킨', '길거리음식', '중동음식', '샌드위치', '양고기', '나들이', '신선한', '데이트', '재방문', '핫플레이스']"
할랄가이즈,서울에서 뉴욕 맛보기 :d   _ 이태원 할랄가이즈 THE HALAL GUYS,https://blog.naver.com/dltlsdo705/221322273813,베트남 여행 프롤로그 쓰다가 너무 힘들어서 잠깐 도피 포스팅 ㅋㅋㅋㅋㅋ 간략하게 챠라락 글을 쓰는 능력치는 없는 사람이라 맘먹고 써야 하는 포스팅 넘나 힘들어옄ㅋㅋ 야금야금 쓰고 있는 여행 이야기는 뒤로 하고... ,5.0,"['재미있는', '고급진', '이국적', '친절하고', '깨끗한', '치킨', '길거리음식', '중동음식', '샌드위치', '양고기', '나들이', '신선한', '데이트', '재방문', '핫플레이스']"
할랄가이즈,(이태원맛집추천) 이태원 맛집 저렴한 가격으로 뉴욕의 맛을 느낄 수... ,https://blog.naver.com/shjce93/221564618461,"주주링~! 벌써 6월도 다 가고 있어요ㅜ ㅜ 바빠 죽겠어서 우울할때는 맛있는거라도 먹어야되어용,,,8-8 지난주에 퇴근하고 대학원생인 친구와 함께 이태원 할랄가이즈에 다녀왔어요! 이태원역 2번출구에서 나와서 한남동... ",5.0,"['재미있는', '고급진', '이국적', '친절하고', '깨끗한', '치킨', '길거리음식', '중동음식', '샌드위치', '양고기', '나들이', '신선한', '데이트', '재방문', '핫플레이스']"
할랄가이즈,뉴욕3대 맛집이라 불리우는 <이태원:할랄가이즈>,https://blog.naver.com/yipsae320/221657687787,주랑주랑 다주랑이 서울방문함 ㅋㅋㅋㅋㅋㅋ 전주갔을때 삼십분 잠깐보았는데 첫 행선지 한강. 날씨가 다했네~ 여기는 이태원 둘다 뭐 거의 이태원 처음이라 헤맸음 도중만난 냐옹이 사료돔 챙겨다닐껄 ㅠㅠ 헤매던중... ,5.0,"['재미있는', '고급진', '이국적', '친절하고', '깨끗한', '치킨', '길거리음식', '중동음식', '샌드위치', '양고기', '나들이', '신선한', '데이트', '재방문', '핫플레이스']"
