name,title,url,description,score,tags
할랄가이즈,이태원 점심 : 할랄 가이즈 이태원점,https://blog.naver.com/sunjuic/221375508638,이태원 점심 : 할랄 가이즈 이태원점 어제는 곰정이랑 접선하기 위해 이태원역으로! 곰정은 아침에 많이 먹어서 배가 안 고프다길래 나 혼자 먹을 밥집을 찾았다. 할랄이 끌리는 날이라 다른 건 옵션에도 없고 이태원역... ,5.0,"['재미있는', '고급진', '이국적', '친절하고', '깨끗한', '치킨', '길거리음식', '중동음식', '샌드위치', '양고기', '나들이', '신선한', '데이트', '재방문', '핫플레이스']"
할랄가이즈,할랄가이즈 이태원 맛집 저렴하고 맛있어!,https://blog.naver.com/skfro000/221351548749,"남편이 이태원을 한번도 안가봤다고 해서, 이태원에 가서 놀기로 하고 코스를 짜고 갔는데 경리단길 너무 실망했어요 ㅠ 역시 이태원은 이태원역 부근이 더 핫한것 같아요! 인터넷검색 당시엔 녹사평역 근처 및 경리단길이... ",5.0,"['재미있는', '고급진', '이국적', '친절하고', '깨끗한', '치킨', '길거리음식', '중동음식', '샌드위치', '양고기', '나들이', '신선한', '데이트', '재방문', '핫플레이스']"
할랄가이즈,이태원 뉴핫플 저렴한 '더할랄가이즈 이태원본점' 간단한 터키요리,https://blog.naver.com/staybystay/221430650140,"안녕하세요 스테이입니다 오늘은 오빠가 정말 정말 좋아하는 더 할랄가이즈 다녀왔어요~!~! 원래부터 넘나 맛집이라 ㅎㅎ 터키음식은 또 맛있잖아여 ㅠ,ㅠ 그 특유의 밥과 고기와 화이트소스 및 그 향의 맛이... ",5.0,"['재미있는', '고급진', '이국적', '친절하고', '깨끗한', '치킨', '길거리음식', '중동음식', '샌드위치', '양고기', '나들이', '신선한', '데이트', '재방문', '핫플레이스']"
할랄가이즈,이태원 할랄가이즈 가격도 저렴한 리얼 뉴욕 맛집,https://blog.naver.com/veryowesome/221373667932,이태원 맛집 할랄가이즈 이태원점 이태원에서 꼭 먹어야하는 필수 먹방템 안녕하세요! 쉑쉑버거에 이은 뉴욕 3대 맛집인 할랄가이즈가 한국에 들어온 거 아시죠? 외국 감성을 제대로 살리는 이태원에서 꼭 먹어야 하는... ,5.0,"['재미있는', '고급진', '이국적', '친절하고', '깨끗한', '치킨', '길거리음식', '중동음식', '샌드위치', '양고기', '나들이', '신선한', '데이트', '재방문', '핫플레이스']"
할랄가이즈,뉴욕 3대 맛집 중 하나인 할랄가이즈! 이태원에서 점심,https://blog.naver.com/love621893/221455322344,이태원에 제가 정말 좋아하는 맛집이 하나 있는데요! 바로바로 할랄가이즈에요 강남역점도 가보고 이태원점도 가봤는데 이태원은 진짜 외국에 온 것 같은 착각까지 들더라구요 [이태원] 다시 찾은 할랄가이즈! 넘나... ,5.0,"['재미있는', '고급진', '이국적', '친절하고', '깨끗한', '치킨', '길거리음식', '중동음식', '샌드위치', '양고기', '나들이', '신선한', '데이트', '재방문', '핫플레이스']"
할랄가이즈,[이태원케밥 ] 뉴욕에서 넘어온 뉴욕3대맛집 @할랄가이즈 / 이태원 가볼... ,https://blog.naver.com/zyoncee/221329038559,"찌니파크에요~ 뉴욕 갔을 때 시간에 쫓겨 맛보고 오지 못해 매번 아쉬웠던 뉴욕 3대 맛집 ""할랄가이즈"" 를 한국에서 먹을 수 있다는 사실!!!! 알고 계셨어요 ?? 저는 이제서야 알게 돼서 당장 다녀왔어요 ㅋㅋㅋㅋㅋ... ",5.0,"['재미있는', '고급진', '이국적', '친절하고', '깨끗한', '치킨', '길거리음식', '중동음식', '샌드위치', '양고기', '나들이', '신선한', '데이트', '재방문', '핫플레이스']"
할랄가이즈,이태원케밥 : 뉴욕3대맛집 할랄 가이즈!,https://blog.naver.com/kgmi85/221292674384,예전 뉴욕 여행 갔을 때 직장인들이 길가의 트럭에서 줄지어 음식을 먹고 있는 장면을 자주 보곤 했는데 한국 와서 알게 된 사실이 그곳은 케밥으로 유명한 뉴욕 3대 맛집 할랄 가이즈였다는 거예요!! 자주 갈 수 없는... ,5.0,"['재미있는', '고급진', '이국적', '친절하고', '깨끗한', '치킨', '길거리음식', '중동음식', '샌드위치', '양고기', '나들이', '신선한', '데이트', '재방문', '핫플레이스']"
할랄가이즈,이태원 맛집 저렴/이태원 점심) '할랄가이즈'에서 색다른 저녁 먹었어요,https://blog.naver.com/mulin0913/221432030321,이태원에서 색다른 음식을 먹어봤습니다. 뉴욕 3대 맛집 이태원 할랄가이즈에 방문했어요! 이태원역 2번 출구 바로 앞에 있어요. 이태원 할랄라이즈 내부 할랄가이즈에는 외국인 직원분들이... ,5.0,"['재미있는', '고급진', '이국적', '친절하고', '깨끗한', '치킨', '길거리음식', '중동음식', '샌드위치', '양고기', '나들이', '신선한', '데이트', '재방문', '핫플레이스']"
할랄가이즈,할랄가이즈 - 이태원 뉴욕에서 넘어온 할랄푸드,https://blog.naver.com/elixir0827/221317407325,뉴욕에서 넘어온 할랄푸드 이태원 할랄가이즈 뉴욕 길거리에 할랄푸드들이 상당히 많아요. 이번에 가서 봤을때도 길거리를 걷다보면 상당히 자주 눈에 들어오더라구요. 저는 그게 다 할랄가이즈 인줄 알았는데 그건... ,5.0,"['재미있는', '고급진', '이국적', '친절하고', '깨끗한', '치킨', '길거리음식', '중동음식', '샌드위치', '양고기', '나들이', '신선한', '데이트', '재방문', '핫플레이스']"
할랄가이즈,"서울1.(대림미술관,서울전시회,나는코코카피탄오늘을살아가는너에게... ",https://blog.naver.com/susan7190/221396774729,시간이 너무 빨리가는건 내 기분탓일까 그렇게 기다렸던 11월 9일 서울가는 날 벌써 그 날이 왔다. 11월 10일 동생이 제일 좋아하는 prep밴드의 첫 내한 공연을 서울에서 해서 나는 동생찬스로 그냥 몸뚱아리만 따라갔다... ,5.0,"['재미있는', '고급진', '이국적', '친절하고', '깨끗한', '치킨', '길거리음식', '중동음식', '샌드위치', '양고기', '나들이', '신선한', '데이트', '재방문', '핫플레이스']"
할랄가이즈,[이태원 점심] 할랄가이즈,https://blog.naver.com/party_tasty/221310269690,"#이태원가볼만한곳 이태원 역 2번출구로 나와서 조금만 걸어오면 2층에 보이는 ""할랄가이즈"" 제이홈에서 파티할때도 포장해서 몇번이나 갔는데 모두에게 인기좋은 이 곳!!! 다섯번째 방문! 내가 데려간 사람들 모두 좋아했던... ",5.0,"['재미있는', '고급진', '이국적', '친절하고', '깨끗한', '치킨', '길거리음식', '중동음식', '샌드위치', '양고기', '나들이', '신선한', '데이트', '재방문', '핫플레이스']"
할랄가이즈,이태원 가볼만한 곳! 이태원케밥의 지존 할랄가이즈,https://blog.naver.com/ssuni1203/221293687243,"뉴욕에서 두 달 정도 머무르며 먹었던 음식 중 생각나는 음식을 꼽아보라면피터루거 스테이크, 루크 랍스터의 랍스터롤, 매그놀리아 바나나푸딩,그리고 하나 더! 바로 할랄가이즈 >ㅁ< 주소 : 서울시 용산구 이태원로 187... ",5.0,"['재미있는', '고급진', '이국적', '친절하고', '깨끗한', '치킨', '길거리음식', '중동음식', '샌드위치', '양고기', '나들이', '신선한', '데이트', '재방문', '핫플레이스']"
할랄가이즈,이태원점심 할랄가이즈@ 이태원 케밥,https://blog.naver.com/iamhodu/221334973942,"이태원점심 메뉴 추천@ 할랄가이즈 이태원점 오후출근이라 바지런히 점심 묵고 나가기로!방학중인 미둘리 이태원으로 커몽! 더워서 멀리 나갈수가 없당, 이태원역 출구로 나와서 도보 1분거리에 위치한 이태원 케밥 맛집... ",5.0,"['재미있는', '고급진', '이국적', '친절하고', '깨끗한', '치킨', '길거리음식', '중동음식', '샌드위치', '양고기', '나들이', '신선한', '데이트', '재방문', '핫플레이스']"
할랄가이즈,이태원케밥 뉴욕스트릿푸드 할랄가이즈 ! 이태원에서 맛보기,https://blog.naver.com/0192256242/221268465254,이태원 가볼만한곳 ! 이색음식 찾으러 할랄가이즈에 다녀왔써용~~ 이태원케밥 유명한거 아시죠? ㅋㅋ 미국에서도 못다녀온 할랄가이즈를 한국에서 다녀왔어요: ) 이색음식 데이트코스로 추천! 향신료가 조금 강하고... ,5.0,"['재미있는', '고급진', '이국적', '친절하고', '깨끗한', '치킨', '길거리음식', '중동음식', '샌드위치', '양고기', '나들이', '신선한', '데이트', '재방문', '핫플레이스']"
할랄가이즈,뉴욕3대맛집 할라가이즈 이태원 상륙!!~ 이태원데이트코스 및 점심으로... ,https://blog.naver.com/kimsame/221291354059,"뉴욕3대맛집 할랄가이즈 이태원 상륟!~ 뉴욕 3대맛집으로 유명한 ""할랄가이즈""가 이태원에 상륙을 했네요!~ 노란색과 빨간색으로~ 어디에서도 눈에 잘 띠겠어요!~ 이태원역 2번 출구로 나와서 직진 50미터 정도에 2층에... ",5.0,"['재미있는', '고급진', '이국적', '친절하고', '깨끗한', '치킨', '길거리음식', '중동음식', '샌드위치', '양고기', '나들이', '신선한', '데이트', '재방문', '핫플레이스']"
할랄가이즈,이태원 할랄가이즈 솔직후기,https://blog.naver.com/janna_lee/221211767868,오늘은 첫 출근 눈누난냐 점심은 늘 밖에서 먹을 수 있게 되었어요 얏호 제가 고른건 그동안 넘 먹고팠던 할랄가이즈! 미국에서도 그렇게 호응이 좋다고들하는데 음식은 크게 샌디치와 플래터 중에 고를 수 있구요 사이즈는... ,5.0,"['재미있는', '고급진', '이국적', '친절하고', '깨끗한', '치킨', '길거리음식', '중동음식', '샌드위치', '양고기', '나들이', '신선한', '데이트', '재방문', '핫플레이스']"
할랄가이즈,이태원케밥 맛있는집 이태원 가볼만한 곳 뉴욕분위기의 할랄가이즈,https://blog.naver.com/dony_zzang/221337124470,이태원 가볼만한 곳 !! 이태원 와줬으면 외국음식좀 먹어줘야죠 ㅋㅋㅋㅋ 그중 케밥이 유명하죠ㅋㅋㅋ #이태원케밥 맛집 어떠세요? 정말 기가막히게 맛나는곳 제가 알거든용!!! 이태원역 2번출구 나와서 도보1분 걷다보면... ,5.0,"['재미있는', '고급진', '이국적', '친절하고', '깨끗한', '치킨', '길거리음식', '중동음식', '샌드위치', '양고기', '나들이', '신선한', '데이트', '재방문', '핫플레이스']"
할랄가이즈,[이태원] 다시 찾은 할랄가이즈! 넘나 맛있당*_*,https://blog.naver.com/love621893/221415731510,예전에 할랄가이즈가 막 생겼을때쯤 강남역에서 한번 먹구 이번에 다시 찾았어요! 이번에는 이태원 놀러간김에 들러보았습니당! 이태원역 2번출구에 나오면 바로 2층에 있는 할랄가이즈. 노란색 간판 많이들 보셨을텐데... ,5.0,"['재미있는', '고급진', '이국적', '친절하고', '깨끗한', '치킨', '길거리음식', '중동음식', '샌드위치', '양고기', '나들이', '신선한', '데이트', '재방문', '핫플레이스']"
할랄가이즈,할랄가이즈 이태원점 강남점,https://blog.naver.com/jhot1123/221400881528,"쉑쉑버거를 이을 뉴욕 맛집이라던 할랄가이즈 이태원 본점과 강남역점 두 군데에 할랄가이즈가 있는데요, 처음 먹어본 건 반년 전쯤 이번 주엔 무려 두 번이나 다녀왔네요 스리라차 소스의 알싸함이 중독성 있는... ",5.0,"['재미있는', '고급진', '이국적', '친절하고', '깨끗한', '치킨', '길거리음식', '중동음식', '샌드위치', '양고기', '나들이', '신선한', '데이트', '재방문', '핫플레이스']"
할랄가이즈,[현대카드] 현대카드 뮤직 라이브러리 / 현대카드 라이브러리 / 라인... ,https://blog.naver.com/llnallll/221269521536,오래된 묵은지 포스팅!!! 오랜만에 이태원 나들이 했던 어느 날 +_+ 목적은 현대카드 MUSIC LIBRARY 가기 위함!!! 우선 친구를 만나 #이태원할랄가이즈 부터 갔어요! 밥 시간 아닌데도 손님이 너무 많아요 ㅠ 더 할랄 가이즈... ,5.0,"['재미있는', '고급진', '이국적', '친절하고', '깨끗한', '치킨', '길거리음식', '중동음식', '샌드위치', '양고기', '나들이', '신선한', '데이트', '재방문', '핫플레이스']"
할랄가이즈,뉴욕 3대 맛집 할랄 가이즈! 이제 이태원에서 만나요-,https://blog.naver.com/hellozina/221223270036,"평일 퇴근 후 오랜만에 친구랑 이태원 다녀왔어요- 뉴욕 여행에서 먹었던 할랄푸드가 내내 그리웠었는데, 한국에도 할랄 가이즈가 생겼더라구요!!!!!! 마침 친구도 뉴욕 여행에서 할랄푸드 맛있게 먹었다고해서 둘 다... ",5.0,"['재미있는', '고급진', '이국적', '친절하고', '깨끗한', '치킨', '길거리음식', '중동음식', '샌드위치', '양고기', '나들이', '신선한', '데이트', '재방문', '핫플레이스']"
할랄가이즈,[이태원 맛집] 할랄가이즈- 할랄음식점,https://blog.naver.com/rsmj91/221201278175,3인방 모인 김에 어찌어찌 이태원 가게 됨. 이태원 나와바리 후계자씨가 강력추천한 곳으로. 원래는 미국?에서 푸드트럭으로 했던 게 대박나서 한국까지 온 걸로 암. 그러고보니 강남역에도 생겼던 데.. 내부는... ,5.0,"['재미있는', '고급진', '이국적', '친절하고', '깨끗한', '치킨', '길거리음식', '중동음식', '샌드위치', '양고기', '나들이', '신선한', '데이트', '재방문', '핫플레이스']"
할랄가이즈,< 이태원 케밥 : 할랄가이즈 >,https://blog.naver.com/jessica1006e/221285578840,[ 이태원 맛집 : 할랄가이즈 ] 날씨도 너무 좋고 케밥도 먹고 싶어서 오랜만에 이태원에 다녀왔어요. 이태원 2번 출구로 나와서 30초만 걸다보면 왼쪽 건물 2층에 눈에 띄는 노란색 간판이 바로 뉴욕의 3대 맛집 '할랄가이즈... ,5.0,"['재미있는', '고급진', '이국적', '친절하고', '깨끗한', '치킨', '길거리음식', '중동음식', '샌드위치', '양고기', '나들이', '신선한', '데이트', '재방문', '핫플레이스']"
할랄가이즈,"이태원 점심추천, 혼밥러 필수코스 할랄가이즈",https://blog.naver.com/sesv1004/221288538446,주말 이태원 나들이때 방문한 할랄가이즈~~ 길거리 노점에서 출발해 이제는 유명한 프랜차이즈가 되어버린 이태원 케밥집인데 혼밥러들에데 꼬옥 추천하고 싶다 이태원에서 프로 혼밥러가 되고 싶다면 여기서 먹방... ,5.0,"['재미있는', '고급진', '이국적', '친절하고', '깨끗한', '치킨', '길거리음식', '중동음식', '샌드위치', '양고기', '나들이', '신선한', '데이트', '재방문', '핫플레이스']"
할랄가이즈,#[이태원케밥] '할랄가이즈 이태원점',https://blog.naver.com/killua19/221195665430,#이태원케밥 할랄가이즈 뉴욕에서 3대 맛집으로 불리우는 할랄가이즈가 이태원에 생겼어요~ 주말에 친구와 다녀온 새로 생긴 맛집 핫한 이태원 케밥 맛집입니다!! 저번에 이태원 방문했을때도 친구 추천으로 이태원... ,5.0,"['재미있는', '고급진', '이국적', '친절하고', '깨끗한', '치킨', '길거리음식', '중동음식', '샌드위치', '양고기', '나들이', '신선한', '데이트', '재방문', '핫플레이스']"
할랄가이즈,2018년 2월의 화르르르륵,https://blog.naver.com/lneworld/221207459607,이번 제목은 평소와 같이 느낌을 쓴 게 아니라 진짜 불타죽을 뻔해서 마음에 화상을 입은 사건을 나타내는 것임 요즘 화재사고가 많이 일어나는데 다들 불조심하세요 불은 생각보다 빨리 타오릅니다... 위베어베어스 더... ,5.0,"['재미있는', '고급진', '이국적', '친절하고', '깨끗한', '치킨', '길거리음식', '중동음식', '샌드위치', '양고기', '나들이', '신선한', '데이트', '재방문', '핫플레이스']"
할랄가이즈,이태원 맛집 : 이국적인 맛이 있는 이태원 할랄가이즈,https://blog.naver.com/ad_yu2016/221216227208,안녕하세요 욜영입니다. 오랜만에 들고 온 맛집 포스팅이예요! 날씨도 풀렸겠다 요즘 나름대로 야무지게 인생을 즐기고 있답니다ㅠㅠ 노느라 바빠서 블로그 관리는 뒷전이다가 이태원 맛집 : 할랄가이즈 소개해 드리려고... ,5.0,"['재미있는', '고급진', '이국적', '친절하고', '깨끗한', '치킨', '길거리음식', '중동음식', '샌드위치', '양고기', '나들이', '신선한', '데이트', '재방문', '핫플레이스']"
할랄가이즈,[이태원] 할랄가이즈 이태원점 The Halal Guys,https://blog.naver.com/swiss9769/220900175134,이태원 해밀턴 호텔 인근 더 할랄 가이즈 오랜 공사를 끝내고 작년 12월엔가 오픈을 했습니다. 맨하탄에서 할랄 푸드를 팔고 있는 푸드 트럭을 매장 형태로 변경을 해서 들여오셨네요. 뉴욕 여행 때 맛있게 먹은... ,5.0,"['재미있는', '고급진', '이국적', '친절하고', '깨끗한', '치킨', '길거리음식', '중동음식', '샌드위치', '양고기', '나들이', '신선한', '데이트', '재방문', '핫플레이스']"
할랄가이즈,이태원 맛집 : 뉴욕이 그리울 땐 할랄 가이즈,https://blog.naver.com/sunjuic/221166738253,할랄 가이즈가 이렇게 맛있는 건 줄 나는 몰랐지. 낄낄. 뉴욕에 직접 다녀와서 진짜 할랄 가이즈 본점에서 먹어본 후에야 알았다. 이렇게 중독성 쩔고 맛있는 음식이 이 세상에 존재한다는 사실을!!!! 제가 다녀왔읍니다.... ,5.0,"['재미있는', '고급진', '이국적', '친절하고', '깨끗한', '치킨', '길거리음식', '중동음식', '샌드위치', '양고기', '나들이', '신선한', '데이트', '재방문', '핫플레이스']"
할랄가이즈,이태원케밥 할랄가이즈. 뉴욕 인기 푸드트럭 맛집을 이태원에서... ,https://blog.naver.com/ok3171/221158047522,작년 이맘때 국내 상륙한 할랄가이즈. 뉴욕에서 꼭 먹어야할 3대 맛집이라고 하죠? 지인들의 인스타그램에 줄줄이 등장하고 지난번 이태원 세계음식축제때도 인기였는데 정작 옥양은 아직까지 가보질 못했답니다. 오픈... ,5.0,"['재미있는', '고급진', '이국적', '친절하고', '깨끗한', '치킨', '길거리음식', '중동음식', '샌드위치', '양고기', '나들이', '신선한', '데이트', '재방문', '핫플레이스']"
할랄가이즈,이태원케밥 할랄가이즈 뉴욕 3대 맛집,https://blog.naver.com/angelhaniel/221173892765,이태원 케밥 할랄가이즈 The Halal Guys 뉴욕 3대 맛집 뉴욕에서 3대 맛집으로 불린다는 할랄가이즈. 나도 이름만 들어본거 같은데 한국에 생겼다고 해서 완전 가보고 싶었다. 뉴욕 3대 체인 맛집이라는 쉐이크쉑 버거는... ,5.0,"['재미있는', '고급진', '이국적', '친절하고', '깨끗한', '치킨', '길거리음식', '중동음식', '샌드위치', '양고기', '나들이', '신선한', '데이트', '재방문', '핫플레이스']"
할랄가이즈,[이태원 맛집] 미국 스트릿푸드 푸드트럭 '할랄가이즈' 격파! / 플래터... ,https://blog.naver.com/yurahning/220907926331,"오픈 예정이라는 현수막이 걸렸을때부터 너무나 기대했던 할랄 가이즈! Halal guys 매번 그쳐 지나가다가 오늘에야 다녀왔어요. 일단 결론부터 말하자면, 맛과 가격 모두 합격!! ㅇㅈ!! ㅋㅋㅋ 샌드위치 vs 플래터 그 다음... ",5.0,"['재미있는', '고급진', '이국적', '친절하고', '깨끗한', '치킨', '길거리음식', '중동음식', '샌드위치', '양고기', '나들이', '신선한', '데이트', '재방문', '핫플레이스']"
할랄가이즈,[이태원 맛집] 할랄가이즈 The Halal Guys #1,https://blog.naver.com/lisso1234/221145593084,2017.10 이태원 더할랄가이즈 The Halal Guys 이태원역 2번 출구의 큰 도로변에 위치 해 있고요 뉴욕 맨해튼의 타임스퀘어에서 푸드트럭 신화로 기반을 다진 할랄가이즈가 한국에선 이태원점을 기점으로 최근 강남점까지... ,5.0,"['재미있는', '고급진', '이국적', '친절하고', '깨끗한', '치킨', '길거리음식', '중동음식', '샌드위치', '양고기', '나들이', '신선한', '데이트', '재방문', '핫플레이스']"
할랄가이즈,맨해튼 기분 물씬 나는 이태원 할랄가이즈 코리아,https://blog.naver.com/20thtigger/220959184820,할랄가이즈 서울특별시 용산구 이태원로 187 2층 The Halal Guys 02-794-8308 얼마 전 이태원역 근처를 지나다가 공사 중인 할랄가이즈 매장을 봤었다. 할랄가이즈도 한국에 들어오면.. 적어도 소문난 음식을 먹으러 뉴욕에... ,5.0,"['재미있는', '고급진', '이국적', '친절하고', '깨끗한', '치킨', '길거리음식', '중동음식', '샌드위치', '양고기', '나들이', '신선한', '데이트', '재방문', '핫플레이스']"
할랄가이즈,[이태원맛집] 더 할랄가이즈 The Halal Guys:: 뉴욕 길거리 음식의 전설... ,https://blog.naver.com/cleanhe/220929346295,추천 메뉴 | 치킨 플래터 전화번호: 02-794-8308 주소: 서울특별시 용산구 이태원동 123-32 영업시간: 11:00AM ~ 22:00PM (평일 & 일요일) 11:00AM ~ 4:00AM (금 & 토요일) 주차: 불가 (근처 공영 주차장 이용) 뉴욕 길거리 푸드트럭에서... ,5.0,"['재미있는', '고급진', '이국적', '친절하고', '깨끗한', '치킨', '길거리음식', '중동음식', '샌드위치', '양고기', '나들이', '신선한', '데이트', '재방문', '핫플레이스']"
할랄가이즈,할랄가이즈 한국 상륙!  뉴욕 VS 이태원 비교,https://blog.naver.com/jenny8428/220889253078,설마 했던 뉴욕의 쉑쉑이 한국에 쉐이크쉑으로 들어오고 이제는 할랄가이즈까지 오픈했네요 ! 뉴욕에 가면 꼭 먹고 오는 음식이 쉑쉑이랑 할랄가이즈였거든요. 한국에 들어온다는 소문 듣고 길거리 음식이라 어떻게... ,5.0,"['재미있는', '고급진', '이국적', '친절하고', '깨끗한', '치킨', '길거리음식', '중동음식', '샌드위치', '양고기', '나들이', '신선한', '데이트', '재방문', '핫플레이스']"
할랄가이즈,[할랄 가이즈(The Halal Guys)/이태원],https://blog.naver.com/dkjang86/221160077630,"올해 이태원에 새로 오픈해서 무척 화제가 되었던 할랄가이즈. 뉴욕에서 호평받고 있는 프랜차이즈입니다. 다녀온 분들마다 맛이 훌륭하다, 독특하다고 평가하시길래 어떤지 궁금하다가 최근에 방문하게 되었습니다.... ",5.0,"['재미있는', '고급진', '이국적', '친절하고', '깨끗한', '치킨', '길거리음식', '중동음식', '샌드위치', '양고기', '나들이', '신선한', '데이트', '재방문', '핫플레이스']"
할랄가이즈,이태원 더 할랄 가이즈 - The Halal Guys,https://blog.naver.com/gigibeyon/221185257455,주말아침~ 악오가 피자먹으러 울동네에 온다고 오고싶으면 오라고... 난 솔직히 피자가 싫어... 그냥 내 취향이 아닙니다... 난 파스타가 좋아... 그런데 자꾸 온더보더가서 먹자고 꼬셔도 안넘어감.... 어쩔수없이 그래도... ,5.0,"['재미있는', '고급진', '이국적', '친절하고', '깨끗한', '치킨', '길거리음식', '중동음식', '샌드위치', '양고기', '나들이', '신선한', '데이트', '재방문', '핫플레이스']"
할랄가이즈,"[이태원맛집]꼬릿꼬릿 취향저격, 할랄가이즈메뉴",https://blog.naver.com/laonhaja/221178867987,"회사끝나고 데리러온 엽이와 드라이브차, 갑자기 이태원으로 떠났다. 원래 레코드 가게로 가서 기분전환하며 음악을 들을 계획이였는데, 일단 배가 고파서 스테이크집을 찾아서 가게 됐고, 그 집이 닫은 바람에... ",5.0,"['재미있는', '고급진', '이국적', '친절하고', '깨끗한', '치킨', '길거리음식', '중동음식', '샌드위치', '양고기', '나들이', '신선한', '데이트', '재방문', '핫플레이스']"
할랄가이즈,[이태원] 더 할랄가이즈,https://blog.naver.com/positivepwr/221143349870,할랄가이즈에 다녀왔다. 뉴욕여행에 갔을 때 (지금처럼 정보가 많지않던 시절이라) 지나가면서 푸드트럭에 사람이 많아 저집은 뭔가싶어 들렀던 곳이 할랄 푸드파는 곳이었다. 할랄이라는 말 자체가 허용되다는 뜻으로... ,5.0,"['재미있는', '고급진', '이국적', '친절하고', '깨끗한', '치킨', '길거리음식', '중동음식', '샌드위치', '양고기', '나들이', '신선한', '데이트', '재방문', '핫플레이스']"
