name,title,url,description,score,tags
할랄가이즈,[이태원 점심]케밥은 뉴욕 3대맛집 할랄가이즈에서!,https://blog.naver.com/pooh1387/221189313935,"[이태원 점심]케밥은 뉴욕 3대맛집 할랄가이즈에서! 출장을 마치고 서울로 올라와 이태원으로 향했습니다. 아주 오랜만에 불금 이태원!ㅋ 금요일임에도 불구하고, 사람이 정말 많이 줄었더라고요. 저는 지난 4~5월 미국... ",5.0,"['재미있는', '고급진', '이국적', '친절하고', '깨끗한', '치킨', '길거리음식', '중동음식', '샌드위치', '양고기', '나들이', '신선한', '데이트', '재방문', '핫플레이스']"
할랄가이즈,"이태원혼밥, 뉴욕 할랄가이즈, 인생네컷 포토그레이",https://blog.naver.com/superjjororo/221173456421,보자마자 감동의 눈물을 흘릴뻔 .. 10년전 뉴욕에 잠시 있었는데 그때 한국에서 온지 이틀되던날인가... 떡삼이 똥똘에게 부탁을 받고 길안내도 해줄겸.. 줄서서 이 할라를 먹게 해준적이 있는데 그 후로 중독(?) 되어.. 정말... ,5.0,"['재미있는', '고급진', '이국적', '친절하고', '깨끗한', '치킨', '길거리음식', '중동음식', '샌드위치', '양고기', '나들이', '신선한', '데이트', '재방문', '핫플레이스']"
할랄가이즈,[용산/ 이태원] 할랄가이즈,https://blog.naver.com/wishadream/221164782926,"뉴욕에서 그르케 핫하다는 할랄가이즈 인테리어할 적에 오픈한다고 현수막이 크게 걸렸을 때 부터, 미국 유학생이었던 리치님이 뉴욕에서 줄서먹는 푸드트럭이라고 기대치 업 시켜놓으셨다. 몇번 포장해서 스튜디오에서... ",5.0,"['재미있는', '고급진', '이국적', '친절하고', '깨끗한', '치킨', '길거리음식', '중동음식', '샌드위치', '양고기', '나들이', '신선한', '데이트', '재방문', '핫플레이스']"
할랄가이즈,[이태원] 할랄 가이즈 ...말랍*.*,https://blog.naver.com/hellopangx2/221158850542,#이태원맛집 #할랄가이즈 #할랄푸드 와... 이게 얼마만이야? 할랄 가이즈의 이태원 상륙!!!!!!! 을 이룬 후 우연히 지나가게된 이태원거리!! 약속이있어서 지나가는데 ㅋㅋㅋㅋㅋㅋㅋ 딱보였다... 이태원역 바로 근처에... ,5.0,"['재미있는', '고급진', '이국적', '친절하고', '깨끗한', '치킨', '길거리음식', '중동음식', '샌드위치', '양고기', '나들이', '신선한', '데이트', '재방문', '핫플레이스']"
할랄가이즈,[할랄가이즈][이태원]맛난데 먹기 핵불편,https://blog.naver.com/hgy0202/221178553276,할랄가이즈 말만 수백번 듣고 드디어 직접 가봐씀다 2출에서 도보 1~2분ㅎㅎ 역세권 ㄱㅇㄷ 에뛰드 건물 2층이에욤 올라가는 계단까지 이국줵 레스토랑부다는 패스트푸드 분위기라고 생각하시면 되겟슴니다아 무튼 창가... ,5.0,"['재미있는', '고급진', '이국적', '친절하고', '깨끗한', '치킨', '길거리음식', '중동음식', '샌드위치', '양고기', '나들이', '신선한', '데이트', '재방문', '핫플레이스']"
할랄가이즈,뉴욕 못 가는 아쉬움은 이태원에서 달래보기 '할랄가이즈',https://blog.naver.com/gonizea/221184305643,"22살 뉴욕 여행을 하면서 동아리 선배가 엄청 극찬을 해주던 푸드 트럭을 찾아갔다 무슨 ""무조건 먹어봐야 한다"" ""꼭 먹고 와야 한다"" ""안 먹으면 왕창 후회"" 등의 이야기를 듣고 간 터라 꼭 먹어야 겠다고 그 추운 겨울에 줄을... ",5.0,"['재미있는', '고급진', '이국적', '친절하고', '깨끗한', '치킨', '길거리음식', '중동음식', '샌드위치', '양고기', '나들이', '신선한', '데이트', '재방문', '핫플레이스']"
할랄가이즈,이태원 더 할랄가이즈. 뉴욕 스트릿푸드계의 신화 국내에 상륙하다,https://blog.naver.com/spring5867/220954613327,아메리카 대륙을 밟고 왔다면 누구나 안다는 할랄가이즈 꼭 외국에 나가지 않았더라도 여러 매체에서 간간히 이 이름을 들어본 적이 있을것입니다. 더 할랄가이즈(The Halal Guys) 뉴욕 한복판에서 선풍적인 인기를 끌며... ,5.0,"['재미있는', '고급진', '이국적', '친절하고', '깨끗한', '치킨', '길거리음식', '중동음식', '샌드위치', '양고기', '나들이', '신선한', '데이트', '재방문', '핫플레이스']"
할랄가이즈,이태원 할랄가이즈,https://blog.naver.com/bloodspear/221154858000,할랄가이즈 작년에 뉴욕 방문시 처음 접했던 할랄가이즈. 뉴욕 방문시 꼭 가봐야할 3대 맛집 중 하나로 꼽히기도 한다. 비주얼을 보고 실망해서 얼마나 맛있겠어라고 생각했다가 생각외로 너무나 맛있어서 놀랐던... ,5.0,"['재미있는', '고급진', '이국적', '친절하고', '깨끗한', '치킨', '길거리음식', '중동음식', '샌드위치', '양고기', '나들이', '신선한', '데이트', '재방문', '핫플레이스']"
할랄가이즈,이태원 점심 먹기좋은 곳 '할랄가이즈' 이태원 케밥 핫한 이태원 놀거리,https://blog.naver.com/msunh/221153542711,이태원 점심 먹기 좋은 곳 '할랄가이즈' 이태원 케밥 한핫 이태원 놀거리 뉴욕의 인기 푸드트럭 음식~ 할랄가이즈가 우리나라에도 상륙했다는 사실.... SNS에서도 인기 많은 할랄가이즈...다녀왔어요. 이태원역 2번출구로... ,5.0,"['재미있는', '고급진', '이국적', '친절하고', '깨끗한', '치킨', '길거리음식', '중동음식', '샌드위치', '양고기', '나들이', '신선한', '데이트', '재방문', '핫플레이스']"
할랄가이즈,이태원 할랄가이즈(the halal guys) 뉴욕 푸드트럭의 맛,https://blog.naver.com/kibi3/220924146836,"이태원 할랄가이즈 The Halal Guys 지금 뉴욕에서 가장 핫한 푸드트럭을 옮겨온 매장 (좌)치킨, (우)자이로(양고기) 뉴욕에서 지금 가장 핫한 푸드트럭, 할랄가이즈 이태원 1호점 오픈 2016년 12월 17일, 더 할랄가이즈가... ",5.0,"['재미있는', '고급진', '이국적', '친절하고', '깨끗한', '치킨', '길거리음식', '중동음식', '샌드위치', '양고기', '나들이', '신선한', '데이트', '재방문', '핫플레이스']"
할랄가이즈,이태원 가성비 좋은 이색 맛집 : The Halal Guys  할랄가이즈,https://blog.naver.com/dio0555/221797806591,이태원 할랄가이즈 영업시간 : 평일 11:00 - 22:00 금요일 11:00 - 04:00 토요일 11:00 - 04:00 일요일 11:00 - 22:00 날씨 좋은 평일날 기분전환 삼아 #이태원 에 방문했어요. 코로나 바이러스 탓인지 사람이 많이 없더라구요. 아 물론... ,5.0,"['재미있는', '고급진', '이국적', '친절하고', '깨끗한', '치킨', '길거리음식', '중동음식', '샌드위치', '양고기', '나들이', '신선한', '데이트', '재방문', '핫플레이스']"
할랄가이즈,[이태원] 할랄가이즈 메뉴. 저렴한 이태원 맛집 할랄가이즈.,https://blog.naver.com/qowldls4997/221786644111,외국인종업원 외국음악 외국인손님.. 내가 외국에 와있나 생각하게 만드는 이태원 할랄가이즈에 다녀왔어요. 식사시간은 아니었는데 배가 고파서 급 들어가게 되었어요. 찾아가실땐 이태원 역 옆에 위치하여 샛노란 간판이... ,5.0,"['재미있는', '고급진', '이국적', '친절하고', '깨끗한', '치킨', '길거리음식', '중동음식', '샌드위치', '양고기', '나들이', '신선한', '데이트', '재방문', '핫플레이스']"
할랄가이즈,이태원 가성비 음식점: 할랄 가이즈 솔직 후기,https://blog.naver.com/yjh9452/221785182050,안녕하세요~ 오랜만에 이태원을 놀러 갔다 왔어요. 너무 오랜만이라 어딜 가야 할지 고민하고 있을 때 할랄 가이즈가 맛집이라는 글이 많아 저도 한번 다녀왔습니다! 그럼 바로 시작할게요. 이태원역 2번 출구에서... ,5.0,"['재미있는', '고급진', '이국적', '친절하고', '깨끗한', '치킨', '길거리음식', '중동음식', '샌드위치', '양고기', '나들이', '신선한', '데이트', '재방문', '핫플레이스']"
할랄가이즈,이태원 할랄가이즈 & 카페 탄탈라이즈,https://blog.naver.com/thehitacc/221745032264,2019.10.21 할랄가이즈 이태원점 몇년전 뉴욕여행갈때 찾아본바로 핫하다는 푸드트럭이었는데 우리나라에도 매장이 있었음 ㅋㅋ 할랄가이즈 메뉴. 사이즈를 보여주는 그릇크기. 여기 갔던때가 할로윈 전이었는데 ㅋㅋ... ,5.0,"['재미있는', '고급진', '이국적', '친절하고', '깨끗한', '치킨', '길거리음식', '중동음식', '샌드위치', '양고기', '나들이', '신선한', '데이트', '재방문', '핫플레이스']"
할랄가이즈,New Year's Day,https://blog.naver.com/ztkaz/221756683166,새해가 밝았어요 이번년도에는 힘들었던 2019년 몫까지 많이 행복했으면 좋겠어요 Taylor Swift - New Year's Day 이 날은 서희 지수 이모들을 오랜만에 만난 날 In Itaewon 오자마자 할랄가이즈 안먹어본 이모들 먹여드렸다 이거... ,5.0,"['재미있는', '고급진', '이국적', '친절하고', '깨끗한', '치킨', '길거리음식', '중동음식', '샌드위치', '양고기', '나들이', '신선한', '데이트', '재방문', '핫플레이스']"
할랄가이즈,이태원에서 맛보는 뉴욕의 맛! 할랄가이즈- THE HALAL GUYS,https://blog.naver.com/kunst-lenben/221745710261,"안녕하세요! 쿤벤입니다 오늘은 이태원에 할랄가이즈를 다녀왔어요! 와우 진짜ㅠㅠㅠㅠ할랄가이즈 너무너무 먹고싶엇는데, 이태원에 있다니 너무 사랑해요 ㅋㅋㅋㅋㅋㅋㅋㅋㅋㅋㅋㅋ 엘에이에서 할랄가이즈 자주 먹고... ",5.0,"['재미있는', '고급진', '이국적', '친절하고', '깨끗한', '치킨', '길거리음식', '중동음식', '샌드위치', '양고기', '나들이', '신선한', '데이트', '재방문', '핫플레이스']"
할랄가이즈,이태원 맛집 추천 : 할랄가이즈 이태원점,https://blog.naver.com/kefron0220/221737103005,오늘은 이태원의 제 최애 맛집을 소개하려고 합니다! 불과 한 달 전까지만 해도 사람도 많이 없고 조용했는데... 얼마전에 정해인이 방송에서 언급하는 바람에... 지난 주말에 가보니 세상에 웨이팅이...! 바로 여기에요... ,5.0,"['재미있는', '고급진', '이국적', '친절하고', '깨끗한', '치킨', '길거리음식', '중동음식', '샌드위치', '양고기', '나들이', '신선한', '데이트', '재방문', '핫플레이스']"
할랄가이즈,[이태원] 가성비 갑 할랄가이즈,https://blog.naver.com/alicd6/221715260442,이태원에서 은빈이랑 연재를 만난 날 점심식사로 할랄가이즈를 갔다왔어요 원래 셋이만나면 항상 인스타맛집 같이 예쁜데를 자주 가려하는데 예쁜 곳이 실속 없 는곳이 워~~낙 많아가지고 가성비 갑이라고 유명한... ,5.0,"['재미있는', '고급진', '이국적', '친절하고', '깨끗한', '치킨', '길거리음식', '중동음식', '샌드위치', '양고기', '나들이', '신선한', '데이트', '재방문', '핫플레이스']"
할랄가이즈,이태원 할랄가이즈,https://blog.naver.com/eunji19733/221786791578,원래는 뉴욕에서 처음으로 할랄가이즈 맛 보고 싶었는데... 요즘 코로나 바이러스 한창 유행이고 또 인생계획이 살포시 와장창 바뀌어서 결국 이태원에서 먹게된 내 생의 첫 할랄가이즈~~ 레귤러 사이즈 치킨플래터와... ,5.0,"['재미있는', '고급진', '이국적', '친절하고', '깨끗한', '치킨', '길거리음식', '중동음식', '샌드위치', '양고기', '나들이', '신선한', '데이트', '재방문', '핫플레이스']"
할랄가이즈,[이태원] 할랄가이즈,https://blog.naver.com/ah_ouo/221782591494,할랄가이즈가 한국에 처음 들어왔을 때 가야지 하고 벼루다가 이제야 가봤다. 플래터 콤보로 시켰더니 고기 종류도 다양하고 양도 괜찮았다. 사워크림 듬뿍 해서 먹으면 정말 맛있다. 매운 소스는 조금만 달라고 해서... ,5.0,"['재미있는', '고급진', '이국적', '친절하고', '깨끗한', '치킨', '길거리음식', '중동음식', '샌드위치', '양고기', '나들이', '신선한', '데이트', '재방문', '핫플레이스']"
할랄가이즈,이태원,https://blog.naver.com/lm___lnh/221754545694,#이태원카페 #할랄가이즈 #이태원챔프 #챔프커피 #이태원맛집 #이태원혼밥 오랜만에 외출. 배고파서 할랄가이즈 갔다. 이태원역앞에 바로. 2층매장이고 창가석이 있어서 혼밥하기도 좋다 소스는 둘 다 조금씩! 흰소스... ,5.0,"['재미있는', '고급진', '이국적', '친절하고', '깨끗한', '치킨', '길거리음식', '중동음식', '샌드위치', '양고기', '나들이', '신선한', '데이트', '재방문', '핫플레이스']"
할랄가이즈,"이태원맛집, 할랄가이즈(Halal guys) 대한항공 기내식으로도 즐길... ",https://blog.naver.com/lujenny/221719429481,"이태원맛집, 할랄가이즈(Halal guys) 대한항공 기내식으로도 즐길 수 있어요 뉴요커들의 소울푸드라고 불리는 할랄 가이즈를 아시나요? 맨해튼에서만 먹을 수 있었던 할랄가이즈, 이태원에서도 먹을 수 있어요 더... ",5.0,"['재미있는', '고급진', '이국적', '친절하고', '깨끗한', '치킨', '길거리음식', '중동음식', '샌드위치', '양고기', '나들이', '신선한', '데이트', '재방문', '핫플레이스']"
할랄가이즈,"이태원 맛집 추천, 할랄가이즈 (위치/가격/메뉴)",https://blog.naver.com/lisa_lhw/221769286007,"할랄가이즈 오랜만에 할랄가이즈에 방문했어요 #할랄가이즈메뉴 #할랄가이즈가격 오랜만에 방문해도 여전한 맛, 맛있는 맛! 넘 맛있었어요 냠냠 둘이서 레귤러 한그릇 먹고 나왔어요 가끔 생각나는 맛 이태원가시면... ",5.0,"['재미있는', '고급진', '이국적', '친절하고', '깨끗한', '치킨', '길거리음식', '중동음식', '샌드위치', '양고기', '나들이', '신선한', '데이트', '재방문', '핫플레이스']"
